Standard_ID,Standard_Text,Subject,Grade_Level,Range,Interdisciplinary,Framework_Type,Adoption_Date,Source_URL
ELD.PII.4.7.Br,"Condense clauses in a variety of ways (e.g., through various types of embedded clauses and other ways of condensing as in, There was a Gold Rush. It began in the 1850s. It brought a lot of people to California. → The Gold Rush that began in the 1850s brought a lot of people to California) to create precise and detailed sentences.",English Language Development (2012-),Grade_04,,,California,2012,http://www.cde.ca.gov/sp/el/er/documents/eldstndspublication14.pdf
ELD.PII.4.7.Ex,"Condense clauses in an increasing variety of ways (e.g., through a growing number of embedded clauses and other condensing, as in, The dog ate quickly. The dog choked. → The dog ate so quickly that it choked) to create precise and detailed sentences.",English Language Development (2012-),Grade_04,,,California,2012,http://www.cde.ca.gov/sp/el/er/documents/eldstndspublication14.pdf
ELD.PII.4.7.Em,"Condense clauses in simple ways (e.g., through simple embedded clauses, as in, The woman is a doctor. She helps children. → The woman is a doctor who helps children) to create precise and detailed sentences.",English Language Development (2012-),Grade_04,,,California,2012,http://www.cde.ca.gov/sp/el/er/documents/eldstndspublication14.pdf
A5409DDD76E941BD805DBFCAA226C706,Condensing ideas,English Language Development (2012-),Grade_04,,,California,2012,http://www.cde.ca.gov/sp/el/er/documents/eldstndspublication14.pdf
ELD.PII.4.6.Br,"Combine clauses in a wide variety of ways (e.g., creating complex sentences using a variety of subordinate conjunctions) to make connections between and join ideas, for example, to express cause/effect (e.g., Since the lion was at the waterhole, the deer ran away), to make a concession, or to link two ideas that happen at the same time (e.g., The cubs played while their mother hunted).",English Language Development (2012-),Grade_04,,,California,2012,http://www.cde.ca.gov/sp/el/er/documents/eldstndspublication14.pdf
ELD.PII.4.6.Ex,"Combine clauses in an increasing variety of ways (e.g., creating complex sentences using familiar subordinate conjunctions) to make connections between and join ideas in sentences, for example, to express cause/effect (e.g., The deer ran because the mountain lion came) or to make a concession (e.g., She studied all night even though she wasn't feeling well).",English Language Development (2012-),Grade_04,,,California,2012,http://www.cde.ca.gov/sp/el/er/documents/eldstndspublication14.pdf
ELD.PII.4.6.Em,"Combine clauses in a few basic ways to make connections between and join ideas in sentences (e.g., creating compound sentences using coordinate conjunctions, such as and, but, so).",English Language Development (2012-),Grade_04,,,California,2012,http://www.cde.ca.gov/sp/el/er/documents/eldstndspublication14.pdf
1C21D1EFCA3A489C9B0263A35D9AC0C2,Connecting ideas,English Language Development (2012-),Grade_04,,,California,2012,http://www.cde.ca.gov/sp/el/er/documents/eldstndspublication14.pdf
0F3DF952F3FF482EA5ABEA3C21F92C17,Connecting and Condensing Ideas,English Language Development (2012-),Grade_04,,,California,2012,http://www.cde.ca.gov/sp/el/er/documents/eldstndspublication14.pdf
ELD.PII.4.5.Br,"Expand sentences with a variety of adverbials (e.g., adverbs, adverb phrases, prepositional phrases) to provide details (e.g., time, manner, place, cause, and so on) about a variety of familiar and new activities and processes (e.g., They worked quietly all night in their room).",English Language Development (2012-),Grade_04,,,California,2012,http://www.cde.ca.gov/sp/el/er/documents/eldstndspublication14.pdf
ELD.PII.4.5.Ex,"Expand sentences with a growing variety of adverbials (e.g., adverbs, prepositional phrases) to provide details (e.g., time, manner, place, cause, and so on) about a familiar or new activity or process (e.g., They worked quietly. They ran across the soccer field).",English Language Development (2012-),Grade_04,,,California,2012,http://www.cde.ca.gov/sp/el/er/documents/eldstndspublication14.pdf
ELD.PII.4.5.Em,"Expand sentences with familiar adverbials (e.g., basic prepositional phrases) to provide details (e.g., time, manner, place, cause, and so on) about a familiar activity or process (e.g., They walked to the soccer field).",English Language Development (2012-),Grade_04,,,California,2012,http://www.cde.ca.gov/sp/el/er/documents/eldstndspublication14.pdf
071A94636D444E389F199EF847E2D9F9,Modifying to add details,English Language Development (2012-),Grade_04,,,California,2012,http://www.cde.ca.gov/sp/el/er/documents/eldstndspublication14.pdf
ELD.PII.4.4.Br,"Expand noun phrases in an increasing variety of ways (e.g., adding general academic adjectives and adverbs to noun phrases or more complex clause embedding) in order to enrich the meaning of sentences and add details about ideas, people, things, and so on.",English Language Development (2012-),Grade_04,,,California,2012,http://www.cde.ca.gov/sp/el/er/documents/eldstndspublication14.pdf
ELD.PII.4.4.Ex,"Expand noun phrases in a variety of ways (e.g., adding adjectives to noun phrases or simple clause embedding) in order to enrich the meaning of sentences and add details about ideas, people, things, and so on.",English Language Development (2012-),Grade_04,,,California,2012,http://www.cde.ca.gov/sp/el/er/documents/eldstndspublication14.pdf
ELD.PII.4.4.Em,"Expand noun phrases in simple ways (e.g., adding an adjective) in order to enrich the meaning of sentences and add details about ideas, people, things, and so on.",English Language Development (2012-),Grade_04,,,California,2012,http://www.cde.ca.gov/sp/el/er/documents/eldstndspublication14.pdf
BF215AC831344E91BEB2E21EC6DC28EE,Using nouns and noun phrases,English Language Development (2012-),Grade_04,,,California,2012,http://www.cde.ca.gov/sp/el/er/documents/eldstndspublication14.pdf
ELD.PII.4.3.Br,"Use various verbs/verb types (e.g., doing, saying, being/having, thinking/feeling) and tenses appropriate to the task and text type (e.g., timeless present for science explanation, mixture of past and present for historical information report) for a variety of familiar and new topics.",English Language Development (2012-),Grade_04,,,California,2012,http://www.cde.ca.gov/sp/el/er/documents/eldstndspublication14.pdf
ELD.PII.4.3.Ex,"Use various verbs/verb types (e.g., doing, saying, being/having, thinking/feeling) and tenses appropriate to the task, text type, and discipline (e.g., simple past for retelling, timeless present for science explanation) for an increasing variety of familiar and new topics.",English Language Development (2012-),Grade_04,,,California,2012,http://www.cde.ca.gov/sp/el/er/documents/eldstndspublication14.pdf
ELD.PII.4.3.Em,"Use various verbs/verb types (e.g., doing, saying, being/having, thinking/feeling) and tenses appropriate to the text type and discipline (e.g., simple past for recounting an experience) for familiar topics.",English Language Development (2012-),Grade_04,,,California,2012,http://www.cde.ca.gov/sp/el/er/documents/eldstndspublication14.pdf
9940F2D6E74E4BE8B616A63388D8AB38,Using verbs and verb phrases,English Language Development (2012-),Grade_04,,,California,2012,http://www.cde.ca.gov/sp/el/er/documents/eldstndspublication14.pdf
96FF5A9760D94864B01386938B391DB8,Expanding and Enriching Ideas,English Language Development (2012-),Grade_04,,,California,2012,http://www.cde.ca.gov/sp/el/er/documents/eldstndspublication14.pdf
ELD.PII.4.2b.Br,"Apply increasing understanding of how ideas, events, or reasons are linked throughout a text using an increasing variety of academic connecting and transitional words or phrases (e.g., for instance, in addition, at the end) to comprehending texts and writing cohesive texts.",English Language Development (2012-),Grade_04,,,California,2012,http://www.cde.ca.gov/sp/el/er/documents/eldstndspublication14.pdf
ELD.PII.4.2a.Br,"Apply increasing understanding of language resources for referring the reader back or forward in text (e.g., how pronouns, synonyms, or nominalizations refer back to nouns in text) to comprehending texts and writing cohesive texts.",English Language Development (2012-),Grade_04,,,California,2012,http://www.cde.ca.gov/sp/el/er/documents/eldstndspublication14.pdf
ELD.PII.4.2b.Ex,"Apply growing understanding of how ideas, events, or reasons are linked throughout a text using a variety of connecting words or phrases (e.g., since, next, for example) to comprehending texts and writing texts with increasing cohesion.",English Language Development (2012-),Grade_04,,,California,2012,http://www.cde.ca.gov/sp/el/er/documents/eldstndspublication14.pdf
ELD.PII.4.2a.Ex,"Apply growing understanding of language resources for referring the reader back or forward in text (e.g., how pronouns or synonyms refer back to nouns in text) to comprehending texts and writing texts with increasing cohesion.",English Language Development (2012-),Grade_04,,,California,2012,http://www.cde.ca.gov/sp/el/er/documents/eldstndspublication14.pdf
ELD.PII.4.2b.Em,"Apply basic understanding of how ideas, events, or reasons are linked throughout a text using everyday connecting words or phrases (e.g., first, yesterday) to comprehending texts and writing basic texts.",English Language Development (2012-),Grade_04,,,California,2012,http://www.cde.ca.gov/sp/el/er/documents/eldstndspublication14.pdf
ELD.PII.4.2a.Em,"Apply basic understanding of language resources for referring the reader back or forward in text (e.g., how pronouns refer back to nouns in text) to comprehending texts and writing basic texts.",English Language Development (2012-),Grade_04,,,California,2012,http://www.cde.ca.gov/sp/el/er/documents/eldstndspublication14.pdf
25C74C386D1340F9BC3B895576211B14,Understanding cohesion,English Language Development (2012-),Grade_04,,,California,2012,http://www.cde.ca.gov/sp/el/er/documents/eldstndspublication14.pdf
ELD.PII.4.1.Br,"Apply understanding of how different text types are organized to express ideas (e.g., how a narrative is organized sequentially with predictable stages versus how opinions/arguments are structured logically, grouping related ideas) to comprehending texts and writing cohesive texts.",English Language Development (2012-),Grade_04,,,California,2012,http://www.cde.ca.gov/sp/el/er/documents/eldstndspublication14.pdf
ELD.PII.4.1.Ex,"Apply increasing understanding of how different text types are organized to express ideas (e.g., how a narrative is organized sequentially with predictable stages versus how an explanation is organized around ideas) to comprehending texts and writing texts with increasing cohesion.",English Language Development (2012-),Grade_04,,,California,2012,http://www.cde.ca.gov/sp/el/er/documents/eldstndspublication14.pdf
ELD.PII.4.1.Em,"Apply understanding of how different text types are organized to express ideas (e.g., how a narrative is organized sequentially) to comprehending texts and writing basic texts.",English Language Development (2012-),Grade_04,,,California,2012,http://www.cde.ca.gov/sp/el/er/documents/eldstndspublication14.pdf
E463E688977249B1BDAE12589AE134FF,Understanding text structure,English Language Development (2012-),Grade_04,,,California,2012,http://www.cde.ca.gov/sp/el/er/documents/eldstndspublication14.pdf
1A7879CAE12641B1BB47E46E4CBEC213,Structuring Cohesive Texts,English Language Development (2012-),Grade_04,,,California,2012,http://www.cde.ca.gov/sp/el/er/documents/eldstndspublication14.pdf
B87D7D93AF214BF88C14FF874A18E3CE,Learning About How English Works,English Language Development (2012-),Grade_04,,,California,2012,http://www.cde.ca.gov/sp/el/er/documents/eldstndspublication14.pdf
ELD.PI.4.12b.Br,"Select a variety of appropriate affixes for accuracy and precision (e.g., She's walking. I'm uncomfortable. They left reluctantly).",English Language Development (2012-),Grade_04,,,California,2012,http://www.cde.ca.gov/sp/el/er/documents/eldstndspublication14.pdf
ELD.PI.4.12a.Br,"Use a wide variety of general academic and domain-specific words, synonyms, antonyms, and figurative language to create precision and shades of meaning while speaking and writing.",English Language Development (2012-),Grade_04,,,California,2012,http://www.cde.ca.gov/sp/el/er/documents/eldstndspublication14.pdf
ELD.PI.4.12b.Ex,"Select a growing number of frequently used affixes for accuracy and precision (e.g., She walked. He likes…, I'm unhappy).",English Language Development (2012-),Grade_04,,,California,2012,http://www.cde.ca.gov/sp/el/er/documents/eldstndspublication14.pdf
ELD.PI.4.12a.Ex,"Use a growing number of general academic and domain-specific words, synonyms, and antonyms to create precision and shades of meaning while speaking and writing.",English Language Development (2012-),Grade_04,,,California,2012,http://www.cde.ca.gov/sp/el/er/documents/eldstndspublication14.pdf
ELD.PI.4.12b.Em,"Select a few frequently used affixes for accuracy and precision (e.g., She walks, I'm unhappy).",English Language Development (2012-),Grade_04,,,California,2012,http://www.cde.ca.gov/sp/el/er/documents/eldstndspublication14.pdf
ELD.PI.4.12a.Em,Use a select number of general academic and domain-specific words to create precision while speaking and writing.,English Language Development (2012-),Grade_04,,,California,2012,http://www.cde.ca.gov/sp/el/er/documents/eldstndspublication14.pdf
2EE0A32121F34609BD9C2A170777C191,Selecting and applying varied and precise vocabulary and language structures to effectively convey ideas,English Language Development (2012-),Grade_04,,,California,2012,http://www.cde.ca.gov/sp/el/er/documents/eldstndspublication14.pdf
ELD.PI.4.11b.Br,"Express attitude and opinions or temper statements with nuanced modal expressions (e.g., probably/certainly, should/would) and phrasing (e.g., In my opinion…).",English Language Development (2012-),Grade_04,,,California,2012,http://www.cde.ca.gov/sp/el/er/documents/eldstndspublication14.pdf
ELD.PI.4.11a.Br,"Support opinions or persuade others by expressing appropriate/accurate reasons using detailed textual evidence (e.g., quotations or specific events from text) or relevant background knowledge about content, with light support.",English Language Development (2012-),Grade_04,,,California,2012,http://www.cde.ca.gov/sp/el/er/documents/eldstndspublication14.pdf
ELD.PI.4.11b.Ex,"Express attitude and opinions or temper statements with familiar modal expressions (e.g., maybe/probably, can/must).",English Language Development (2012-),Grade_04,,,California,2012,http://www.cde.ca.gov/sp/el/er/documents/eldstndspublication14.pdf
ELD.PI.4.11a.Ex,"Support opinions or persuade others by expressing appropriate/accurate reasons using some textual evidence (e.g., paraphrasing facts) or relevant background knowledge about content, with moderate support.",English Language Development (2012-),Grade_04,,,California,2012,http://www.cde.ca.gov/sp/el/er/documents/eldstndspublication14.pdf
ELD.PI.4.11b.Em,"Express ideas and opinions or temper statements using basic modal expressions (e.g., can, will, maybe).",English Language Development (2012-),Grade_04,,,California,2012,http://www.cde.ca.gov/sp/el/er/documents/eldstndspublication14.pdf
ELD.PI.4.11a.Em,"Support opinions by expressing appropriate/accurate reasons using textual evidence (e.g., referring to text) or relevant background knowledge about content, with substantial support.",English Language Development (2012-),Grade_04,,,California,2012,http://www.cde.ca.gov/sp/el/er/documents/eldstndspublication14.pdf
F5F2D8352C614FC6BCED8C1AE28C3DA0,Supporting own opinions and evaluating others' opinions in speaking and writing,English Language Development (2012-),Grade_04,,,California,2012,http://www.cde.ca.gov/sp/el/er/documents/eldstndspublication14.pdf
ELD.PI.4.10b.Br,"Write clear and coherent summaries of texts and experiences using complete and concise sentences and key words (e.g., from notes or graphic organizers).",English Language Development (2012-),Grade_04,,,California,2012,http://www.cde.ca.gov/sp/el/er/documents/eldstndspublication14.pdf
ELD.PI.4.10a.Br,"Write longer and more detailed literary and informational texts (e.g., an explanatory text on how flashlights work) collaboratively (e.g., joint construction of texts with an adult or with peers) and independently using appropriate text organization and growing understanding of register.",English Language Development (2012-),Grade_04,,,California,2012,http://www.cde.ca.gov/sp/el/er/documents/eldstndspublication14.pdf
ELD.PI.4.10b.Ex,"Write increasingly concise summaries of texts and experiences using complete sentences and key words (e.g., from notes or graphic organizers).",English Language Development (2012-),Grade_04,,,California,2012,http://www.cde.ca.gov/sp/el/er/documents/eldstndspublication14.pdf
ELD.PI.4.10a.Ex,"Write longer literary and informational texts (e.g., an explanatory text on how flashlights work) collaboratively (e.g., joint construction of texts with an adult or with peers) and with increasing independence using appropriate text organization.",English Language Development (2012-),Grade_04,,,California,2012,http://www.cde.ca.gov/sp/el/er/documents/eldstndspublication14.pdf
ELD.PI.4.10b.Em,"Write brief summaries of texts and experiences using complete sentences and key words (e.g., from notes or graphic organizers).",English Language Development (2012-),Grade_04,,,California,2012,http://www.cde.ca.gov/sp/el/er/documents/eldstndspublication14.pdf
ELD.PI.4.10a.Em,"Write short literary and informational texts (e.g., a description of a flashlight) collaboratively (e.g., joint construction of texts with an adult or with peers) and sometimes independently.",English Language Development (2012-),Grade_04,,,California,2012,http://www.cde.ca.gov/sp/el/er/documents/eldstndspublication14.pdf
C6FE6FECAD3243E2ABAB0057C3F815A3,"Writing literary and informational texts to present, describe, and explain ideas and information, using appropriate technology",English Language Development (2012-),Grade_04,,,California,2012,http://www.cde.ca.gov/sp/el/er/documents/eldstndspublication14.pdf
ELD.PI.4.9.Br,"Plan and deliver oral presentations on a variety of topics in a variety of content areas (e.g., retelling a story, explaining a science process, reporting on a current event, recounting a memorable experience, and so on), with light support.",English Language Development (2012-),Grade_04,,,California,2012,http://www.cde.ca.gov/sp/el/er/documents/eldstndspublication14.pdf
ELD.PI.4.9.Ex,"Plan and deliver longer oral presentations on a variety of topics and content areas (e.g., retelling a story, explaining a science process, reporting on a current event, recounting a memorable experience, and so on), with moderate support.",English Language Development (2012-),Grade_04,,,California,2012,http://www.cde.ca.gov/sp/el/er/documents/eldstndspublication14.pdf
ELD.PI.4.9.Em,"Plan and deliver brief oral presentations on a variety of topics and content areas (e.g., retelling a story, explaining a science process, reporting on a current event, recounting a memorable experience, and so on), with substantial support.",English Language Development (2012-),Grade_04,,,California,2012,http://www.cde.ca.gov/sp/el/er/documents/eldstndspublication14.pdf
F2AAADC0551D404BA94381CEC9ED0B71,Expressing information and ideas in formal oral presentations on academic topics,English Language Development (2012-),Grade_04,,,California,2012,http://www.cde.ca.gov/sp/el/er/documents/eldstndspublication14.pdf
3572676B6BF14E009180EDDA349B0C07,Productive (creation of oral presentations and written texts),English Language Development (2012-),Grade_04,,,California,2012,http://www.cde.ca.gov/sp/el/er/documents/eldstndspublication14.pdf
ELD.PI.4.8.Br,"Distinguish how different words with related meanings (e.g., fun versus entertaining versus thrilling, possibly versus certainly) and figurative language produce shades of meaning and different effects on the audience.",English Language Development (2012-),Grade_04,,,California,2012,http://www.cde.ca.gov/sp/el/er/documents/eldstndspublication14.pdf
ELD.PI.4.8.Ex,"Distinguish how different words with similar meanings (e.g., describing a character as smart versus an expert) and figurative language (e.g., as big as a whale) produce shades of meaning and different effects on the audience.",English Language Development (2012-),Grade_04,,,California,2012,http://www.cde.ca.gov/sp/el/er/documents/eldstndspublication14.pdf
ELD.PI.4.8.Em,"Distinguish how different words with similar meanings produce different effects on the audience (e.g., describing a character's actions as whined versus said).",English Language Development (2012-),Grade_04,,,California,2012,http://www.cde.ca.gov/sp/el/er/documents/eldstndspublication14.pdf
312F2982AEA34224BCA7FBC76D22BE71,"Analyzing how writers and speakers use vocabulary and other language resources for specific purposes (to explain, persuade, entertain, etc.) depending on modality, text type, purpose, audience, topic, and content area",English Language Development (2012-),Grade_04,,,California,2012,http://www.cde.ca.gov/sp/el/er/documents/eldstndspublication14.pdf
ELD.PI.4.7.Br,"Describe how well writers and speakers use specific language resources to support an opinion or present an idea (e.g., the clarity or appealing nature of language used to present evidence), with prompting and light support.",English Language Development (2012-),Grade_04,,,California,2012,http://www.cde.ca.gov/sp/el/er/documents/eldstndspublication14.pdf
ELD.PI.4.7.Ex,"Describe how well writers or speakers use specific language resources to support an opinion or present an idea (e.g., whether the vocabulary or phrasing used to provide evidence is strong enough), with prompting and moderate support.",English Language Development (2012-),Grade_04,,,California,2012,http://www.cde.ca.gov/sp/el/er/documents/eldstndspublication14.pdf
ELD.PI.4.7.Em,"Describe the specific language writers or speakers use to present or support an idea (e.g., the specific vocabulary or phrasing used to provide evidence), with prompting and substantial support.",English Language Development (2012-),Grade_04,,,California,2012,http://www.cde.ca.gov/sp/el/er/documents/eldstndspublication14.pdf
F7E42DDFFF854AB88EC691CAA6F0A61F,"Evaluating how well writers and speakers use language to support ideas and opinions with details or reasons depending on modality, text type, purpose, audience, topic, and content area",English Language Development (2012-),Grade_04,,,California,2012,http://www.cde.ca.gov/sp/el/er/documents/eldstndspublication14.pdf
ELD.PI.4.6b.Br,"Use knowledge of morphology (e.g., affixes, roots, and base words) and linguistic context to determine the meaning of unknown and multiple-meaning words on familiar and new topics.",English Language Development (2012-),Grade_04,,,California,2012,http://www.cde.ca.gov/sp/el/er/documents/eldstndspublication14.pdf
ELD.PI.4.6a.Br,"Describe ideas, phenomena (e.g., pollination), and text elements (main idea, character traits, event sequence, and the like) in detail based on close reading of a variety of grade-level texts, with light support.",English Language Development (2012-),Grade_04,,,California,2012,http://www.cde.ca.gov/sp/el/er/documents/eldstndspublication14.pdf
ELD.PI.4.6b.Ex,"Use knowledge of morphology (e.g., affixes, roots, and base words), linguistic context, and reference materials to determine the meaning of unknown words on familiar topics.",English Language Development (2012-),Grade_04,,,California,2012,http://www.cde.ca.gov/sp/el/er/documents/eldstndspublication14.pdf
ELD.PI.4.6a.Ex,"Describe ideas, phenomena (e.g., animal migration), and text elements (main idea, central message, and the like) in greater detail based on close reading of a variety of grade-level texts, with moderate support.",English Language Development (2012-),Grade_04,,,California,2012,http://www.cde.ca.gov/sp/el/er/documents/eldstndspublication14.pdf
ELD.PI.4.6b.Em,"Use knowledge of frequently used affixes (e.g., un-, mis-) and linguistic context, reference materials, and visual cues to determine the meaning of unknown words on familiar topics.",English Language Development (2012-),Grade_04,,,California,2012,http://www.cde.ca.gov/sp/el/er/documents/eldstndspublication14.pdf
ELD.PI.4.6a.Em,"Describe ideas, phenomena (e.g., volcanic eruptions), and text elements (main idea, characters, events, and the like) based on close reading of a select set of grade-level texts, with substantial support.",English Language Development (2012-),Grade_04,,,California,2012,http://www.cde.ca.gov/sp/el/er/documents/eldstndspublication14.pdf
3F4646F85E454F468B9D64305F2C8B9A,Reading closely literary and informational texts and viewing multimedia to determine how meaning is conveyed explicitly and implicitly through language,English Language Development (2012-),Grade_04,,,California,2012,http://www.cde.ca.gov/sp/el/er/documents/eldstndspublication14.pdf
ELD.PI.4.5.Br,"Demonstrate active listening of read-alouds and oral presentations by asking and answering detailed questions, with minimal prompting and light support.",English Language Development (2012-),Grade_04,,,California,2012,http://www.cde.ca.gov/sp/el/er/documents/eldstndspublication14.pdf
ELD.PI.4.5.Ex,"Demonstrate active listening of read-alouds and oral presentations by asking and answering detailed questions, with occasional prompting and moderate support.",English Language Development (2012-),Grade_04,,,California,2012,http://www.cde.ca.gov/sp/el/er/documents/eldstndspublication14.pdf
