Standard_ID,Standard_Text,Subject,Grade_Level,Range,Interdisciplinary,Framework_Type,Adoption_Date,Source_URL
W.4.1a,"Introduce a topic or text clearly, state an opinion, and create an organizational structure in which related ideas are grouped to support the writer's purpose.",English Language Arts & Literacy (2010-),Grade_04,,English Language Arts,California,2010,http://www.cde.ca.gov/be/st/ss/documents/finalelaccssstandards.pdf
W.4.1,"Write opinion pieces on topics or texts, supporting a point of view with reasons and information",English Language Arts & Literacy (2010-),Grade_04,,English Language Arts,California,2010,http://www.cde.ca.gov/be/st/ss/documents/finalelaccssstandards.pdf
E43BEE28F69542A2BBD59C31AFEE464F,Text Types and Purposes,English Language Arts & Literacy (2010-),Grade_04,,English Language Arts,California,2010,http://www.cde.ca.gov/be/st/ss/documents/finalelaccssstandards.pdf
5B526BDFE4EF459186CE39EF02FA8BC5,Writing Standards,English Language Arts & Literacy (2010-),Grade_04,,English Language Arts,California,2010,http://www.cde.ca.gov/be/st/ss/documents/finalelaccssstandards.pdf
W.CCR.10,"Write routinely over extended time frames (time for research, reflection, and revision) and shorter time frames (a single sitting or a day or two) for a range of tasks, purposes, and audiences.",English Language Arts & Literacy (2010-),Grade_04,,English Language Arts,California,2010,http://www.cde.ca.gov/be/st/ss/documents/finalelaccssstandards.pdf
AE4CD46097D546F8A8666CA3F1B7C102,Range of Writing,English Language Arts & Literacy (2010-),Grade_04,,English Language Arts,California,2010,http://www.cde.ca.gov/be/st/ss/documents/finalelaccssstandards.pdf
W.CCR.9,"Draw evidence from literary or informational texts to support analysis, reflection, and research.",English Language Arts & Literacy (2010-),Grade_04,,English Language Arts,California,2010,http://www.cde.ca.gov/be/st/ss/documents/finalelaccssstandards.pdf
W.CCR.8,"Gather relevant information from multiple print and digital sources, assess the credibility and accuracy of each source, and integrate the information while avoiding plagiarism.",English Language Arts & Literacy (2010-),Grade_04,,English Language Arts,California,2010,http://www.cde.ca.gov/be/st/ss/documents/finalelaccssstandards.pdf
W.CCR.7,"Conduct short as well as more sustained research projects based on focused questions, demonstrating understanding of the subject under investigation.",English Language Arts & Literacy (2010-),Grade_04,,English Language Arts,California,2010,http://www.cde.ca.gov/be/st/ss/documents/finalelaccssstandards.pdf
1DE0FA2A234944B6B11D9CD381E644AC,Research to Build and Present Knowledge,English Language Arts & Literacy (2010-),Grade_04,,English Language Arts,California,2010,http://www.cde.ca.gov/be/st/ss/documents/finalelaccssstandards.pdf
W.CCR.6,"Use technology, including the Internet, to produce and publish writing and to interact and collaborate with others.",English Language Arts & Literacy (2010-),Grade_04,,English Language Arts,California,2010,http://www.cde.ca.gov/be/st/ss/documents/finalelaccssstandards.pdf
W.CCR.5,"Develop and strengthen writing as needed by planning, revising, editing, rewriting, or trying a new approach.",English Language Arts & Literacy (2010-),Grade_04,,English Language Arts,California,2010,http://www.cde.ca.gov/be/st/ss/documents/finalelaccssstandards.pdf
W.CCR.4,"Produce clear and coherent writing in which the development, organization, and style are appropriate to task, purpose, and audience.",English Language Arts & Literacy (2010-),Grade_04,,English Language Arts,California,2010,http://www.cde.ca.gov/be/st/ss/documents/finalelaccssstandards.pdf
309509CB61DB4342A5805C9B36747884,Production and Distribution of Writing,English Language Arts & Literacy (2010-),Grade_04,,English Language Arts,California,2010,http://www.cde.ca.gov/be/st/ss/documents/finalelaccssstandards.pdf
W.CCR.3,"Write narratives to develop real or imagined experiences or events using effective technique, well-chosen details, and well-structured event sequences.",English Language Arts & Literacy (2010-),Grade_04,,English Language Arts,California,2010,http://www.cde.ca.gov/be/st/ss/documents/finalelaccssstandards.pdf
W.CCR.2,"Write informative/explanatory texts to examine and convey complex ideas and information clearly and accurately through the effective selection, organization, and analysis of content.",English Language Arts & Literacy (2010-),Grade_04,,English Language Arts,California,2010,http://www.cde.ca.gov/be/st/ss/documents/finalelaccssstandards.pdf
W.CCR.1,"Write arguments to support claims in an analysis of substantive topics or texts, using valid reasoning and relevant and sufficient evidence.",English Language Arts & Literacy (2010-),Grade_04,,English Language Arts,California,2010,http://www.cde.ca.gov/be/st/ss/documents/finalelaccssstandards.pdf
BFFC5E2C89534751B4DC5E45D9F8DAD5,Text Types and Purposes,English Language Arts & Literacy (2010-),Grade_04,,English Language Arts,California,2010,http://www.cde.ca.gov/be/st/ss/documents/finalelaccssstandards.pdf
B58AA1DCF2304F458ECCB3D1AFACBC5E,College and Career Readiness Anchor Standards for Writing,English Language Arts & Literacy (2010-),Grade_04,,English Language Arts,California,2010,http://www.cde.ca.gov/be/st/ss/documents/finalelaccssstandards.pdf
RF.4.4c,"Use context to confirm or self-correct word recognition and understanding, rereading as necessary.",English Language Arts & Literacy (2010-),Grade_04,,English Language Arts,California,2010,http://www.cde.ca.gov/be/st/ss/documents/finalelaccssstandards.pdf
RF.4.4b,"Read on-level prose and poetry orally with accuracy, appropriate rate, and expression on successive readings",English Language Arts & Literacy (2010-),Grade_04,,English Language Arts,California,2010,http://www.cde.ca.gov/be/st/ss/documents/finalelaccssstandards.pdf
RF.4.4a,Read on-level text with purpose and understanding.,English Language Arts & Literacy (2010-),Grade_04,,English Language Arts,California,2010,http://www.cde.ca.gov/be/st/ss/documents/finalelaccssstandards.pdf
RF.4.4,Read with sufficient accuracy and fluency to support comprehension.,English Language Arts & Literacy (2010-),Grade_04,,English Language Arts,California,2010,http://www.cde.ca.gov/be/st/ss/documents/finalelaccssstandards.pdf
B9682E2BFD66472E9884FFDBDE18AB95,Fluency,English Language Arts & Literacy (2010-),Grade_04,,English Language Arts,California,2010,http://www.cde.ca.gov/be/st/ss/documents/finalelaccssstandards.pdf
RF.4.3a,"Use combined knowledge of all letter-sound correspondences, syllabication patterns, and morphology (e.g., roots and affixes) to read accurately unfamiliar multisyllabic words in context and out of context.",English Language Arts & Literacy (2010-),Grade_04,,English Language Arts,California,2010,http://www.cde.ca.gov/be/st/ss/documents/finalelaccssstandards.pdf
RF.4.3,Know and apply grade-level phonics and word analysis skills in decoding words.,English Language Arts & Literacy (2010-),Grade_04,,English Language Arts,California,2010,http://www.cde.ca.gov/be/st/ss/documents/finalelaccssstandards.pdf
8E85EAE434B143C3BD5049844F45EDFE,Phonics and Word Recognition,English Language Arts & Literacy (2010-),Grade_04,,English Language Arts,California,2010,http://www.cde.ca.gov/be/st/ss/documents/finalelaccssstandards.pdf
86B78B257CA34CCBA8C32814729031FB,Reading Standards: Foundational Skills,English Language Arts & Literacy (2010-),Grade_04,,English Language Arts,California,2010,http://www.cde.ca.gov/be/st/ss/documents/finalelaccssstandards.pdf
RI.4.10,"By the end of year, read and comprehend informational texts, including history/social studies, science, and technical texts, in the grades 4—5 text complexity band proficiently, with scaffolding as needed at the high end of the range.",English Language Arts & Literacy (2010-),Grade_04,,English Language Arts,California,2010,http://www.cde.ca.gov/be/st/ss/documents/finalelaccssstandards.pdf
4FAF2ED79834440E8058DE72AED0A839,Range of Reading and Level of Text Complexity,English Language Arts & Literacy (2010-),Grade_04,,English Language Arts,California,2010,http://www.cde.ca.gov/be/st/ss/documents/finalelaccssstandards.pdf
RI.4.9,Integrate information from two texts on the same topic in order to write or speak about the subject knowledgeably.,English Language Arts & Literacy (2010-),Grade_04,,English Language Arts,California,2010,http://www.cde.ca.gov/be/st/ss/documents/finalelaccssstandards.pdf
RI.4.8,Explain how an author uses reasons and evidence to support particular points in a text.,English Language Arts & Literacy (2010-),Grade_04,,English Language Arts,California,2010,http://www.cde.ca.gov/be/st/ss/documents/finalelaccssstandards.pdf
RI.4.7,"Interpret information presented visually, orally, or quantitatively (e.g., in charts, graphs, diagrams, time lines, animations, or interactive elements on Web pages) and explain how the information contributes to an understanding of the text in which it appears.",English Language Arts & Literacy (2010-),Grade_04,,English Language Arts,California,2010,http://www.cde.ca.gov/be/st/ss/documents/finalelaccssstandards.pdf
DF291724D71F450690A86878E3175F13,Integration of Knowledge and Ideas,English Language Arts & Literacy (2010-),Grade_04,,English Language Arts,California,2010,http://www.cde.ca.gov/be/st/ss/documents/finalelaccssstandards.pdf
RI.4.6,Compare and contrast a firsthand and secondhand account of the same event or topic; describe the differences in focus and the information provided.,English Language Arts & Literacy (2010-),Grade_04,,English Language Arts,California,2010,http://www.cde.ca.gov/be/st/ss/documents/finalelaccssstandards.pdf
RI.4.5,"Describe the overall structure (e.g., chronology, comparison, cause/effect, problem/solution) of events, ideas, concepts, or information in a text or part of a text.",English Language Arts & Literacy (2010-),Grade_04,,English Language Arts,California,2010,http://www.cde.ca.gov/be/st/ss/documents/finalelaccssstandards.pdf
RI.4.4,Determine the meaning of general academic and domain-specific words or phrases in a text relevant to a grade 4 topic or subject area. (See grade 4 Language standards 4–6 for additional expectations.),English Language Arts & Literacy (2010-),Grade_04,,English Language Arts,California,2010,http://www.cde.ca.gov/be/st/ss/documents/finalelaccssstandards.pdf
CACFADF5171748119546EAFD898BAF37,Craft and Structure,English Language Arts & Literacy (2010-),Grade_04,,English Language Arts,California,2010,http://www.cde.ca.gov/be/st/ss/documents/finalelaccssstandards.pdf
RI.4.3,"Explain events, procedures, ideas, or concepts in a historical, scientific, or technical text, including what happened and why, based on specific information in the text.",English Language Arts & Literacy (2010-),Grade_04,,English Language Arts,California,2010,http://www.cde.ca.gov/be/st/ss/documents/finalelaccssstandards.pdf
RI.4.2,Determine the main idea of a text and explain how it is supported by key details; summarize the text.,English Language Arts & Literacy (2010-),Grade_04,,English Language Arts,California,2010,http://www.cde.ca.gov/be/st/ss/documents/finalelaccssstandards.pdf
RI.4.1,Refer to details and examples in a text when explaining what the text says explicitly and when drawing inferences from the text.,English Language Arts & Literacy (2010-),Grade_04,,English Language Arts,California,2010,http://www.cde.ca.gov/be/st/ss/documents/finalelaccssstandards.pdf
DBB07F1CF6424C549372E184A4A0C854,Key Ideas and Details,English Language Arts & Literacy (2010-),Grade_04,,English Language Arts,California,2010,http://www.cde.ca.gov/be/st/ss/documents/finalelaccssstandards.pdf
9989F9362A314C50A37933DA82992EAD,Reading Standards for Informational Text,English Language Arts & Literacy (2010-),Grade_04,,English Language Arts,California,2010,http://www.cde.ca.gov/be/st/ss/documents/finalelaccssstandards.pdf
RL.4.10,"By the end of the year, read and comprehend literature, including stories, dramas, and poetry, in the grades 4—5 text complexity band proficiently, with scaffolding as needed at the high end of the range.",English Language Arts & Literacy (2010-),Grade_04,,English Language Arts,California,2010,http://www.cde.ca.gov/be/st/ss/documents/finalelaccssstandards.pdf
0D2856964E544D2C82FF7C20D1D7666E,Range of Reading and Level of Text Complexity,English Language Arts & Literacy (2010-),Grade_04,,English Language Arts,California,2010,http://www.cde.ca.gov/be/st/ss/documents/finalelaccssstandards.pdf
RL.4.9,"Compare and contrast the treatment of similar themes and topics (e.g., opposition of good and evil) and patterns of events (e.g., the quest) in stories, myths, and traditional literature from different cultures.",English Language Arts & Literacy (2010-),Grade_04,,English Language Arts,California,2010,http://www.cde.ca.gov/be/st/ss/documents/finalelaccssstandards.pdf
6CCBC3934C0E463DB89708A08EFD80CD,(Not applicable to literature),English Language Arts & Literacy (2010-),Grade_04,,English Language Arts,California,2010,http://www.cde.ca.gov/be/st/ss/documents/finalelaccssstandards.pdf
RL.4.7,"Make connections between the text of a story or drama and a visual or oral presentation of the text, identifying where each version reflects specific descriptions and directions in the text.",English Language Arts & Literacy (2010-),Grade_04,,English Language Arts,California,2010,http://www.cde.ca.gov/be/st/ss/documents/finalelaccssstandards.pdf
4541CB29AD7F4C6084235BBEB731CBBA,Integration of Knowledge and Ideas,English Language Arts & Literacy (2010-),Grade_04,,English Language Arts,California,2010,http://www.cde.ca.gov/be/st/ss/documents/finalelaccssstandards.pdf
RL.4.6,"Compare and contrast the point of view from which different stories are narrated, including the difference between first- and third-person narrations.",English Language Arts & Literacy (2010-),Grade_04,,English Language Arts,California,2010,http://www.cde.ca.gov/be/st/ss/documents/finalelaccssstandards.pdf
RL.4.5,"Explain major differences between poems, drama, and prose, and refer to the structural elements of poems (e.g., verse, rhythm, meter) and drama (e.g., casts of characters, settings, descriptions, dialogue, stage directions) when writing or speaking about a text.",English Language Arts & Literacy (2010-),Grade_04,,English Language Arts,California,2010,http://www.cde.ca.gov/be/st/ss/documents/finalelaccssstandards.pdf
RL.4.4,"Determine the meaning of words and phrases as they are used in a text, including those that allude to significant characters found in mythology (e.g., Herculean). (See grade 4 Language standards 4–6 for additional expectations.)",English Language Arts & Literacy (2010-),Grade_04,,English Language Arts,California,2010,http://www.cde.ca.gov/be/st/ss/documents/finalelaccssstandards.pdf
BDDEC5BD701742DE96C9DD381B2E8F2A,Craft and Structure,English Language Arts & Literacy (2010-),Grade_04,,English Language Arts,California,2010,http://www.cde.ca.gov/be/st/ss/documents/finalelaccssstandards.pdf
RL.4.3,"Describe in depth a character, setting, or event in a story or drama, drawing on specific details in the text (e.g., a character's thoughts, words, or actions).",English Language Arts & Literacy (2010-),Grade_04,,English Language Arts,California,2010,http://www.cde.ca.gov/be/st/ss/documents/finalelaccssstandards.pdf
RL.4.2,"Determine a theme of a story, drama, or poem from details in the text; summarize the text.",English Language Arts & Literacy (2010-),Grade_04,,English Language Arts,California,2010,http://www.cde.ca.gov/be/st/ss/documents/finalelaccssstandards.pdf
RL.4.1,Refer to details and examples in a text when explaining what the text says explicitly and when drawing inferences from the text.,English Language Arts & Literacy (2010-),Grade_04,,English Language Arts,California,2010,http://www.cde.ca.gov/be/st/ss/documents/finalelaccssstandards.pdf
62E566ADCF30476F81DE0AD92DDDF15F,Key Ideas and Details,English Language Arts & Literacy (2010-),Grade_04,,English Language Arts,California,2010,http://www.cde.ca.gov/be/st/ss/documents/finalelaccssstandards.pdf
651DDDF344014167A04D45D33C467145,Reading Standards for Literature,English Language Arts & Literacy (2010-),Grade_04,,English Language Arts,California,2010,http://www.cde.ca.gov/be/st/ss/documents/finalelaccssstandards.pdf
R.CCR.10,Read and comprehend complex literary and informational texts independently and proficiently.,English Language Arts & Literacy (2010-),Grade_04,,English Language Arts,California,2010,http://www.cde.ca.gov/be/st/ss/documents/finalelaccssstandards.pdf
7207A377ACA94DC9A9DA159CAF82D7D5,Range of Reading and Level of Text Complexity,English Language Arts & Literacy (2010-),Grade_04,,English Language Arts,California,2010,http://www.cde.ca.gov/be/st/ss/documents/finalelaccssstandards.pdf
R.CCR.9,Analyze how two or more texts address similar themes or topics in order to build knowledge or to compare the approaches the authors take.,English Language Arts & Literacy (2010-),Grade_04,,English Language Arts,California,2010,http://www.cde.ca.gov/be/st/ss/documents/finalelaccssstandards.pdf
R.CCR.8,"Delineate and evaluate the argument and specific claims in a text, including the validity of the reasoning as well as the relevance and sufficiency of the evidence.",English Language Arts & Literacy (2010-),Grade_04,,English Language Arts,California,2010,http://www.cde.ca.gov/be/st/ss/documents/finalelaccssstandards.pdf
R.CCR.7,"Integrate and evaluate content presented in diverse media and formats, including visually and quantitatively, as well as in words.",English Language Arts & Literacy (2010-),Grade_04,,English Language Arts,California,2010,http://www.cde.ca.gov/be/st/ss/documents/finalelaccssstandards.pdf
B16B7366141E44468E66816DE200FA79,Integration of Knowledge and Ideas,English Language Arts & Literacy (2010-),Grade_04,,English Language Arts,California,2010,http://www.cde.ca.gov/be/st/ss/documents/finalelaccssstandards.pdf
R.CCR.6,Assess how point of view or purpose shapes the content and style of a text.,English Language Arts & Literacy (2010-),Grade_04,,English Language Arts,California,2010,http://www.cde.ca.gov/be/st/ss/documents/finalelaccssstandards.pdf
R.CCR.5,"Analyze the structure of texts, including how specific sentences, paragraphs, and larger portions of the text (e.g., a section, chapter, scene, or stanza) relate to each other and the whole.",English Language Arts & Literacy (2010-),Grade_04,,English Language Arts,California,2010,http://www.cde.ca.gov/be/st/ss/documents/finalelaccssstandards.pdf
R.CCR.4,"Interpret words and phrases as they are used in a text, including determining technical, connotative, and figurative meanings, and analyze how specific word choices shape meaning or tone.",English Language Arts & Literacy (2010-),Grade_04,,English Language Arts,California,2010,http://www.cde.ca.gov/be/st/ss/documents/finalelaccssstandards.pdf
EE4C00073AED4B91BE188EAD47029D15,Craft and Structure,English Language Arts & Literacy (2010-),Grade_04,,English Language Arts,California,2010,http://www.cde.ca.gov/be/st/ss/documents/finalelaccssstandards.pdf
R.CCR.3,"Analyze how and why individuals, events, and ideas develop and interact over the course of a text.",English Language Arts & Literacy (2010-),Grade_04,,English Language Arts,California,2010,http://www.cde.ca.gov/be/st/ss/documents/finalelaccssstandards.pdf
R.CCR.2,Determine central ideas or themes of a text and analyze their development; summarize the key supporting details and ideas.,English Language Arts & Literacy (2010-),Grade_04,,English Language Arts,California,2010,http://www.cde.ca.gov/be/st/ss/documents/finalelaccssstandards.pdf
R.CCR.1,Read closely to determine what the text says explicitly and to make logical inferences from it; cite specific textual evidence when writing or speaking to support conclusions drawn from the text.,English Language Arts & Literacy (2010-),Grade_04,,English Language Arts,California,2010,http://www.cde.ca.gov/be/st/ss/documents/finalelaccssstandards.pdf
7EB84CE28F5F40A1ADA6601609E2F197,Key Ideas and Details,English Language Arts & Literacy (2010-),Grade_04,,English Language Arts,California,2010,http://www.cde.ca.gov/be/st/ss/documents/finalelaccssstandards.pdf
35A5FA4BE7C54FC8BEAFA06C5D2279DE,College and Career Readiness Anchor Standards for Reading,English Language Arts & Literacy (2010-),Grade_04,,English Language Arts,California,2010,http://www.cde.ca.gov/be/st/ss/documents/finalelaccssstandards.pdf
