Standard_ID,Standard_Text,Subject,Grade_Level,Range,Interdisciplinary,Framework_Type,Adoption_Date,Source_URL
ELD.PI.4.5.Em,"Demonstrate active listening of read-alouds and oral presentations by asking and answering basic questions, with prompting and substantial support.",English Language Development (2012-),Grade_04,,,California,2012,http://www.cde.ca.gov/sp/el/er/documents/eldstndspublication14.pdf
7120AAAC004043DCB360499065DC4563,Listening actively to spoken English in a range of social and academic contexts,English Language Development (2012-),Grade_04,,,California,2012,http://www.cde.ca.gov/sp/el/er/documents/eldstndspublication14.pdf
49DB0C748C6D43C5A302104BCA403ACE,Interpretive (comprehension and analysis of written and spoken texts),English Language Development (2012-),Grade_04,,,California,2012,http://www.cde.ca.gov/sp/el/er/documents/eldstndspublication14.pdf
ELD.PI.4.4.Br,"Adjust language choices according to purpose, task (e.g., facilitating a science experiment), and audience, with light support.",English Language Development (2012-),Grade_04,,,California,2012,http://www.cde.ca.gov/sp/el/er/documents/eldstndspublication14.pdf
ELD.PI.4.4.Ex,"Adjust language choices according to purpose (e.g., persuading, entertaining), task (e.g., telling a story versus explaining a science experiment), and audience, with moderate support.",English Language Development (2012-),Grade_04,,,California,2012,http://www.cde.ca.gov/sp/el/er/documents/eldstndspublication14.pdf
ELD.PI.4.4.Em,"Adjust language choices according to social setting (e.g., playground, classroom) and audience (e.g., peers, teacher), with substantial support.",English Language Development (2012-),Grade_04,,,California,2012,http://www.cde.ca.gov/sp/el/er/documents/eldstndspublication14.pdf
7C9353EA65A54129B8F56D48A4BD1DE5,"Adapting language choices to various contexts (based on task, purpose, audience, and text type)",English Language Development (2012-),Grade_04,,,California,2012,http://www.cde.ca.gov/sp/el/er/documents/eldstndspublication14.pdf
ELD.PI.4.3.Br,"Negotiate with or persuade others in conversations using a variety of learned phrases (e.g., That's a good idea. However…), as well as open responses, in order to gain and/or hold the floor, provide counterarguments, elaborate on an idea, and so on.",English Language Development (2012-),Grade_04,,,California,2012,http://www.cde.ca.gov/sp/el/er/documents/eldstndspublication14.pdf
ELD.PI.4.3.Ex,"Negotiate with or persuade others in conversations using an expanded set of learned phrases (e.g., I agree with X, but…), as well as open responses, in order to gain and/or hold the floor, provide counterarguments, and so on.",English Language Development (2012-),Grade_04,,,California,2012,http://www.cde.ca.gov/sp/el/er/documents/eldstndspublication14.pdf
ELD.PI.4.3.Em,"Negotiate with or persuade others in conversations using basic learned phrases (e.g., I think…), as well as open responses, in order to gain and/or hold the floor.",English Language Development (2012-),Grade_04,,,California,2012,http://www.cde.ca.gov/sp/el/er/documents/eldstndspublication14.pdf
877DADDB6DDA4056B0E32F1BDFDC5701,Offering and supporting opinions and negotiating with others in communicative exchanges,English Language Development (2012-),Grade_04,,,California,2012,http://www.cde.ca.gov/sp/el/er/documents/eldstndspublication14.pdf
ELD.PI.4.2.Br,"Collaborate with peers on joint writing projects of a variety of longer informational and literary texts, using technology where appropriate for publishing, graphics, and the like.",English Language Development (2012-),Grade_04,,,California,2012,http://www.cde.ca.gov/sp/el/er/documents/eldstndspublication14.pdf
ELD.PI.4.2.Ex,"Collaborate with peers on joint writing projects of longer informational and literary texts, using technology where appropriate for publishing, graphics, and the like.",English Language Development (2012-),Grade_04,,,California,2012,http://www.cde.ca.gov/sp/el/er/documents/eldstndspublication14.pdf
ELD.PI.4.2.Em,"Collaborate with peers on joint writing projects of short informational and literary texts, using technology where appropriate for publishing, graphics, and the like.",English Language Development (2012-),Grade_04,,,California,2012,http://www.cde.ca.gov/sp/el/er/documents/eldstndspublication14.pdf
07AA57693EE346D1A66A77828D41B893,"Interacting with others in written English in various communicative forms (print, communicative technology, and multimedia)",English Language Development (2012-),Grade_04,,,California,2012,http://www.cde.ca.gov/sp/el/er/documents/eldstndspublication14.pdf
ELD.PI.4.1.Br,"Contribute to class, group, and partner discussions, including sustained dialogue, by following turn-taking rules, asking relevant questions, affirming others, adding relevant information, building on responses, and providing useful feedback.",English Language Development (2012-),Grade_04,,,California,2012,http://www.cde.ca.gov/sp/el/er/documents/eldstndspublication14.pdf
ELD.PI.4.1.Ex,"Contribute to class, group, and partner discussions, including sustained dialogue, by following turn-taking rules, asking relevant questions, affirming others, and adding relevant information.",English Language Development (2012-),Grade_04,,,California,2012,http://www.cde.ca.gov/sp/el/er/documents/eldstndspublication14.pdf
ELD.PI.4.1.Em,Contribute to conversations and express ideas by asking and answering yes-no and wh- questions and responding using short phrases.,English Language Development (2012-),Grade_04,,,California,2012,http://www.cde.ca.gov/sp/el/er/documents/eldstndspublication14.pdf
CA06CAFB8D6943128EE0087361EA9DD2,Exchanging information and ideas with others through oral collaborative conversations on a range of social and academic topics,English Language Development (2012-),Grade_04,,,California,2012,http://www.cde.ca.gov/sp/el/er/documents/eldstndspublication14.pdf
F45A1B064A5F44EAB337C440EABA2E80,Collaborative (engagement in dialogue with others),English Language Development (2012-),Grade_04,,,California,2012,http://www.cde.ca.gov/sp/el/er/documents/eldstndspublication14.pdf
993DE14D74B3450DAE2ED9F580A57576,Interacting in Meaningful Ways,English Language Development (2012-),Grade_04,,,California,2012,http://www.cde.ca.gov/sp/el/er/documents/eldstndspublication14.pdf
