Standard_ID,Standard_Text,Subject,Grade_Level,Range,Interdisciplinary,Framework_Type,Adoption_Date,Source_URL
RF.K.2d,"Isolate and pronounce the initial, medial vowel, and final sounds (phonemes) in three-phoneme (consonent-vowel-consonent, or CVC) words. (This does not include CVCs ending with /l/, /r/, or /x/.)",English Language Arts & Literacy (2010-),TK,,English Language Arts,California,2010,http://www.cde.ca.gov/be/st/ss/documents/finalelaccssstandards.pdf
RF.K.2c,Blend and segment onsets and rimes of single-syllable spoken words.,English Language Arts & Literacy (2010-),TK,,English Language Arts,California,2010,http://www.cde.ca.gov/be/st/ss/documents/finalelaccssstandards.pdf
RF.K.2b,"Count, pronounce, blend, and segment syllables in spoken words.",English Language Arts & Literacy (2010-),TK,,English Language Arts,California,2010,http://www.cde.ca.gov/be/st/ss/documents/finalelaccssstandards.pdf
RF.K.2a,Recognize and produce rhyming words.,English Language Arts & Literacy (2010-),TK,,English Language Arts,California,2010,http://www.cde.ca.gov/be/st/ss/documents/finalelaccssstandards.pdf
RF.K.2,"Demonstrate understanding of spoken words, syllables, and sounds (phonemes).",English Language Arts & Literacy (2010-),TK,,English Language Arts,California,2010,http://www.cde.ca.gov/be/st/ss/documents/finalelaccssstandards.pdf
7F7131A0C014445BAC6F80BF394EF1B4,Phonological Awareness,English Language Arts & Literacy (2010-),TK,,English Language Arts,California,2010,http://www.cde.ca.gov/be/st/ss/documents/finalelaccssstandards.pdf
RF.K.1d,Recognize and name all upper- and lowercase letters of the alphabet.,English Language Arts & Literacy (2010-),TK,,English Language Arts,California,2010,http://www.cde.ca.gov/be/st/ss/documents/finalelaccssstandards.pdf
RF.K.1c,Understand that words are separated by spaces in print.,English Language Arts & Literacy (2010-),TK,,English Language Arts,California,2010,http://www.cde.ca.gov/be/st/ss/documents/finalelaccssstandards.pdf
RF.K.1b,Recognize that spoken words are represented in written language by specific sequences of letters.,English Language Arts & Literacy (2010-),TK,,English Language Arts,California,2010,http://www.cde.ca.gov/be/st/ss/documents/finalelaccssstandards.pdf
RF.K.1a,"Follow words from left to right, top to bottom, and page by page.",English Language Arts & Literacy (2010-),TK,,English Language Arts,California,2010,http://www.cde.ca.gov/be/st/ss/documents/finalelaccssstandards.pdf
RF.K.1,Demonstrate understanding of the organization and basic features of print.,English Language Arts & Literacy (2010-),TK,,English Language Arts,California,2010,http://www.cde.ca.gov/be/st/ss/documents/finalelaccssstandards.pdf
D2CC5D11A76D4795AD4814E5D6674D03,Print Concepts,English Language Arts & Literacy (2010-),TK,,English Language Arts,California,2010,http://www.cde.ca.gov/be/st/ss/documents/finalelaccssstandards.pdf
36392F7986AC422D864E30317DE5884D,Reading Standards: Foundational Skills,English Language Arts & Literacy (2010-),TK,,English Language Arts,California,2010,http://www.cde.ca.gov/be/st/ss/documents/finalelaccssstandards.pdf
RI.K.10b,Use illustrations and context to make predictions about text.,English Language Arts & Literacy (2010-),TK,,English Language Arts,California,2010,http://www.cde.ca.gov/be/st/ss/documents/finalelaccssstandards.pdf
RI.K.10a,Activate prior knowledge related to the information and events in texts.,English Language Arts & Literacy (2010-),TK,,English Language Arts,California,2010,http://www.cde.ca.gov/be/st/ss/documents/finalelaccssstandards.pdf
RI.K.10,Actively engage in group reading activities with purpose and understanding.,English Language Arts & Literacy (2010-),TK,,English Language Arts,California,2010,http://www.cde.ca.gov/be/st/ss/documents/finalelaccssstandards.pdf
C69AEA8580E84695B77E200A426AA492,Range of Reading and Level of Text Complexity,English Language Arts & Literacy (2010-),TK,,English Language Arts,California,2010,http://www.cde.ca.gov/be/st/ss/documents/finalelaccssstandards.pdf
RI.K.9,"With prompting and support, identify basic similarities in and differences between two texts on the same topic (e.g., in illustrations, descriptions, or procedures).",English Language Arts & Literacy (2010-),TK,,English Language Arts,California,2010,http://www.cde.ca.gov/be/st/ss/documents/finalelaccssstandards.pdf
RI.K.8,"With prompting and support, identify the reasons an author gives to support points in a text.",English Language Arts & Literacy (2010-),TK,,English Language Arts,California,2010,http://www.cde.ca.gov/be/st/ss/documents/finalelaccssstandards.pdf
RI.K.7,"With prompting and support, describe the relationship between illustrations and the text in which they appear (e.g., what person, place, thing, or idea in the text an illustration depicts).",English Language Arts & Literacy (2010-),TK,,English Language Arts,California,2010,http://www.cde.ca.gov/be/st/ss/documents/finalelaccssstandards.pdf
4171FAB66F644D3B9F20FC7B76A62F8A,Integration of Knowledge and Ideas,English Language Arts & Literacy (2010-),TK,,English Language Arts,California,2010,http://www.cde.ca.gov/be/st/ss/documents/finalelaccssstandards.pdf
RI.K.6,Name the author and illustrator of a text and define the role of each in presenting the ideas or information in a text.,English Language Arts & Literacy (2010-),TK,,English Language Arts,California,2010,http://www.cde.ca.gov/be/st/ss/documents/finalelaccssstandards.pdf
RI.K.5,"Identify the front cover, back cover, and title page of a book.",English Language Arts & Literacy (2010-),TK,,English Language Arts,California,2010,http://www.cde.ca.gov/be/st/ss/documents/finalelaccssstandards.pdf
RI.K.4,"With prompting and support, ask and answer questions about unknown words in a text.(See grade K Language standards 4–6 additional expectations.)",English Language Arts & Literacy (2010-),TK,,English Language Arts,California,2010,http://www.cde.ca.gov/be/st/ss/documents/finalelaccssstandards.pdf
55437BCA47E0411C8C2CD1B4FABE348B,Craft and Structure,English Language Arts & Literacy (2010-),TK,,English Language Arts,California,2010,http://www.cde.ca.gov/be/st/ss/documents/finalelaccssstandards.pdf
RI.K.3,"With prompting and support, describe the connection between two individuals, events, ideas, or pieces of information in a text.",English Language Arts & Literacy (2010-),TK,,English Language Arts,California,2010,http://www.cde.ca.gov/be/st/ss/documents/finalelaccssstandards.pdf
RI.K.2,"With prompting and support, identify the main topic and retell key details of a text.",English Language Arts & Literacy (2010-),TK,,English Language Arts,California,2010,http://www.cde.ca.gov/be/st/ss/documents/finalelaccssstandards.pdf
RI.K.1,"With prompting and support, ask and answer questions about key details in a text.",English Language Arts & Literacy (2010-),TK,,English Language Arts,California,2010,http://www.cde.ca.gov/be/st/ss/documents/finalelaccssstandards.pdf
7F599AAD2F204EC8B38E973822D7FB3A,Key Ideas and Details,English Language Arts & Literacy (2010-),TK,,English Language Arts,California,2010,http://www.cde.ca.gov/be/st/ss/documents/finalelaccssstandards.pdf
A90E9FF4852E49AEB8A106D3D49C656A,Reading Standards for Informational Text,English Language Arts & Literacy (2010-),TK,,English Language Arts,California,2010,http://www.cde.ca.gov/be/st/ss/documents/finalelaccssstandards.pdf
RL.K.10b,Use illustrations and context to make predictions about text.,English Language Arts & Literacy (2010-),TK,,English Language Arts,California,2010,http://www.cde.ca.gov/be/st/ss/documents/finalelaccssstandards.pdf
RL.K.10a,Activate prior knowledge related to the information and events in texts.,English Language Arts & Literacy (2010-),TK,,English Language Arts,California,2010,http://www.cde.ca.gov/be/st/ss/documents/finalelaccssstandards.pdf
RL.K.10,Actively engage in group reading activities with purpose and understanding.,English Language Arts & Literacy (2010-),TK,,English Language Arts,California,2010,http://www.cde.ca.gov/be/st/ss/documents/finalelaccssstandards.pdf
4ABF86F55DD649B889DEC0AAAE41BDD8,Range of Reading and Level of Text Complexity,English Language Arts & Literacy (2010-),TK,,English Language Arts,California,2010,http://www.cde.ca.gov/be/st/ss/documents/finalelaccssstandards.pdf
RL.K.9,"With prompting and support, compare and contrast the adventures and experiences of characters in familiar stories.",English Language Arts & Literacy (2010-),TK,,English Language Arts,California,2010,http://www.cde.ca.gov/be/st/ss/documents/finalelaccssstandards.pdf
D6B2484AD7884A7D97EB7D6D229972E0,(Not applicable to literature),English Language Arts & Literacy (2010-),TK,,English Language Arts,California,2010,http://www.cde.ca.gov/be/st/ss/documents/finalelaccssstandards.pdf
RL.K.7,"With prompting and support, describe the relationship between illustrations and the story in which they appear (e.g., what moment in a story an illustration depicts).",English Language Arts & Literacy (2010-),TK,,English Language Arts,California,2010,http://www.cde.ca.gov/be/st/ss/documents/finalelaccssstandards.pdf
1322648248E3478EBE7A358836897A6A,Integration of Knowledge and Ideas,English Language Arts & Literacy (2010-),TK,,English Language Arts,California,2010,http://www.cde.ca.gov/be/st/ss/documents/finalelaccssstandards.pdf
RL.K.6,"With prompting and support, name the author and illustrator of a story and define the role of each in telling the story.",English Language Arts & Literacy (2010-),TK,,English Language Arts,California,2010,http://www.cde.ca.gov/be/st/ss/documents/finalelaccssstandards.pdf
RL.K.5,"Recognize common types of texts (e.g., storybooks, poems, fantasy, realistic text).",English Language Arts & Literacy (2010-),TK,,English Language Arts,California,2010,http://www.cde.ca.gov/be/st/ss/documents/finalelaccssstandards.pdf
RL.K.4,Ask and answer questions about unknown words in a text. (See grade K Language standards 4–6 for additional expectations.),English Language Arts & Literacy (2010-),TK,,English Language Arts,California,2010,http://www.cde.ca.gov/be/st/ss/documents/finalelaccssstandards.pdf
A4DAA629C74245A987759DE71BE3C2E2,Craft and Structure,English Language Arts & Literacy (2010-),TK,,English Language Arts,California,2010,http://www.cde.ca.gov/be/st/ss/documents/finalelaccssstandards.pdf
RL.K.3,"With prompting and support, identify characters, settings, and major events in a story.",English Language Arts & Literacy (2010-),TK,,English Language Arts,California,2010,http://www.cde.ca.gov/be/st/ss/documents/finalelaccssstandards.pdf
RL.K.2,"With prompting and support, retell familiar stories, including key details.",English Language Arts & Literacy (2010-),TK,,English Language Arts,California,2010,http://www.cde.ca.gov/be/st/ss/documents/finalelaccssstandards.pdf
RL.K.1,"With prompting and support, ask and answer questions about key details in a text.",English Language Arts & Literacy (2010-),TK,,English Language Arts,California,2010,http://www.cde.ca.gov/be/st/ss/documents/finalelaccssstandards.pdf
62EBDFD87E8549179248DE6354D618A5,Key Ideas and Details,English Language Arts & Literacy (2010-),TK,,English Language Arts,California,2010,http://www.cde.ca.gov/be/st/ss/documents/finalelaccssstandards.pdf
C55C1687CD394FA889724FFE3146C6E4,Reading Standards for Literature,English Language Arts & Literacy (2010-),TK,,English Language Arts,California,2010,http://www.cde.ca.gov/be/st/ss/documents/finalelaccssstandards.pdf
R.CCR.10,Read and comprehend complex literary and informational texts independently and proficiently.,English Language Arts & Literacy (2010-),TK,,English Language Arts,California,2010,http://www.cde.ca.gov/be/st/ss/documents/finalelaccssstandards.pdf
8C96B7A3A5424468B98D60D317ADC429,Range of Reading and Level of Text Complexity,English Language Arts & Literacy (2010-),TK,,English Language Arts,California,2010,http://www.cde.ca.gov/be/st/ss/documents/finalelaccssstandards.pdf
R.CCR.9,Analyze how two or more texts address similar themes or topics in order to build knowledge or to compare the approaches the authors take.,English Language Arts & Literacy (2010-),TK,,English Language Arts,California,2010,http://www.cde.ca.gov/be/st/ss/documents/finalelaccssstandards.pdf
R.CCR.8,"Delineate and evaluate the argument and specific claims in a text, including the validity of the reasoning as well as the relevance and sufficiency of the evidence.",English Language Arts & Literacy (2010-),TK,,English Language Arts,California,2010,http://www.cde.ca.gov/be/st/ss/documents/finalelaccssstandards.pdf
R.CCR.7,"Integrate and evaluate content presented in diverse media and formats, including visually and quantitatively, as well as in words.",English Language Arts & Literacy (2010-),TK,,English Language Arts,California,2010,http://www.cde.ca.gov/be/st/ss/documents/finalelaccssstandards.pdf
C8A37F07C7AD45F1A9B31055C4634562,Integration of Knowledge and Ideas,English Language Arts & Literacy (2010-),TK,,English Language Arts,California,2010,http://www.cde.ca.gov/be/st/ss/documents/finalelaccssstandards.pdf
R.CCR.6,Assess how point of view or purpose shapes the content and style of a text.,English Language Arts & Literacy (2010-),TK,,English Language Arts,California,2010,http://www.cde.ca.gov/be/st/ss/documents/finalelaccssstandards.pdf
R.CCR.5,"Analyze the structure of texts, including how specific sentences, paragraphs, and larger portions of the text (e.g., a section, chapter, scene, or stanza) relate to each other and the whole.",English Language Arts & Literacy (2010-),TK,,English Language Arts,California,2010,http://www.cde.ca.gov/be/st/ss/documents/finalelaccssstandards.pdf
R.CCR.4,"Interpret words and phrases as they are used in a text, including determining technical, connotative, and figurative meanings, and analyze how specific word choices shape meaning or tone.",English Language Arts & Literacy (2010-),TK,,English Language Arts,California,2010,http://www.cde.ca.gov/be/st/ss/documents/finalelaccssstandards.pdf
7DA6EFACCD15403EB4ACB71FBA2E0038,Craft and Structure,English Language Arts & Literacy (2010-),TK,,English Language Arts,California,2010,http://www.cde.ca.gov/be/st/ss/documents/finalelaccssstandards.pdf
R.CCR.3,"Analyze how and why individuals, events, and ideas develop and interact over the course of a text.",English Language Arts & Literacy (2010-),TK,,English Language Arts,California,2010,http://www.cde.ca.gov/be/st/ss/documents/finalelaccssstandards.pdf
R.CCR.2,Determine central ideas or themes of a text and analyze their development; summarize the key supporting details and ideas.,English Language Arts & Literacy (2010-),TK,,English Language Arts,California,2010,http://www.cde.ca.gov/be/st/ss/documents/finalelaccssstandards.pdf
R.CCR.1,Read closely to determine what the text says explicitly and to make logical inferences from it; cite specific textual evidence when writing or speaking to support conclusions drawn from the text.,English Language Arts & Literacy (2010-),TK,,English Language Arts,California,2010,http://www.cde.ca.gov/be/st/ss/documents/finalelaccssstandards.pdf
9A452358C71A4B30AEF2DCF353F9E359,Key Ideas and Details,English Language Arts & Literacy (2010-),TK,,English Language Arts,California,2010,http://www.cde.ca.gov/be/st/ss/documents/finalelaccssstandards.pdf
D45C64C111A8448CA2AA44842D9D59EC,College and Career Readiness Anchor Standards for Reading,English Language Arts & Literacy (2010-),TK,,English Language Arts,California,2010,http://www.cde.ca.gov/be/st/ss/documents/finalelaccssstandards.pdf
