Standard_ID,Standard_Text,Subject,Grade_Level,Range,Interdisciplinary,Framework_Type,Adoption_Date,Source_URL
F5F76490DFE301318C9E68A86D17958E,Participate as a leader and a follower during physical activities.,Physical Education,TK,,,California,2005,http://www.cde.ca.gov/be/st/ss/documents/pestandards.pdf
F5F72280DFE301318C9D68A86D17958E,Group Dynamics,Physical Education,TK,,,California,2005,http://www.cde.ca.gov/be/st/ss/documents/pestandards.pdf
F5F6DD00DFE301318C9C68A86D17958E,Describe how positive social interaction can make physical activity with others more fun.,Physical Education,TK,,,California,2005,http://www.cde.ca.gov/be/st/ss/documents/pestandards.pdf
F5F69010DFE301318C9B68A86D17958E,Demonstrate the characteristics of sharing in a physical activity.,Physical Education,TK,,,California,2005,http://www.cde.ca.gov/be/st/ss/documents/pestandards.pdf
F5F650F0DFE301318C9A68A86D17958E,Social Interaction,Physical Education,TK,,,California,2005,http://www.cde.ca.gov/be/st/ss/documents/pestandards.pdf
F5F612C0DFE301318C9968A86D17958E,Participate willingly in physical activities.,Physical Education,TK,,,California,2005,http://www.cde.ca.gov/be/st/ss/documents/pestandards.pdf
F5F5D400DFE301318C9868A86D17958E,Identify the feelings that result from participation in physical activity.,Physical Education,TK,,,California,2005,http://www.cde.ca.gov/be/st/ss/documents/pestandards.pdf
F5F59480DFE301318C9768A86D17958E,Self-Responsibility,Physical Education,TK,,,California,2005,http://www.cde.ca.gov/be/st/ss/documents/pestandards.pdf
F5F551F0DFE301318C9668A86D17958E,"Students demonstrate and utilize knowledge of psychological and sociological concepts, principles, and strategies that apply to the learning and performance of physical activity.",Physical Education,TK,,,California,2005,http://www.cde.ca.gov/be/st/ss/documents/pestandards.pdf
F5F50A70DFE301318C9568A86D17958E,"Explain that the body is composed of bones, organs, fat, and other tissues.",Physical Education,TK,,,California,2005,http://www.cde.ca.gov/be/st/ss/documents/pestandards.pdf
F5F4B4D0DFE301318C9468A86D17958E,Body Composition,Physical Education,TK,,,California,2005,http://www.cde.ca.gov/be/st/ss/documents/pestandards.pdf
F5F469E0DFE301318C9368A86D17958E,Identify the body part involved when stretching.,Physical Education,TK,,,California,2005,http://www.cde.ca.gov/be/st/ss/documents/pestandards.pdf
F5F41EA0DFE301318C9268A86D17958E,Flexibility,Physical Education,TK,,,California,2005,http://www.cde.ca.gov/be/st/ss/documents/pestandards.pdf
F5F3DB20DFE301318C9168A86D17958E,Describe the role of muscles in moving the bones.,Physical Education,TK,,,California,2005,http://www.cde.ca.gov/be/st/ss/documents/pestandards.pdf
F5F39310DFE301318C9068A86D17958E,"Explain that strong muscles help the body to climb, hang, push, and pull.",Physical Education,TK,,,California,2005,http://www.cde.ca.gov/be/st/ss/documents/pestandards.pdf
F5F34B60DFE301318C8F68A86D17958E,Muscular Strength/Endurance,Physical Education,TK,,,California,2005,http://www.cde.ca.gov/be/st/ss/documents/pestandards.pdf
F5F2F8B0DFE301318C8E68A86D17958E,Identify the location of the lungs and explain the role of the lungs in the collection of oxygen.,Physical Education,TK,,,California,2005,http://www.cde.ca.gov/be/st/ss/documents/pestandards.pdf
F5F2B0C0DFE301318C8D68A86D17958E,Explain that physical activity increases the heart rate.,Physical Education,TK,,,California,2005,http://www.cde.ca.gov/be/st/ss/documents/pestandards.pdf
F5F26EE0DFE301318C8C68A86D17958E,Identify the location of the heart and explain that it is a muscle.,Physical Education,TK,,,California,2005,http://www.cde.ca.gov/be/st/ss/documents/pestandards.pdf
F5F22ED0DFE301318C8B68A86D17958E,Aerobic Capacity,Physical Education,TK,,,California,2005,http://www.cde.ca.gov/be/st/ss/documents/pestandards.pdf
F5F1EB80DFE301318C8A68A86D17958E,Explain that nutritious food provides energy for physical activity.,Physical Education,TK,,,California,2005,http://www.cde.ca.gov/be/st/ss/documents/pestandards.pdf
F5F1A0B0DFE301318C8968A86D17958E,Describe the role of water as an essential nutrient for the body.,Physical Education,TK,,,California,2005,http://www.cde.ca.gov/be/st/ss/documents/pestandards.pdf
F5F15230DFE301318C8868A86D17958E,Identify physical activities that are enjoyable and challenging.,Physical Education,TK,,,California,2005,http://www.cde.ca.gov/be/st/ss/documents/pestandards.pdf
F5F113C0DFE301318C8768A86D17958E,Fitness Concepts,Physical Education,TK,,,California,2005,http://www.cde.ca.gov/be/st/ss/documents/pestandards.pdf
F5F0D210DFE301318C8668A86D17958E,"Students demonstrate knowledge of physical fitness concepts, principles, and strategies to improve health and performance.",Physical Education,TK,,,California,2005,http://www.cde.ca.gov/be/st/ss/documents/pestandards.pdf
F5F09030DFE301318C8568A86D17958E,Identify indicators of increased capacity to participate in vigorous physical activity.,Physical Education,TK,,,California,2005,http://www.cde.ca.gov/be/st/ss/documents/pestandards.pdf
F5F050B0DFE301318C8468A86D17958E,Assessment,Physical Education,TK,,,California,2005,http://www.cde.ca.gov/be/st/ss/documents/pestandards.pdf
F5F00750DFE301318C8368A86D17958E,Sustain continuous movement for increasing periods of time while participating in moderate to vigorous physical activity.,Physical Education,TK,,,California,2005,http://www.cde.ca.gov/be/st/ss/documents/pestandards.pdf
F5EFB3F0DFE301318C8268A86D17958E,Body Composition,Physical Education,TK,,,California,2005,http://www.cde.ca.gov/be/st/ss/documents/pestandards.pdf
F5EF4D00DFE301318C8168A86D17958E,"Stretch shoulders, legs, arms, and back without bouncing.",Physical Education,TK,,,California,2005,http://www.cde.ca.gov/be/st/ss/documents/pestandards.pdf
F5EEFFF0DFE301318C8068A86D17958E,Flexibility,Physical Education,TK,,,California,2005,http://www.cde.ca.gov/be/st/ss/documents/pestandards.pdf
F5EEC130DFE301318C7F68A86D17958E,"Climb a ladder, jungle gym, or apparatus.",Physical Education,TK,,,California,2005,http://www.cde.ca.gov/be/st/ss/documents/pestandards.pdf
F5EE7E70DFE301318C7E68A86D17958E,Hang from overhead bars for increasing periods of time.,Physical Education,TK,,,California,2005,http://www.cde.ca.gov/be/st/ss/documents/pestandards.pdf
F5EE3D60DFE301318C7D68A86D17958E,Muscular Strength/Endurance,Physical Education,TK,,,California,2005,http://www.cde.ca.gov/be/st/ss/documents/pestandards.pdf
F5EDF470DFE301318C7C68A86D17958E,Participate three to four days each week in moderate to vigorous physical activities that increase breathing and heart rate.,Physical Education,TK,,,California,2005,http://www.cde.ca.gov/be/st/ss/documents/pestandards.pdf
F5EDB020DFE301318C7B68A86D17958E,Aerobic Capacity,Physical Education,TK,,,California,2005,http://www.cde.ca.gov/be/st/ss/documents/pestandards.pdf
F5ED6550DFE301318C7A68A86D17958E,Participate in physical activities that are enjoyable and challenging.,Physical Education,TK,,,California,2005,http://www.cde.ca.gov/be/st/ss/documents/pestandards.pdf
F5ECFEE0DFE301318C7968A86D17958E,Fitness Concepts,Physical Education,TK,,,California,2005,http://www.cde.ca.gov/be/st/ss/documents/pestandards.pdf
F5ECA3E0DFE301318C7868A86D17958E,Students assess and maintain a level of physical fitness to improve health and performance.,Physical Education,TK,,,California,2005,http://www.cde.ca.gov/be/st/ss/documents/pestandards.pdf
F5EC5790DFE301318C7768A86D17958E,Describe the position of the fingers in the follow-through phase of bouncing a ball continuously.,Physical Education,TK,,,California,2005,http://www.cde.ca.gov/be/st/ss/documents/pestandards.pdf
F5EC0A10DFE301318C7668A86D17958E,Identify the point of contact for kicking a ball in a straight line.,Physical Education,TK,,,California,2005,http://www.cde.ca.gov/be/st/ss/documents/pestandards.pdf
F5EBC920DFE301318C7568A86D17958E,"Explain the role of the eyes when striking objects with the hands, arms, and feet.",Physical Education,TK,,,California,2005,http://www.cde.ca.gov/be/st/ss/documents/pestandards.pdf
F5EB88C0DFE301318C7468A86D17958E,Manipulative Skills,Physical Education,TK,,,California,2005,http://www.cde.ca.gov/be/st/ss/documents/pestandards.pdf
F5EB45C0DFE301318C7368A86D17958E,"Identify the locomotor skills of walk, jog, run, hop, jump, slide, and gallop.",Physical Education,TK,,,California,2005,http://www.cde.ca.gov/be/st/ss/documents/pestandards.pdf
F5EAFAA0DFE301318C7268A86D17958E,Locomotor Movement,Physical Education,TK,,,California,2005,http://www.cde.ca.gov/be/st/ss/documents/pestandards.pdf
F5EA99F0DFE301318C7168A86D17958E,Explain base of support.,Physical Education,TK,,,California,2005,http://www.cde.ca.gov/be/st/ss/documents/pestandards.pdf
F5EA14D0DFE301318C7068A86D17958E,"Identify and describe parts of the body: the head, shoulders, neck, back, chest, waist, hips, arms, elbows, wrists, hands, fingers, legs, knees, ankles, feet, and toes.",Physical Education,TK,,,California,2005,http://www.cde.ca.gov/be/st/ss/documents/pestandards.pdf
F5E9C9F0DFE301318C6F68A86D17958E,Body Management,Physical Education,TK,,,California,2005,http://www.cde.ca.gov/be/st/ss/documents/pestandards.pdf
F5E98420DFE301318C6E68A86D17958E,"Identify and independently use personal space, general space, and boundaries and discuss why they are important.",Physical Education,TK,,,California,2005,http://www.cde.ca.gov/be/st/ss/documents/pestandards.pdf
F5E93AD0DFE301318C6D68A86D17958E,"Explain the difference between under and over, behind and in front of, next to and through, up and down, forward and backward, and sideways.",Physical Education,TK,,,California,2005,http://www.cde.ca.gov/be/st/ss/documents/pestandards.pdf
F5E8EFF0DFE301318C6C68A86D17958E,Movement Concepts,Physical Education,TK,,,California,2005,http://www.cde.ca.gov/be/st/ss/documents/pestandards.pdf
F5E8A1E0DFE301318C6B68A86D17958E,"Students demonstrate knowledge of movement concepts, principles, and strategies that apply to the learning and performance of physical activities.",Physical Education,TK,,,California,2005,http://www.cde.ca.gov/be/st/ss/documents/pestandards.pdf
F5E86000DFE301318C6A68A86D17958E,"Clap in time to a simple, rhythmic beat.",Physical Education,TK,,,California,2005,http://www.cde.ca.gov/be/st/ss/documents/pestandards.pdf
F5E81F30DFE301318C6968A86D17958E,Perform locomotor and nonlocomotor movements to a steady beat.,Physical Education,TK,,,California,2005,http://www.cde.ca.gov/be/st/ss/documents/pestandards.pdf
F5E7DB40DFE301318C6868A86D17958E,Rhythmic Skills,Physical Education,TK,,,California,2005,http://www.cde.ca.gov/be/st/ss/documents/pestandards.pdf
F5E78A50DFE301318C6768A86D17958E,"Bounce a ball continuously, using two hands.",Physical Education,TK,,,California,2005,http://www.cde.ca.gov/be/st/ss/documents/pestandards.pdf
F5E73F80DFE301318C6668A86D17958E,"Kick a stationary object, using a simple kicking pattern.",Physical Education,TK,,,California,2005,http://www.cde.ca.gov/be/st/ss/documents/pestandards.pdf
F5E6F1B0DFE301318C6568A86D17958E,"Toss a ball to oneself, using the underhand throw pattern, and catch it before it bounces twice.",Physical Education,TK,,,California,2005,http://www.cde.ca.gov/be/st/ss/documents/pestandards.pdf
F5E6A8B0DFE301318C6468A86D17958E,"Strike a stationary ball or balloon with the hands, arms, and feet.",Physical Education,TK,,,California,2005,http://www.cde.ca.gov/be/st/ss/documents/pestandards.pdf
F5E66830DFE301318C6368A86D17958E,Manipulative Skills,Physical Education,TK,,,California,2005,http://www.cde.ca.gov/be/st/ss/documents/pestandards.pdf
F5E5E390DFE301318C6168A86D17958E,"Jump over a stationary rope several times in succession, using forward-and-back and side-to-side movement patterns.",Physical Education,TK,,,California,2005,http://www.cde.ca.gov/be/st/ss/documents/pestandards.pdf
F5E59DB0DFE301318C6068A86D17958E,"Travel in straight, curved, and zigzag pathways.",Physical Education,TK,,,California,2005,http://www.cde.ca.gov/be/st/ss/documents/pestandards.pdf
F5E62640DFE301318C6268A86D17958E,Perform a continuous log roll.,Physical Education,TK,,,California,2005,http://www.cde.ca.gov/be/st/ss/documents/pestandards.pdf
F5E54E00DFE301318C5F68A86D17958E,Locomotor Movement,Physical Education,TK,,,California,2005,http://www.cde.ca.gov/be/st/ss/documents/pestandards.pdf
F5E50E50DFE301318C5E68A86D17958E,"Demonstrate the relationship of under, over, behind, next to, through, right, left, up, down, forward, backward, and in front of by using the body and an object.",Physical Education,TK,,,California,2005,http://www.cde.ca.gov/be/st/ss/documents/pestandards.pdf
F5E4CF60DFE301318C5D68A86D17958E,"Balance while walking forward and sideways on a narrow, elevated surface.",Physical Education,TK,,,California,2005,http://www.cde.ca.gov/be/st/ss/documents/pestandards.pdf
F5E49020DFE301318C5C68A86D17958E,"Balance on one, two, three, four, and five body parts.",Physical Education,TK,,,California,2005,http://www.cde.ca.gov/be/st/ss/documents/pestandards.pdf
F5E45050DFE301318C5B68A86D17958E,Create shapes by using nonlocomotor movements.,Physical Education,TK,,,California,2005,http://www.cde.ca.gov/be/st/ss/documents/pestandards.pdf
F5E40EE0DFE301318C5A68A86D17958E,Body Management,Physical Education,TK,,,California,2005,http://www.cde.ca.gov/be/st/ss/documents/pestandards.pdf
F5E3C620DFE301318C5968A86D17958E,"Create shapes at high, medium, and low levels by using hands, arms, torso, feet, and legs in a variety of combinations.",Physical Education,TK,,,California,2005,http://www.cde.ca.gov/be/st/ss/documents/pestandards.pdf
F5E37C80DFE301318C5868A86D17958E,Demonstrate contrasts between slow and fast speeds while using locomotor skills.,Physical Education,TK,,,California,2005,http://www.cde.ca.gov/be/st/ss/documents/pestandards.pdf
F5E333A0DFE301318C5768A86D17958E,Travel forward and sideways while changing direction quickly in response to a signal.,Physical Education,TK,,,California,2005,http://www.cde.ca.gov/be/st/ss/documents/pestandards.pdf
F5E2C5D0DFE301318C5668A86D17958E,"Travel within a large group, without bumping into others or falling, while using locomotor skills.",Physical Education,TK,,,California,2005,http://www.cde.ca.gov/be/st/ss/documents/pestandards.pdf
F5E25B50DFE301318C5568A86D17958E,Movement Concepts,Physical Education,TK,,,California,2005,http://www.cde.ca.gov/be/st/ss/documents/pestandards.pdf
F5E20A40DFE301318C5468A86D17958E,Students demonstrate the motor skills and movement patterns needed to perform a variety of physical activities.,Physical Education,TK,,,California,2005,http://www.cde.ca.gov/be/st/ss/documents/pestandards.pdf
