Standard_ID,Standard_Text,Subject,Grade_Level,Range,Interdisciplinary,Framework_Type,Adoption_Date,Source_URL
0B3840C6D91C418A8FCA1645DE382F42,Discuss how art is used to illustrate stories.,Visual & Performing Arts (2001-2019),TK,,,California,2001,http://www.cde.ca.gov/be/st/ss/documents/vpastandards.pdf
5AE43137C4EE409ABF16BEC17E3976AB,Careers and Career-Related Skills,Visual & Performing Arts (2001-2019),TK,,,California,2001,http://www.cde.ca.gov/be/st/ss/documents/vpastandards.pdf
8589D3658AAE43239EFD8B4093631663,"Identify images of self, friends, and family (including snapshots and the students' own works of art).",Visual & Performing Arts (2001-2019),TK,,,California,2001,http://www.cde.ca.gov/be/st/ss/documents/vpastandards.pdf
B7CA7EA8FD084AC9A825A0C545190231,Visual Literacy,Visual & Performing Arts (2001-2019),TK,,,California,2001,http://www.cde.ca.gov/be/st/ss/documents/vpastandards.pdf
83AAC695AA8B4F44AD43EE46883548D7,"Name colors and draw an object, using the colors (e.g., red balloon, green leaf, brown dog, yellow sun).",Visual & Performing Arts (2001-2019),TK,,,California,2001,http://www.cde.ca.gov/be/st/ss/documents/vpastandards.pdf
94C9414984C8475C8F929C6A4C14E11F,"Create visual patterns (e.g., line, line, dot; line, line, dot) to match rythms made by clapping or drumming the beat found in selected poems or songs.",Visual & Performing Arts (2001-2019),TK,,,California,2001,http://www.cde.ca.gov/be/st/ss/documents/vpastandards.pdf
3EA63ECC0DB24DE087E22EBCBAEE450D,Connections and Applications,Visual & Performing Arts (2001-2019),TK,,,California,2001,http://www.cde.ca.gov/be/st/ss/documents/vpastandards.pdf
788AFAD70F5D4F2C8F836C1A4B2EA6E3,"Connections, Relationships, Applications - Connecting and Applying What Is Learned in the Visual Arts to Other Art Forms and Subject Areas and to Careers",Visual & Performing Arts (2001-2019),TK,,,California,2001,http://www.cde.ca.gov/be/st/ss/documents/vpastandards.pdf
FD2B5919706C4DAEAB5D3EA35EE715F3,Select works of art by others and tell what they like about them.,Visual & Performing Arts (2001-2019),TK,,,California,2001,http://www.cde.ca.gov/be/st/ss/documents/vpastandards.pdf
BA7FE79DBA4A4C23A0BE8BB60888CDBF,Discuss what they like about their own works of art.,Visual & Performing Arts (2001-2019),TK,,,California,2001,http://www.cde.ca.gov/be/st/ss/documents/vpastandards.pdf
E90C09D787FE45B798CD36197A29FC6A,Make Informed Judgments,Visual & Performing Arts (2001-2019),TK,,,California,2001,http://www.cde.ca.gov/be/st/ss/documents/vpastandards.pdf
FFA0395D27C44CADB80F49CE2A99A196,Ask questions about works of art.,Visual & Performing Arts (2001-2019),TK,,,California,2001,http://www.cde.ca.gov/be/st/ss/documents/vpastandards.pdf
3C8528598C974FB0A534C8052AD27DB1,Discuss what is seen in works of art.,Visual & Performing Arts (2001-2019),TK,,,California,2001,http://www.cde.ca.gov/be/st/ss/documents/vpastandards.pdf
8E635E5671BB4F2CB9751FC8DC80126E,Derive Meaning,Visual & Performing Arts (2001-2019),TK,,,California,2001,http://www.cde.ca.gov/be/st/ss/documents/vpastandards.pdf
C9F06EFFEBB440B3A0155E0D7ABA4227,"Aesthetic Valuing - Responding to, Analyzing, and Making Judgments About Works in the Visual Arts",Visual & Performing Arts (2001-2019),TK,,,California,2001,http://www.cde.ca.gov/be/st/ss/documents/vpastandards.pdf
DBE396373E9C41538C2CFB2EABFA13AC,Discuss art objects from various places and times.,Visual & Performing Arts (2001-2019),TK,,,California,2001,http://www.cde.ca.gov/be/st/ss/documents/vpastandards.pdf
A678FA01D39A4DE8B6645146788B50DE,Diversity of the Visual Arts,Visual & Performing Arts (2001-2019),TK,,,California,2001,http://www.cde.ca.gov/be/st/ss/documents/vpastandards.pdf
ADF18A2A98C443C4A71A2536F38DAC45,Describe pictorial objects that appear in works of art.,Visual & Performing Arts (2001-2019),TK,,,California,2001,http://www.cde.ca.gov/be/st/ss/documents/vpastandards.pdf
9424405F72D74A20B0D3CB4DB429EF8C,Identify art observed in daily life.,Visual & Performing Arts (2001-2019),TK,,,California,2001,http://www.cde.ca.gov/be/st/ss/documents/vpastandards.pdf
9282BF99EE924950A92010D53D7F479A,Role and Development of the Visual Arts,Visual & Performing Arts (2001-2019),TK,,,California,2001,http://www.cde.ca.gov/be/st/ss/documents/vpastandards.pdf
22D4A4069949401E87CAF62C6B4FFFA8,Historical and Cultural Context - Understanding the Historical Contributions and Cultural Dimensions of the Visual Arts,Visual & Performing Arts (2001-2019),TK,,,California,2001,http://www.cde.ca.gov/be/st/ss/documents/vpastandards.pdf
32DC9D5E99434719BCA98F10459BDB02,Create a three-dimensional form.,Visual & Performing Arts (2001-2019),TK,,,California,2001,http://www.cde.ca.gov/be/st/ss/documents/vpastandards.pdf
017AF36FE12D45BF8D976C285D59EB87,Use colors to draw or paint a picture of everyday objects.,Visual & Performing Arts (2001-2019),TK,,,California,2001,http://www.cde.ca.gov/be/st/ss/documents/vpastandards.pdf
3E5B3C618E384C3885640FD7EEC7339F,Create a picture of a person.,Visual & Performing Arts (2001-2019),TK,,,California,2001,http://www.cde.ca.gov/be/st/ss/documents/vpastandards.pdf
27D7DF4A9FB04A27A4C41FFE7E0C738B,Create a self-portrait.,Visual & Performing Arts (2001-2019),TK,,,California,2001,http://www.cde.ca.gov/be/st/ss/documents/vpastandards.pdf
31E3161FF89943D9A3F62CCE7F116AD6,Communication and Expression Through Original Works of Art,Visual & Performing Arts (2001-2019),TK,,,California,2001,http://www.cde.ca.gov/be/st/ss/documents/vpastandards.pdf
07328AF1641A486DBE4A8444B4B7747A,Experiment with colors through the use of a variety of drawing materials and paints.,Visual & Performing Arts (2001-2019),TK,,,California,2001,http://www.cde.ca.gov/be/st/ss/documents/vpastandards.pdf
FD52E1F1D8C84E109A1FBA45D8546F23,"Demonstrate beginning skill in the use of materials (such as pencils, paints, crayons, clay) to create works of art.",Visual & Performing Arts (2001-2019),TK,,,California,2001,http://www.cde.ca.gov/be/st/ss/documents/vpastandards.pdf
406C9F2498C9451BA0AA3E89AE89F453,Create patterns and three-dimensional arrangements (using manipulatives or blocks).,Visual & Performing Arts (2001-2019),TK,,,California,2001,http://www.cde.ca.gov/be/st/ss/documents/vpastandards.pdf
C116216B5B094E63BE7A1A322F0F354D,"Skills, Processes, Materials, and Tools",Visual & Performing Arts (2001-2019),TK,,,California,2001,http://www.cde.ca.gov/be/st/ss/documents/vpastandards.pdf
C2B402558AD54C93960B5F70468C1557,"Creative Expression - Creating, Performing, and Participating in the Visual Arts",Visual & Performing Arts (2001-2019),TK,,,California,2001,http://www.cde.ca.gov/be/st/ss/documents/vpastandards.pdf
123D931034B24C4BA095604E7DCEA12B,Name and describe objects by color and relative size.,Visual & Performing Arts (2001-2019),TK,,,California,2001,http://www.cde.ca.gov/be/st/ss/documents/vpastandards.pdf
4F5CD6A3B0414B498B6793E9C99635F4,Identify colors by name.,Visual & Performing Arts (2001-2019),TK,,,California,2001,http://www.cde.ca.gov/be/st/ss/documents/vpastandards.pdf
4A89FC42A00348E1BA7171E819CAB6DD,Discuss visual and tactile perceptions of the natural and human-made world: what is seen and how objects feel.,Visual & Performing Arts (2001-2019),TK,,,California,2001,http://www.cde.ca.gov/be/st/ss/documents/vpastandards.pdf
E026E2A6EB544FE5B732B7609155BC25,Develop Perceptual Skills and Visual Arts Vocabulary,Visual & Performing Arts (2001-2019),TK,,,California,2001,http://www.cde.ca.gov/be/st/ss/documents/vpastandards.pdf
2C3495B4B1644EC9B85EFABB9393C482,"Artistic Perception - Processing, Analyzing, and Responding to Sensory Information Through the Language and Skills Unique to the Visual Arts",Visual & Performing Arts (2001-2019),TK,,,California,2001,http://www.cde.ca.gov/be/st/ss/documents/vpastandards.pdf
F3CB028B93C24B2E8F1394EBAE43B70B,Visual Arts,Visual & Performing Arts (2001-2019),TK,,,California,2001,http://www.cde.ca.gov/be/st/ss/documents/vpastandards.pdf
10FF846849474C898A78B7505CDBC6EC,"Role-play adult professions, using creative dramatics and theatrical activities.",Visual & Performing Arts (2001-2019),TK,,,California,2001,http://www.cde.ca.gov/be/st/ss/documents/vpastandards.pdf
9F0D3A2D691140D0B8542FB1E943B006,Careers and Career-Related Skills,Visual & Performing Arts (2001-2019),TK,,,California,2001,http://www.cde.ca.gov/be/st/ss/documents/vpastandards.pdf
A73217ADCFA54B229C7137C0F60A8DEE,"Use body, voice, and imagination to illustrate concepts in other content areas. Use movement and voice, for example, to reinforce vocabulary, such as big, little, loud, and quiet.",Visual & Performing Arts (2001-2019),TK,,,California,2001,http://www.cde.ca.gov/be/st/ss/documents/vpastandards.pdf
D0002C1861274A82ABF154DDE8A89790,Connections and Applications,Visual & Performing Arts (2001-2019),TK,,,California,2001,http://www.cde.ca.gov/be/st/ss/documents/vpastandards.pdf
EA7126CE01F84AB6AC1698374CDD5530,"Connections, Relationships, Applications - Connecting and Applying What Is Learned in Theatre, Film/Video, and Electronic Media to Other Art Forms and Subject Areas and to Careers",Visual & Performing Arts (2001-2019),TK,,,California,2001,http://www.cde.ca.gov/be/st/ss/documents/vpastandards.pdf
1284955BEB1747FB882FA239BE2ADB42,Respond appropriately as an audience member.,Visual & Performing Arts (2001-2019),TK,,,California,2001,http://www.cde.ca.gov/be/st/ss/documents/vpastandards.pdf
8CF05AFD187F4E299B60DB72E1383974,Critical Assessment of Theatre,Visual & Performing Arts (2001-2019),TK,,,California,2001,http://www.cde.ca.gov/be/st/ss/documents/vpastandards.pdf
9F4F7D41F94C4C7BA321A779CC10A350,"Aesthetic Valuing - Responding to, Analyzing, and Critiquing Theatrical Experiences",Visual & Performing Arts (2001-2019),TK,,,California,2001,http://www.cde.ca.gov/be/st/ss/documents/vpastandards.pdf
07552C330D9A436A9E203A82F5B9E452,"Identify various theatrical experiences, such as live theatre, television, and puppetry.",Visual & Performing Arts (2001-2019),TK,,,California,2001,http://www.cde.ca.gov/be/st/ss/documents/vpastandards.pdf
439180E3F9B040B4A9A28C3C124C7315,Role and Cultural Significance of Theatre,Visual & Performing Arts (2001-2019),TK,,,California,2001,http://www.cde.ca.gov/be/st/ss/documents/vpastandards.pdf
9D823C1F80B043C4A27EAA16DAE468BD,Historical and Cultural Context - Understanding the Historical Contributions and Cultural Dimensions of Theatre,Visual & Performing Arts (2001-2019),TK,,,California,2001,http://www.cde.ca.gov/be/st/ss/documents/vpastandards.pdf
E9657F2D523442AFA98578B2C05CE667,"Engage in fantasy play, re-creating situations in familiar settings.",Visual & Performing Arts (2001-2019),TK,,,California,2001,http://www.cde.ca.gov/be/st/ss/documents/vpastandards.pdf
76A95F744E1846B7B432A5F799DB9319,Creation/Invention in Theatre,Visual & Performing Arts (2001-2019),TK,,,California,2001,http://www.cde.ca.gov/be/st/ss/documents/vpastandards.pdf
75807B37A07F4121922081803E8EC8B7,Participate in call-and-response games.,Visual & Performing Arts (2001-2019),TK,,,California,2001,http://www.cde.ca.gov/be/st/ss/documents/vpastandards.pdf
3F1A518720AE4B839C187E070CB0EADF,Development of Theatrical Skills,Visual & Performing Arts (2001-2019),TK,,,California,2001,http://www.cde.ca.gov/be/st/ss/documents/vpastandards.pdf
104B5BBAB1F54E9992D9C26CCC5BA824,"Creative Expression - Creating, Performing, and Participating in Theatre",Visual & Performing Arts (2001-2019),TK,,,California,2001,http://www.cde.ca.gov/be/st/ss/documents/vpastandards.pdf
07732396B7B64C89848B60A8443D5021,Identify characteristic movements and sounds of animate and inanimate objects.,Visual & Performing Arts (2001-2019),TK,,,California,2001,http://www.cde.ca.gov/be/st/ss/documents/vpastandards.pdf
794F30FE4F5448008747C61C8611D7F8,Comprehension and Analysis of the Elements of Theatre,Visual & Performing Arts (2001-2019),TK,,,California,2001,http://www.cde.ca.gov/be/st/ss/documents/vpastandards.pdf
E7C99C49E5634EC48B04DB6CEC58ADC1,"Use the vocabulary of theatre, such as pretend, imagination, movement, puppetry, and audience, to describe theatrical experiences.",Visual & Performing Arts (2001-2019),TK,,,California,2001,http://www.cde.ca.gov/be/st/ss/documents/vpastandards.pdf
C0D9AB9B5E314D87BF320660CC3416AD,Development of the Vocabulary of Theatre,Visual & Performing Arts (2001-2019),TK,,,California,2001,http://www.cde.ca.gov/be/st/ss/documents/vpastandards.pdf
753C753885E941118D88AF1C7CA8D3B0,"Artistic Perception - Processing, Analyzing, and Responding to Sensory Information Through the Language and Skills Unique to Theatre",Visual & Performing Arts (2001-2019),TK,,,California,2001,http://www.cde.ca.gov/be/st/ss/documents/vpastandards.pdf
F638A2BC2E2B4A44A266AFF3073C1BF8,Theatre,Visual & Performing Arts (2001-2019),TK,,,California,2001,http://www.cde.ca.gov/be/st/ss/documents/vpastandards.pdf
81F44EDEAAA84E00BD31FA0E62587B35,Demonstrate an awareness of music as a part of daily life.,Visual & Performing Arts (2001-2019),TK,,,California,2001,http://www.cde.ca.gov/be/st/ss/documents/vpastandards.pdf
2FD8B325BB7A42578BF726C04A03B645,Careers and Career-Related Skills,Visual & Performing Arts (2001-2019),TK,,,California,2001,http://www.cde.ca.gov/be/st/ss/documents/vpastandards.pdf
FE8B4DFF87604C87A86AEF5B65C3FFB7,Improvise songs to accompany games and playtime activities.,Visual & Performing Arts (2001-2019),TK,,,California,2001,http://www.cde.ca.gov/be/st/ss/documents/vpastandards.pdf
FBDBB571CF744F7C827F67A57F09AC4C,Connections and Applications,Visual & Performing Arts (2001-2019),TK,,,California,2001,http://www.cde.ca.gov/be/st/ss/documents/vpastandards.pdf
3434075638DD47AE8E1302093133848A,"Connections, Relationships, Applications - Connecting and Applying What Is Learned in Music to Learning in Other Art Forms and Subject Areas and to Careers",Visual & Performing Arts (2001-2019),TK,,,California,2001,http://www.cde.ca.gov/be/st/ss/documents/vpastandards.pdf
E2D739DE87B2487AAD476905D41B7CAF,Participate freely in musical activities.,Visual & Performing Arts (2001-2019),TK,,,California,2001,http://www.cde.ca.gov/be/st/ss/documents/vpastandards.pdf
AB5BFA71FFBC4191BFFAF6B479470C41,Create movements in response to music.,Visual & Performing Arts (2001-2019),TK,,,California,2001,http://www.cde.ca.gov/be/st/ss/documents/vpastandards.pdf
5D04ECC6D7D24C8FA08338A840D7FB01,Derive Meaning,Visual & Performing Arts (2001-2019),TK,,,California,2001,http://www.cde.ca.gov/be/st/ss/documents/vpastandards.pdf
3202F532024E44408C7D048CF597BAEA,"Aesthetic Valuing - Responding to, Analyzing, and Making Judgments About Works of Music",Visual & Performing Arts (2001-2019),TK,,,California,2001,http://www.cde.ca.gov/be/st/ss/documents/vpastandards.pdf
F316B5D09FA2466CB418B99E750E3EF8,Use developmentally appropriate movements in responding to music from various genres and periods (rhythm).,Visual & Performing Arts (2001-2019),TK,,,California,2001,http://www.cde.ca.gov/be/st/ss/documents/vpastandards.pdf
955E570044DC4417BDEBF1CA95BAE406,Use a personal vocabulary to describe music from diverse cultures.,Visual & Performing Arts (2001-2019),TK,,,California,2001,http://www.cde.ca.gov/be/st/ss/documents/vpastandards.pdf
9FDFF857354D4CE1BE408B50B28DEE34,Diversity of Music,Visual & Performing Arts (2001-2019),TK,,,California,2001,http://www.cde.ca.gov/be/st/ss/documents/vpastandards.pdf
7FDECF08C1D7471C9E61014190AB2A18,Historical and Cultural Context - Understanding the Historical Contributions and Cultural Dimensions of Music,Visual & Performing Arts (2001-2019),TK,,,California,2001,http://www.cde.ca.gov/be/st/ss/documents/vpastandards.pdf
87D0197D59D74E20964B15D1ED9222CE,"Improvise simple instrumental accompaniments to songs, recorded selections, stories, and poems.",Visual & Performing Arts (2001-2019),TK,,,California,2001,http://www.cde.ca.gov/be/st/ss/documents/vpastandards.pdf
90C904762744429EA4A3CEBB3B1EB654,"Compose, Arrange, and Improvise",Visual & Performing Arts (2001-2019),TK,,,California,2001,http://www.cde.ca.gov/be/st/ss/documents/vpastandards.pdf
C9DD3D52CEC84059BF6C8B61056CA36B,"Use the voice to speak, chant, and sing.",Visual & Performing Arts (2001-2019),TK,,,California,2001,http://www.cde.ca.gov/be/st/ss/documents/vpastandards.pdf
E56DB5E651EF4300BA24A64ECD11172F,Move or use body percussion to demonstrate awareness of beat and tempo.,Visual & Performing Arts (2001-2019),TK,,,California,2001,http://www.cde.ca.gov/be/st/ss/documents/vpastandards.pdf
65F0EC7BF2BE47C7B7A74F22A9104622,Apply Vocal and Instrumental Skills,Visual & Performing Arts (2001-2019),TK,,,California,2001,http://www.cde.ca.gov/be/st/ss/documents/vpastandards.pdf
657E9C56B3D1482A8AF8DED63A227376,"Creative Expression - Creating, Performing, and Participating in Music",Visual & Performing Arts (2001-2019),TK,,,California,2001,http://www.cde.ca.gov/be/st/ss/documents/vpastandards.pdf
3717990E4614455BB8D0FD76D9B33B99,Use body movement to respond to dynamics and tempo.,Visual & Performing Arts (2001-2019),TK,,,California,2001,http://www.cde.ca.gov/be/st/ss/documents/vpastandards.pdf
F5C6F911AAE442B98A0B635556CBF88A,Identify the sources of a wide variety of sounds.,Visual & Performing Arts (2001-2019),TK,,,California,2001,http://www.cde.ca.gov/be/st/ss/documents/vpastandards.pdf
205E6E8DF56042B6B3BAB3F117312556,"Listen to, Analyze, and Describe Music",Visual & Performing Arts (2001-2019),TK,,,California,2001,http://www.cde.ca.gov/be/st/ss/documents/vpastandards.pdf
964C4142B6E3496CB3151535F43EBBB9,Use icons or invented symbols to represent musical sounds and ideas.,Visual & Performing Arts (2001-2019),TK,,,California,2001,http://www.cde.ca.gov/be/st/ss/documents/vpastandards.pdf
813763E27A60438D98BA4372282E2C41,Read and Notate Music,Visual & Performing Arts (2001-2019),TK,,,California,2001,http://www.cde.ca.gov/be/st/ss/documents/vpastandards.pdf
12EFC4B5B9AF453E997025A0F6714197,"Artistic Perception - Processing, Analyzing, and Responding to Sensory Information Through the Language and Skills Unique to Music",Visual & Performing Arts (2001-2019),TK,,,California,2001,http://www.cde.ca.gov/be/st/ss/documents/vpastandards.pdf
44955C379B984C93B092F933A22B42C9,Music,Visual & Performing Arts (2001-2019),TK,,,California,2001,http://www.cde.ca.gov/be/st/ss/documents/vpastandards.pdf
4814993312ED4A68834396CA46FA999F,"Participate in dance games, sing songs, recite poems, and tell stories from countries around the world.",Visual & Performing Arts (2001-2019),TK,,,California,2001,http://www.cde.ca.gov/be/st/ss/documents/vpastandards.pdf
78A0E82B47274C5098863FAC418195C1,Connections and Applications Across Disciplines,Visual & Performing Arts (2001-2019),TK,,,California,2001,http://www.cde.ca.gov/be/st/ss/documents/vpastandards.pdf
5CC44F8C86EB4E718FA7A16E8FD09096,"Connections, Relationships, Applications - Connecting and Applying What Is Learned in Dance to Learning in Other Art Forms and Subject Areas and to Careers",Visual & Performing Arts (2001-2019),TK,,,California,2001,http://www.cde.ca.gov/be/st/ss/documents/vpastandards.pdf
EFF84AD651B1479B9E566C7699399305,"Describe how everyday movements can be used in dance (e.g., walk quickly, stretch slowly).",Visual & Performing Arts (2001-2019),TK,,,California,2001,http://www.cde.ca.gov/be/st/ss/documents/vpastandards.pdf
50199820C0AD4D0EA674498677813EF4,"Description, Analysis, and Criticism of Dance",Visual & Performing Arts (2001-2019),TK,,,California,2001,http://www.cde.ca.gov/be/st/ss/documents/vpastandards.pdf
AC17576A1AEF4D16BE4BF0030A96A184,"Aesthetic Valuing - Responding to, Analyzing, and Making Judgments About Works of Dance",Visual & Performing Arts (2001-2019),TK,,,California,2001,http://www.cde.ca.gov/be/st/ss/documents/vpastandards.pdf
9917A6E9310846EBB91052EA587CAC19,Name and play children's dance games from countries around the world.,Visual & Performing Arts (2001-2019),TK,,,California,2001,http://www.cde.ca.gov/be/st/ss/documents/vpastandards.pdf
18527365CCBE435080743BC9427D4D25,Development of Dance,Visual & Performing Arts (2001-2019),TK,,,California,2001,http://www.cde.ca.gov/be/st/ss/documents/vpastandards.pdf
13D2D492B55D42DA9715EB4DF4510B3A,Historical and Cultural Context - Understanding the Historical Contributions and Cultural Dimensions of Dance,Visual & Performing Arts (2001-2019),TK,,,California,2001,http://www.cde.ca.gov/be/st/ss/documents/vpastandards.pdf
9D02DCA4A15342A89E579AF2D16948AC,Respond spontaneously to different types of music and rhythms.,Visual & Performing Arts (2001-2019),TK,,,California,2001,http://www.cde.ca.gov/be/st/ss/documents/vpastandards.pdf
758E71D16E10489388CE5EB974CB68DD,"Respond to visual and sound stimuli (e.g., bubbles, feathers, bell, clock, ball) with original movement.",Visual & Performing Arts (2001-2019),TK,,,California,2001,http://www.cde.ca.gov/be/st/ss/documents/vpastandards.pdf
BA4120A95BAA4A23B6E8CFCE8A79F62C,Create movements that reflect a variety of daily tasks and activities.,Visual & Performing Arts (2001-2019),TK,,,California,2001,http://www.cde.ca.gov/be/st/ss/documents/vpastandards.pdf
6CE5BADB76A34161B3D4BD5FA403DBE0,Creation/Invention of Dance Movements,Visual & Performing Arts (2001-2019),TK,,,California,2001,http://www.cde.ca.gov/be/st/ss/documents/vpastandards.pdf
5048D2936DB947BCA67CAC64AE7240FA,"Creative Expression - Creating, Performing, and Participating in Dance",Visual & Performing Arts (2001-2019),TK,,,California,2001,http://www.cde.ca.gov/be/st/ss/documents/vpastandards.pdf
3A660BD806E14F159FF556A7F8B572F0,"Name the opposites in basic movements (e.g., big/small).",Visual & Performing Arts (2001-2019),TK,,,California,2001,http://www.cde.ca.gov/be/st/ss/documents/vpastandards.pdf
43AA5BF2B8854FAB93BF50F23B502080,Development of Dance Vocabulary,Visual & Performing Arts (2001-2019),TK,,,California,2001,http://www.cde.ca.gov/be/st/ss/documents/vpastandards.pdf
5613313D7BAC417199B35D8E7D1A0E70,"Respond in movement to opposites (e.g., big/small, fast/slow, tight/loose, move/stop).",Visual & Performing Arts (2001-2019),TK,,,California,2001,http://www.cde.ca.gov/be/st/ss/documents/vpastandards.pdf
5B62410E3FA84374B2BE96214BE349E3,Comprehension and Analysis of Dance Elements,Visual & Performing Arts (2001-2019),TK,,,California,2001,http://www.cde.ca.gov/be/st/ss/documents/vpastandards.pdf
95DED7841BEE41BF94D1C522C8A34595,Imitate the movements shown.,Visual & Performing Arts (2001-2019),TK,,,California,2001,http://www.cde.ca.gov/be/st/ss/documents/vpastandards.pdf
303F636B4332414CA4F661A9552D8BE8,Move in a variety of directed ways.,Visual & Performing Arts (2001-2019),TK,,,California,2001,http://www.cde.ca.gov/be/st/ss/documents/vpastandards.pdf
D1A87262EA7044CFAFA00CF7BDD5F418,Development of Motor Skills and Technical Expertise,Visual & Performing Arts (2001-2019),TK,,,California,2001,http://www.cde.ca.gov/be/st/ss/documents/vpastandards.pdf
67BA8371059B439E8AA18B4E79430A5D,"Artistic Perception – Processing, Analyzing, and Responding to Sensory Information Through the Language and Skills Unique to Dance",Visual & Performing Arts (2001-2019),TK,,,California,2001,http://www.cde.ca.gov/be/st/ss/documents/vpastandards.pdf
84C538751E8F404299CD7D30D18FC8CA,Dance,Visual & Performing Arts (2001-2019),TK,,,California,2001,http://www.cde.ca.gov/be/st/ss/documents/vpastandards.pdf
FB72B540DFE30131956D68A86D17958E,"Discuss the various works of art (e.g., ceramics, paintings, sculpture) that artists create and the type of media used.",Visual & Performing Arts (2001-2019),TK,,,California,2001,http://www.cde.ca.gov/be/st/ss/documents/vpastandards.pdf
FB7260F0DFE30131956C68A86D17958E,Careers and Career-Related Skills,Visual & Performing Arts (2001-2019),TK,,,California,2001,http://www.cde.ca.gov/be/st/ss/documents/vpastandards.pdf
FB71ECD0DFE30131956B68A86D17958E,"Point out images (e.g., photographs, paintings, murals, ceramics, sculptures) and sym-bols found at home, in school, and in the community, including national and state symbols and icons.",Visual & Performing Arts (2001-2019),TK,,,California,2001,http://www.cde.ca.gov/be/st/ss/documents/vpastandards.pdf
FB719720DFE30131956A68A86D17958E,Visual Literacy,Visual & Performing Arts (2001-2019),TK,,,California,2001,http://www.cde.ca.gov/be/st/ss/documents/vpastandards.pdf
FB712E60DFE30131956968A86D17958E,"Look at and draw something used every day (e.g., scissors, toothbrush, fork) and de-scribe how the object is used.",Visual & Performing Arts (2001-2019),TK,,,California,2001,http://www.cde.ca.gov/be/st/ss/documents/vpastandards.pdf
FB70D970DFE30131956868A86D17958E,"Draw geometric shapes/forms (e.g., circles, squares, triangles) and repeat them in dance/movement sequences.",Visual & Performing Arts (2001-2019),TK,,,California,2001,http://www.cde.ca.gov/be/st/ss/documents/vpastandards.pdf
FB709740DFE30131956768A86D17958E,Connections and Applications,Visual & Performing Arts (2001-2019),TK,,,California,2001,http://www.cde.ca.gov/be/st/ss/documents/vpastandards.pdf
FB705210DFE30131956668A86D17958E,"Connections, Relationships, Applications - Connecting and Applying What Is Learned in the Visual Arts to Other Art Forms and Subject Areas and to Careers",Visual & Performing Arts (2001-2019),TK,,,California,2001,http://www.cde.ca.gov/be/st/ss/documents/vpastandards.pdf
FB700730DFE30131956568A86D17958E,"Give reasons why they like a particular work of art they made, using appropriate art vocabulary.",Visual & Performing Arts (2001-2019),TK,,,California,2001,http://www.cde.ca.gov/be/st/ss/documents/vpastandards.pdf
FB6FB770DFE30131956468A86D17958E,Discuss how and why they made a specific work of art.,Visual & Performing Arts (2001-2019),TK,,,California,2001,http://www.cde.ca.gov/be/st/ss/documents/vpastandards.pdf
FB6F7370DFE30131956368A86D17958E,Make Informed Judgments,Visual & Performing Arts (2001-2019),TK,,,California,2001,http://www.cde.ca.gov/be/st/ss/documents/vpastandards.pdf
