Standard_ID,Standard_Text,Subject,Grade_Level,Range,Interdisciplinary,Framework_Type,Adoption_Date,Source_URL
CCSS.Math.Content.5.MD.C.5,Relate volume to the operations of multiplication and addition and solve real world and mathematical problems involving volume.,Mathematics,Grade_05,,,Common Core State Standards,2010,http://www.corestandards.org/assets/CCSSI_Math%20Standards.pdf
CCSS.Math.Content.5.MD.C.4,"Measure volumes by counting unit cubes, using cubic cm, cubic in, cubic ft, and improvised units.",Mathematics,Grade_05,,,Common Core State Standards,2010,http://www.corestandards.org/assets/CCSSI_Math%20Standards.pdf
CCSS.Math.Content.5.MD.C.3b,A solid figure which can be packed without gaps or overlaps using n unit cubes is said to have a volume of n cubic units.,Mathematics,Grade_05,,,Common Core State Standards,2010,http://www.corestandards.org/assets/CCSSI_Math%20Standards.pdf
CCSS.Math.Content.5.MD.C.3a,"A cube with side length 1 unit, called a ""unit cube,"" is said to have ""one cubic unit"" of volume, and can be used to measure volume.",Mathematics,Grade_05,,,Common Core State Standards,2010,http://www.corestandards.org/assets/CCSSI_Math%20Standards.pdf
CCSS.Math.Content.5.MD.C.3,Recognize volume as an attribute of solid figures and understand concepts of volume measurement.,Mathematics,Grade_05,,,Common Core State Standards,2010,http://www.corestandards.org/assets/CCSSI_Math%20Standards.pdf
CCSS.Math.Content.5.MD.C,Geometric measurement: understand concepts of volume and relate volume to multiplication and to addition.,Mathematics,Grade_05,,,Common Core State Standards,2010,http://www.corestandards.org/assets/CCSSI_Math%20Standards.pdf
CCSS.Math.Content.5.MD.B.2,"Make a line plot to display a data set of measurements in fractions of a unit (1/2, 1/4, 1/8). Use operations on fractions for this grade to solve problems involving information presented in line plots.",Mathematics,Grade_05,,,Common Core State Standards,2010,http://www.corestandards.org/assets/CCSSI_Math%20Standards.pdf
CCSS.Math.Content.5.MD.B,Represent and interpret data.,Mathematics,Grade_05,,,Common Core State Standards,2010,http://www.corestandards.org/assets/CCSSI_Math%20Standards.pdf
CCSS.Math.Content.5.MD.A.1,"Convert among different-sized standard measurement units within a given measurement system (e.g., convert 5 cm to 0.05 m), and use these conversions in solving multi-step, real world problems.",Mathematics,Grade_05,,,Common Core State Standards,2010,http://www.corestandards.org/assets/CCSSI_Math%20Standards.pdf
CCSS.Math.Content.5.MD.A,Convert like measurement units within a given measurement system.,Mathematics,Grade_05,,,Common Core State Standards,2010,http://www.corestandards.org/assets/CCSSI_Math%20Standards.pdf
D11AC510DFE401311CF968A86D17958E,Measurement and Data,Mathematics,Grade_05,,,Common Core State Standards,2010,http://www.corestandards.org/assets/CCSSI_Math%20Standards.pdf
CCSS.Math.Content.5.NBT.B.7,"Add, subtract, multiply, and divide decimals to hundredths, using concrete models or drawings and strategies based on place value, properties of operations, and/or the relationship between addition and subtraction; relate the strategy to a written method and explain the reasoning used.",Mathematics,Grade_05,,,Common Core State Standards,2010,http://www.corestandards.org/assets/CCSSI_Math%20Standards.pdf
CCSS.Math.Content.5.NBT.B.6,"Find whole-number quotients of whole numbers with up to four-digit dividends and two-digit divisors, using strategies based on place value, the properties of operations, and/or the relationship between multiplication and division. Illustrate and explain the calculation by using equations, rectangular arrays, and/or area models.",Mathematics,Grade_05,,,Common Core State Standards,2010,http://www.corestandards.org/assets/CCSSI_Math%20Standards.pdf
CCSS.Math.Content.5.NBT.B.5,Fluently multiply multi-digit whole numbers using the standard algorithm.,Mathematics,Grade_05,,,Common Core State Standards,2010,http://www.corestandards.org/assets/CCSSI_Math%20Standards.pdf
CCSS.Math.Content.5.NBT.B,Perform operations with multi-digit whole numbers and with decimals to hundredths.,Mathematics,Grade_05,,,Common Core State Standards,2010,http://www.corestandards.org/assets/CCSSI_Math%20Standards.pdf
CCSS.Math.Content.5.NBT.A.4,Use place value understanding to round decimals to any place.,Mathematics,Grade_05,,,Common Core State Standards,2010,http://www.corestandards.org/assets/CCSSI_Math%20Standards.pdf
CCSS.Math.Content.5.NBT.A.3b,"Compare two decimals to thousandths based on meanings of the digits in each place, using >, =, and < symbols to record the results of comparisons.",Mathematics,Grade_05,,,Common Core State Standards,2010,http://www.corestandards.org/assets/CCSSI_Math%20Standards.pdf
CCSS.Math.Content.5.NBT.A.3a,"Read and write decimals to thousandths using base-ten numerals, number names, and expanded form, e.g., 347.392 = 3 × 100 + 4 × 10 + 7 × 1 + 3 × (1/10) + 9 × (1/100) + 2 × (1/1000).",Mathematics,Grade_05,,,Common Core State Standards,2010,http://www.corestandards.org/assets/CCSSI_Math%20Standards.pdf
CCSS.Math.Content.5.NBT.A.3,"Read, write, and compare decimals to thousandths.",Mathematics,Grade_05,,,Common Core State Standards,2010,http://www.corestandards.org/assets/CCSSI_Math%20Standards.pdf
CCSS.Math.Content.5.NBT.A.2,"Explain patterns in the number of zeros of the product when multiplying a number by powers of 10, and explain patterns in the placement of the decimal point when a decimal is multiplied or divided by a power of 10. Use whole-number exponents to denote powers of 10.",Mathematics,Grade_05,,,Common Core State Standards,2010,http://www.corestandards.org/assets/CCSSI_Math%20Standards.pdf
CCSS.Math.Content.5.NBT.A.1,"Recognize that in a multi-digit number, a digit in one place represents 10 times as much as it represents in the place to its right and 1/10 of what it represents in the place to its left.",Mathematics,Grade_05,,,Common Core State Standards,2010,http://www.corestandards.org/assets/CCSSI_Math%20Standards.pdf
CCSS.Math.Content.5.NBT.A,Understand the place value system.,Mathematics,Grade_05,,,Common Core State Standards,2010,http://www.corestandards.org/assets/CCSSI_Math%20Standards.pdf
D11073F0DFE401311CF868A86D17958E,Number and Operations in Base Ten,Mathematics,Grade_05,,,Common Core State Standards,2010,http://www.corestandards.org/assets/CCSSI_Math%20Standards.pdf
CCSS.Math.Content.5.OA.B.3,"Generate two numerical patterns using two given rules. Identify apparent relationships between corresponding terms. Form ordered pairs consisting of corresponding terms from the two patterns, and graph the ordered pairs on a coordinate plane.",Mathematics,Grade_05,,,Common Core State Standards,2010,http://www.corestandards.org/assets/CCSSI_Math%20Standards.pdf
CCSS.Math.Content.5.OA.B,Analyze patterns and relationships.,Mathematics,Grade_05,,,Common Core State Standards,2010,http://www.corestandards.org/assets/CCSSI_Math%20Standards.pdf
CCSS.Math.Content.5.OA.A.2,"Write simple expressions that record calculations with numbers, and interpret numerical expressions without evaluating them.",Mathematics,Grade_05,,,Common Core State Standards,2010,http://www.corestandards.org/assets/CCSSI_Math%20Standards.pdf
CCSS.Math.Content.5.OA.A.1,"Use parentheses, brackets, or braces in numerical expressions, and evaluate expressions with these symbols.",Mathematics,Grade_05,,,Common Core State Standards,2010,http://www.corestandards.org/assets/CCSSI_Math%20Standards.pdf
CCSS.Math.Content.5.OA.A,Write and interpret numerical expressions.,Mathematics,Grade_05,,,Common Core State Standards,2010,http://www.corestandards.org/assets/CCSSI_Math%20Standards.pdf
D10DEE20DFE401311CF768A86D17958E,Operations and Algebraic Thinking,Mathematics,Grade_05,,,Common Core State Standards,2010,http://www.corestandards.org/assets/CCSSI_Math%20Standards.pdf
CCSS.Math.Practice.MP8,Look for and express regularity in repeated reasoning.,Mathematics,Grade_05,,,Common Core State Standards,2010,http://www.corestandards.org/assets/CCSSI_Math%20Standards.pdf
CCSS.Math.Practice.MP7,Look for and make use of structure.,Mathematics,Grade_05,,,Common Core State Standards,2010,http://www.corestandards.org/assets/CCSSI_Math%20Standards.pdf
CCSS.Math.Practice.MP6,Attend to precision.,Mathematics,Grade_05,,,Common Core State Standards,2010,http://www.corestandards.org/assets/CCSSI_Math%20Standards.pdf
CCSS.Math.Practice.MP5,Use appropriate tools strategically.,Mathematics,Grade_05,,,Common Core State Standards,2010,http://www.corestandards.org/assets/CCSSI_Math%20Standards.pdf
CCSS.Math.Practice.MP4,Model with mathematics.,Mathematics,Grade_05,,,Common Core State Standards,2010,http://www.corestandards.org/assets/CCSSI_Math%20Standards.pdf
CCSS.Math.Practice.MP3,Construct viable arguments and critique the reasoning of others.,Mathematics,Grade_05,,,Common Core State Standards,2010,http://www.corestandards.org/assets/CCSSI_Math%20Standards.pdf
CCSS.Math.Practice.MP2,Reason abstractly and quantitatively.,Mathematics,Grade_05,,,Common Core State Standards,2010,http://www.corestandards.org/assets/CCSSI_Math%20Standards.pdf
CCSS.Math.Practice.MP1,Make sense of problems and persevere in solving them.,Mathematics,Grade_05,,,Common Core State Standards,2010,http://www.corestandards.org/assets/CCSSI_Math%20Standards.pdf
D129C240DFE401311CFC68A86D17958E,Standards for Mathematical Practice,Mathematics,Grade_05,,,Common Core State Standards,2010,http://www.corestandards.org/assets/CCSSI_Math%20Standards.pdf
