Standard_ID,Standard_Text,Subject,Grade_Level,Range,Interdisciplinary,Framework_Type,Adoption_Date,Source_URL
ELD.PI.5.5.Br,"Demonstrate active listening of read-alouds and oral presentations by asking and answering detailed questions, with minimal prompting and light support.",English Language Development (2012-),Grade_05,,,California,2012,http://www.cde.ca.gov/sp/el/er/documents/eldstndspublication14.pdf
ELD.PI.5.5.Ex,"Demonstrate active listening of read-alouds and oral presentations by asking and answering detailed questions, with occasional prompting and moderate support.",English Language Development (2012-),Grade_05,,,California,2012,http://www.cde.ca.gov/sp/el/er/documents/eldstndspublication14.pdf
ELD.PI.5.5.Em,"Demonstrate active listening of read-alouds and oral presentations by asking and answering basic questions, with prompting and substantial support.",English Language Development (2012-),Grade_05,,,California,2012,http://www.cde.ca.gov/sp/el/er/documents/eldstndspublication14.pdf
7136ABE86886498EA5D1BC4B3F3038C3,Listening actively to spoken English in a range of social and academic contexts,English Language Development (2012-),Grade_05,,,California,2012,http://www.cde.ca.gov/sp/el/er/documents/eldstndspublication14.pdf
8CDDAF7D89F54557A9B679DCE1567EF0,Interpretive (comprehension and analysis of written and spoken texts),English Language Development (2012-),Grade_05,,,California,2012,http://www.cde.ca.gov/sp/el/er/documents/eldstndspublication14.pdf
ELD.PI.5.4.Br,"Adjust language choices according to purpose, task (e.g., facilitating a science experiment), and audience, with light support.",English Language Development (2012-),Grade_05,,,California,2012,http://www.cde.ca.gov/sp/el/er/documents/eldstndspublication14.pdf
ELD.PI.5.4.Ex,"Adjust language choices according to purpose (e.g., persuading, entertaining), task (e.g., telling a story versus explaining a science experiment), and audience, with moderate support.",English Language Development (2012-),Grade_05,,,California,2012,http://www.cde.ca.gov/sp/el/er/documents/eldstndspublication14.pdf
ELD.PI.5.4.Em,"Adjust language choices according to social setting (e.g., playground, classroom) and audience (e.g., peers, teacher), with substantial support.",English Language Development (2012-),Grade_05,,,California,2012,http://www.cde.ca.gov/sp/el/er/documents/eldstndspublication14.pdf
747BFF97CC9548F88B5A92BCECC91BB8,"Adapting language choices to various contexts (based on task, purpose, audience, and text type)",English Language Development (2012-),Grade_05,,,California,2012,http://www.cde.ca.gov/sp/el/er/documents/eldstndspublication14.pdf
ELD.PI.5.3.Br,"Negotiate with or persuade others in conversations using a variety of learned phrases (e.g., That's an interesting idea. However,…), as well as open responses, in order to gain and/or hold the floor, provide counterarguments, elaborate on an idea, and so on.",English Language Development (2012-),Grade_05,,,California,2012,http://www.cde.ca.gov/sp/el/er/documents/eldstndspublication14.pdf
ELD.PI.5.3.Ex,"Negotiate with or persuade others in conversations using an expanded set of learned phrases (e.g., I agree with X, but…), as well as open responses, in order to gain and/or hold the floor, provide counterarguments, and so on.",English Language Development (2012-),Grade_05,,,California,2012,http://www.cde.ca.gov/sp/el/er/documents/eldstndspublication14.pdf
ELD.PI.5.3.Em,"Negotiate with or persuade others in conversations using basic learned phrases (e.g., I think…), as well as open responses, in order to gain and/or hold the floor.",English Language Development (2012-),Grade_05,,,California,2012,http://www.cde.ca.gov/sp/el/er/documents/eldstndspublication14.pdf
53990D62EC1C408E9497AC48E7733D39,Offering and supporting opinions and negotiating with others in communicative exchanges,English Language Development (2012-),Grade_05,,,California,2012,http://www.cde.ca.gov/sp/el/er/documents/eldstndspublication14.pdf
ELD.PI.5.2.Br,"Collaborate with peers on joint writing projects of a variety of longer informational and literary texts, using technology where appropriate for publishing, graphics, and the like.",English Language Development (2012-),Grade_05,,,California,2012,http://www.cde.ca.gov/sp/el/er/documents/eldstndspublication14.pdf
ELD.PI.5.2.Ex,"Collaborate with peers on joint writing projects of longer informational and literary texts, using technology where appropriate for publishing, graphics, and the like.",English Language Development (2012-),Grade_05,,,California,2012,http://www.cde.ca.gov/sp/el/er/documents/eldstndspublication14.pdf
ELD.PI.5.2.Em,"Collaborate with peers on joint writing projects of short informational and literary texts, using technology where appropriate for publishing, graphics, and the like.",English Language Development (2012-),Grade_05,,,California,2012,http://www.cde.ca.gov/sp/el/er/documents/eldstndspublication14.pdf
1286F61CCD49476885A73182540563F9,"Interacting with others in written English in various communicative forms (print, communicative technology, and multimedia)",English Language Development (2012-),Grade_05,,,California,2012,http://www.cde.ca.gov/sp/el/er/documents/eldstndspublication14.pdf
ELD.PI.5.1.Br,"Contribute to class, group, and partner discussions, including sustained dialogue, by following turn-taking rules, asking relevant questions, affirming others, adding relevant information, building on responses, and providing useful feedback.",English Language Development (2012-),Grade_05,,,California,2012,http://www.cde.ca.gov/sp/el/er/documents/eldstndspublication14.pdf
ELD.PI.5.1.Ex,"Contribute to class, group, and partner discussions, including sustained dialogue, by following turn-taking rules, asking relevant questions, affirming others, and adding relevant information.",English Language Development (2012-),Grade_05,,,California,2012,http://www.cde.ca.gov/sp/el/er/documents/eldstndspublication14.pdf
ELD.PI.5.1.Em,Contribute to conversations and express ideas by asking and answering yes-no and wh- questions and responding using short phrases.,English Language Development (2012-),Grade_05,,,California,2012,http://www.cde.ca.gov/sp/el/er/documents/eldstndspublication14.pdf
99E25E64CAB043AF8237850C82BC03CC,Exchanging information and ideas with others through oral collaborative conversations on a range of social and academic topics,English Language Development (2012-),Grade_05,,,California,2012,http://www.cde.ca.gov/sp/el/er/documents/eldstndspublication14.pdf
676FA2C1D22B46A0A97B77C28BE53FB6,Collaborative (engagement in dialogue with others),English Language Development (2012-),Grade_05,,,California,2012,http://www.cde.ca.gov/sp/el/er/documents/eldstndspublication14.pdf
B909FCF37F864FB0A89F43D7ADC93F2A,Interacting in Meaningful Ways,English Language Development (2012-),Grade_05,,,California,2012,http://www.cde.ca.gov/sp/el/er/documents/eldstndspublication14.pdf
