Standard_ID,Standard_Text,Subject,Grade_Level,Range,Interdisciplinary,Framework_Type,Adoption_Date,Source_URL
5.NF.7.c,"Solve real world problems involving division of unit fractions by non-zero whole numbers and division of whole numbers by unit fractions, e.g., by using visual fraction models and equations to represent the problem.",Mathematics,Grade_05,,,California,2010,http://www.cde.ca.gov/be/st/ss/documents/ccssmathstandardaug2013.pdf
5.NF.7.b,"Interpret division of a whole number by a unit fraction, and compute such quotients.",Mathematics,Grade_05,,,California,2010,http://www.cde.ca.gov/be/st/ss/documents/ccssmathstandardaug2013.pdf
5.NF.7.a,"Interpret division of a unit fraction by a non-zero whole number, and compute such quotients.",Mathematics,Grade_05,,,California,2010,http://www.cde.ca.gov/be/st/ss/documents/ccssmathstandardaug2013.pdf
5.NF.7,Apply and extend previous understandings of division to divide unit fractions by whole numbers and whole numbers by unit fractions.,Mathematics,Grade_05,,,California,2010,http://www.cde.ca.gov/be/st/ss/documents/ccssmathstandardaug2013.pdf
5.NF.6,"Solve real world problems involving multiplication of fractions and mixed numbers, e.g., by using visual fraction models or equations to represent the problem.",Mathematics,Grade_05,,,California,2010,http://www.cde.ca.gov/be/st/ss/documents/ccssmathstandardaug2013.pdf
5.NF.5.b,Explaining why multiplying a given number by a fraction greater than 1 results in a product greater than the given number (recognizing multiplication by whole numbers greater than 1 as a familiar case); explaining why multiplying a given number by a fraction less than 1 results in a product smaller than the given number; and relating the principle of fraction equivalence a/b = (n×a)/(n×b) to the effect of multiplying a/b by 1.,Mathematics,Grade_05,,,California,2010,http://www.cde.ca.gov/be/st/ss/documents/ccssmathstandardaug2013.pdf
5.NF.5.a,"Comparing the size of a product to the size of one factor on the basis of the size of the other factor, without performing the indicated multiplication.",Mathematics,Grade_05,,,California,2010,http://www.cde.ca.gov/be/st/ss/documents/ccssmathstandardaug2013.pdf
5.NF.5,"Interpret multiplication as scaling (resizing), by:",Mathematics,Grade_05,,,California,2010,http://www.cde.ca.gov/be/st/ss/documents/ccssmathstandardaug2013.pdf
5.NF.4.b,"Find the area of a rectangle with fractional side lengths by tiling it with unit squares of the appropriate unit fraction side lengths, and show that the area is the same as would be found by multiplying the side lengths. Multiply fractional side lengths to find areas of rectangles, and represent fraction products as rectangular areas.",Mathematics,Grade_05,,,California,2010,http://www.cde.ca.gov/be/st/ss/documents/ccssmathstandardaug2013.pdf
5.NF.4.a,"Interpret the product (a/b) × q as a parts of a partition of q into b equal parts; equivalently, as the result of a sequence of operations a × q ÷ b.",Mathematics,Grade_05,,,California,2010,http://www.cde.ca.gov/be/st/ss/documents/ccssmathstandardaug2013.pdf
5.NF.4,Apply and extend previous understandings of multiplication to multiply a fraction or whole number by a fraction.,Mathematics,Grade_05,,,California,2010,http://www.cde.ca.gov/be/st/ss/documents/ccssmathstandardaug2013.pdf
5.NF.3,"Interpret a fraction as division of the numerator by the denominator (a/b = a ÷ b). Solve word problems involving division of whole numbers leading to answers in the form of fractions or mixed numbers, e.g., by using visual fraction models or equations to represent the problem.",Mathematics,Grade_05,,,California,2010,http://www.cde.ca.gov/be/st/ss/documents/ccssmathstandardaug2013.pdf
5.NF.B,Apply and extend previous understandings of multiplication and division to multiply and divide fractions.,Mathematics,Grade_05,,,California,2010,http://www.cde.ca.gov/be/st/ss/documents/ccssmathstandardaug2013.pdf
5.NF.2,"Solve word problems involving addition and subtraction of fractions referring to the same whole, including cases of unlike denominators, e.g., by using visual fraction models or equations to represent the problem. Use benchmark fractions and number sense of fractions to estimate mentally and assess the reasonableness of answers.",Mathematics,Grade_05,,,California,2010,http://www.cde.ca.gov/be/st/ss/documents/ccssmathstandardaug2013.pdf
5.NF.1,Add and subtract fractions with unlike denominators (including mixed numbers) by replacing given fractions with equivalent fractions in such a way as to produce an equivalent sum or difference of fractions with like denominators.,Mathematics,Grade_05,,,California,2010,http://www.cde.ca.gov/be/st/ss/documents/ccssmathstandardaug2013.pdf
5.NF.A,Use equivalent fractions as a strategy to add and subtract fractions.,Mathematics,Grade_05,,,California,2010,http://www.cde.ca.gov/be/st/ss/documents/ccssmathstandardaug2013.pdf
B5E220FBCB3346B8ACAEFF67B5C86D19,Number and Operations—Fractions,Mathematics,Grade_05,,,California,2010,http://www.cde.ca.gov/be/st/ss/documents/ccssmathstandardaug2013.pdf
5.G.4,Classify two-dimensional figures in a hierarchy based on properties.,Mathematics,Grade_05,,,California,2010,http://www.cde.ca.gov/be/st/ss/documents/ccssmathstandardaug2013.pdf
5.G.3,Understand that attributes belonging to a category of two-dimensional figures also belong to all subcategories of that category.,Mathematics,Grade_05,,,California,2010,http://www.cde.ca.gov/be/st/ss/documents/ccssmathstandardaug2013.pdf
5.G.B,Classify two-dimensional figures into categories based on their properties.,Mathematics,Grade_05,,,California,2010,http://www.cde.ca.gov/be/st/ss/documents/ccssmathstandardaug2013.pdf
5.G.2,"Represent real world and mathematical problems by graphing points in the first quadrant of the coordinate plane, and interpret coordinate values of points in the context of the situation.",Mathematics,Grade_05,,,California,2010,http://www.cde.ca.gov/be/st/ss/documents/ccssmathstandardaug2013.pdf
5.G.1,"Use a pair of perpendicular number lines, called axes, to define a coordinate system, with the intersection of the lines (the origin) arranged to coincide with the 0 on each line and a given point in the plane located by using an ordered pair of numbers, called its coordinates. Understand that the first number indicates how far to travel from the origin in the direction of one axis, and the second number indicates how far to travel in the direction of the second axis, with the convention that the names of the two axes and the coordinates correspond (e.g., x-axis and x-coordinate, y-axis and y-coordinate).",Mathematics,Grade_05,,,California,2010,http://www.cde.ca.gov/be/st/ss/documents/ccssmathstandardaug2013.pdf
5.G.A,Graph points on the coordinate plane to solve real-world and mathematical problems.,Mathematics,Grade_05,,,California,2010,http://www.cde.ca.gov/be/st/ss/documents/ccssmathstandardaug2013.pdf
0FD11FDC5A134383B85C553BB511FC93,Geometry,Mathematics,Grade_05,,,California,2010,http://www.cde.ca.gov/be/st/ss/documents/ccssmathstandardaug2013.pdf
5.MD.5.c,"Recognize volume as additive. Find volumes of solid figures composed of two non-overlapping right rectangular prisms by adding the volumes of the non-overlapping parts, applying this technique to solve real world problems.",Mathematics,Grade_05,,,California,2010,http://www.cde.ca.gov/be/st/ss/documents/ccssmathstandardaug2013.pdf
5.MD.5.b,Apply the formulas V = l × w × h and V = b × h for rectangular prisms to find volumes of right rectangular prisms with whole-number edge lengths in the context of solving real world and mathematical problems.,Mathematics,Grade_05,,,California,2010,http://www.cde.ca.gov/be/st/ss/documents/ccssmathstandardaug2013.pdf
5.MD.5.a,"Find the volume of a right rectangular prism with whole-number side lengths by packing it with unit cubes, and show that the volume is the same as would be found by multiplying the edge lengths, equivalently by multiplying the height by the area of the base. Represent threefold whole-number products as volumes, e.g., to represent the associative property of multiplication.",Mathematics,Grade_05,,,California,2010,http://www.cde.ca.gov/be/st/ss/documents/ccssmathstandardaug2013.pdf
5.MD.5,Relate volume to the operations of multiplication and addition and solve real world and mathematical problems involving volume.,Mathematics,Grade_05,,,California,2010,http://www.cde.ca.gov/be/st/ss/documents/ccssmathstandardaug2013.pdf
5.MD.4,"Measure volumes by counting unit cubes, using cubic cm, cubic in, cubic ft, and improvised units.",Mathematics,Grade_05,,,California,2010,http://www.cde.ca.gov/be/st/ss/documents/ccssmathstandardaug2013.pdf
5.MD.3.b,A solid figure which can be packed without gaps or overlaps using n unit cubes is said to have a volume of n cubic units.,Mathematics,Grade_05,,,California,2010,http://www.cde.ca.gov/be/st/ss/documents/ccssmathstandardaug2013.pdf
5.MD.3.a,"A cube with side length 1 unit, called a ""unit cube,"" is said to have ""one cubic unit"" of volume, and can be used to measure volume.",Mathematics,Grade_05,,,California,2010,http://www.cde.ca.gov/be/st/ss/documents/ccssmathstandardaug2013.pdf
5.MD.3,Recognize volume as an attribute of solid figures and understand concepts of volume measurement.,Mathematics,Grade_05,,,California,2010,http://www.cde.ca.gov/be/st/ss/documents/ccssmathstandardaug2013.pdf
5.MD.C,Geometric measurement: understand concepts of volume and relate volume to multiplication and to addition.,Mathematics,Grade_05,,,California,2010,http://www.cde.ca.gov/be/st/ss/documents/ccssmathstandardaug2013.pdf
5.MD.2,"Make a line plot to display a data set of measurements in fractions of a unit (1/2, 1/4, 1/8). Use operations on fractions for this grade to solve problems involving information presented in line plots.",Mathematics,Grade_05,,,California,2010,http://www.cde.ca.gov/be/st/ss/documents/ccssmathstandardaug2013.pdf
5.MD.B,Represent and interpret data.,Mathematics,Grade_05,,,California,2010,http://www.cde.ca.gov/be/st/ss/documents/ccssmathstandardaug2013.pdf
5.MD.1,"Convert among different-sized standard measurement units within a given measurement system (e.g., convert 5 cm to 0.05 m), and use these conversions in solving multi-step, real world problems.",Mathematics,Grade_05,,,California,2010,http://www.cde.ca.gov/be/st/ss/documents/ccssmathstandardaug2013.pdf
5.MD.A,Convert like measurement units within a given measurement system.,Mathematics,Grade_05,,,California,2010,http://www.cde.ca.gov/be/st/ss/documents/ccssmathstandardaug2013.pdf
AC42B7F69F694968908A6E3E6F06D8AF,Measurement and Data,Mathematics,Grade_05,,,California,2010,http://www.cde.ca.gov/be/st/ss/documents/ccssmathstandardaug2013.pdf
5.NBT.7,"Add, subtract, multiply, and divide decimals to hundredths, using concrete models or drawings and strategies based on place value, properties of operations, and/or the relationship between addition and subtraction; relate the strategy to a written method and explain the reasoning used.",Mathematics,Grade_05,,,California,2010,http://www.cde.ca.gov/be/st/ss/documents/ccssmathstandardaug2013.pdf
5.NBT.6,"Find whole-number quotients of whole numbers with up to four-digit dividends and two-digit divisors, using strategies based on place value, the properties of operations, and/or the relationship between multiplication and division. Illustrate and explain the calculation by using equations, rectangular arrays, and/or area models.",Mathematics,Grade_05,,,California,2010,http://www.cde.ca.gov/be/st/ss/documents/ccssmathstandardaug2013.pdf
5.NBT.5,Fluently multiply multi-digit whole numbers using the standard algorithm.,Mathematics,Grade_05,,,California,2010,http://www.cde.ca.gov/be/st/ss/documents/ccssmathstandardaug2013.pdf
5.NBT.B,Perform operations with multi-digit whole numbers and with decimals to hundredths.,Mathematics,Grade_05,,,California,2010,http://www.cde.ca.gov/be/st/ss/documents/ccssmathstandardaug2013.pdf
5.NBT.4,Use place value understanding to round decimals to any place.,Mathematics,Grade_05,,,California,2010,http://www.cde.ca.gov/be/st/ss/documents/ccssmathstandardaug2013.pdf
5.NBT.3.b,"Compare two decimals to thousandths based on meanings of the digits in each place, using >, =, and < symbols to record the results of comparisons.",Mathematics,Grade_05,,,California,2010,http://www.cde.ca.gov/be/st/ss/documents/ccssmathstandardaug2013.pdf
5.NBT.3.a,"Read and write decimals to thousandths using base-ten numerals, number names, and expanded form, e.g., 347.392 = 3 × 100 + 4 × 10 + 7 × 1 + 3 × (1/10) + 9 × (1/100) + 2 × (1/1000).",Mathematics,Grade_05,,,California,2010,http://www.cde.ca.gov/be/st/ss/documents/ccssmathstandardaug2013.pdf
5.NBT.3,"Read, write, and compare decimals to thousandths.",Mathematics,Grade_05,,,California,2010,http://www.cde.ca.gov/be/st/ss/documents/ccssmathstandardaug2013.pdf
5.NBT.2,"Explain patterns in the number of zeros of the product when multiplying a number by powers of 10, and explain patterns in the placement of the decimal point when a decimal is multiplied or divided by a power of 10. Use whole-number exponents to denote powers of 10.",Mathematics,Grade_05,,,California,2010,http://www.cde.ca.gov/be/st/ss/documents/ccssmathstandardaug2013.pdf
5.NBT.1,"Recognize that in a multi-digit number, a digit in one place represents 10 times as much as it represents in the place to its right and 1/10 of what it represents in the place to its left.",Mathematics,Grade_05,,,California,2010,http://www.cde.ca.gov/be/st/ss/documents/ccssmathstandardaug2013.pdf
5.NBT.A,Understand the place value system.,Mathematics,Grade_05,,,California,2010,http://www.cde.ca.gov/be/st/ss/documents/ccssmathstandardaug2013.pdf
20E71FDB72F243B6B7CB4D2CB51ED1E7,Number and Operations in Base Ten,Mathematics,Grade_05,,,California,2010,http://www.cde.ca.gov/be/st/ss/documents/ccssmathstandardaug2013.pdf
5.OA.3,"Generate two numerical patterns using two given rules. Identify apparent relationships between corresponding terms. Form ordered pairs consisting of corresponding terms from the two patterns, and graph the ordered pairs on a coordinate plane.",Mathematics,Grade_05,,,California,2010,http://www.cde.ca.gov/be/st/ss/documents/ccssmathstandardaug2013.pdf
5.OA.B,Analyze patterns and relationships.,Mathematics,Grade_05,,,California,2010,http://www.cde.ca.gov/be/st/ss/documents/ccssmathstandardaug2013.pdf
5.OA.2.1,"Express a whole number in the range 2–50 as a product of its prime factors. For example, find the prime factors of 24 and express 24 as 2 × 2 × 2 × 3.",Mathematics,Grade_05,,,California,2010,http://www.cde.ca.gov/be/st/ss/documents/ccssmathstandardaug2013.pdf
5.OA.2,"Write simple expressions that record calculations with numbers, and interpret numerical expressions without evaluating them.",Mathematics,Grade_05,,,California,2010,http://www.cde.ca.gov/be/st/ss/documents/ccssmathstandardaug2013.pdf
5.OA.1,"Use parentheses, brackets, or braces in numerical expressions, and evaluate expressions with these symbols.",Mathematics,Grade_05,,,California,2010,http://www.cde.ca.gov/be/st/ss/documents/ccssmathstandardaug2013.pdf
5.OA.A,Write and interpret numerical expressions.,Mathematics,Grade_05,,,California,2010,http://www.cde.ca.gov/be/st/ss/documents/ccssmathstandardaug2013.pdf
FCA9958AB2244318A0FE317C75385E86,Operations and Algebraic Thinking,Mathematics,Grade_05,,,California,2010,http://www.cde.ca.gov/be/st/ss/documents/ccssmathstandardaug2013.pdf
MP.8,Look for and express regularity in repeated reasoning.,Mathematics,Grade_05,,,California,2010,http://www.cde.ca.gov/be/st/ss/documents/ccssmathstandardaug2013.pdf
MP.7,Look for and make use of structure.,Mathematics,Grade_05,,,California,2010,http://www.cde.ca.gov/be/st/ss/documents/ccssmathstandardaug2013.pdf
MP.6,Attend to precision.,Mathematics,Grade_05,,,California,2010,http://www.cde.ca.gov/be/st/ss/documents/ccssmathstandardaug2013.pdf
MP.5,Use appropriate tools strategically.,Mathematics,Grade_05,,,California,2010,http://www.cde.ca.gov/be/st/ss/documents/ccssmathstandardaug2013.pdf
MP.4,Model with mathematics.,Mathematics,Grade_05,,,California,2010,http://www.cde.ca.gov/be/st/ss/documents/ccssmathstandardaug2013.pdf
MP.3,Construct viable arguments and critique the reasoning of others.,Mathematics,Grade_05,,,California,2010,http://www.cde.ca.gov/be/st/ss/documents/ccssmathstandardaug2013.pdf
MP.2,Reason abstractly and quantitatively.,Mathematics,Grade_05,,,California,2010,http://www.cde.ca.gov/be/st/ss/documents/ccssmathstandardaug2013.pdf
MP.1,Make sense of problems and persevere in solving them.,Mathematics,Grade_05,,,California,2010,http://www.cde.ca.gov/be/st/ss/documents/ccssmathstandardaug2013.pdf
7D4BB5D72DB04CFD94550E0025501329,Standards for Mathematical Practice,Mathematics,Grade_05,,,California,2010,http://www.cde.ca.gov/be/st/ss/documents/ccssmathstandardaug2013.pdf
CCSS.Math.Content.5.NF.B.7c,"Solve real world problems involving division of unit fractions by non-zero whole numbers and division of whole numbers by unit fractions, e.g., by using visual fraction models and equations to represent the problem.",Mathematics,Grade_05,,,Common Core State Standards,2010,http://www.corestandards.org/assets/CCSSI_Math%20Standards.pdf
CCSS.Math.Content.5.NF.B.7b,"Interpret division of a whole number by a unit fraction, and compute such quotients.",Mathematics,Grade_05,,,Common Core State Standards,2010,http://www.corestandards.org/assets/CCSSI_Math%20Standards.pdf
CCSS.Math.Content.5.NF.B.7a,"Interpret division of a unit fraction by a non-zero whole number, and compute such quotients.",Mathematics,Grade_05,,,Common Core State Standards,2010,http://www.corestandards.org/assets/CCSSI_Math%20Standards.pdf
CCSS.Math.Content.5.NF.B.7,Apply and extend previous understandings of division to divide unit fractions by whole numbers and whole numbers by unit fractions.,Mathematics,Grade_05,,,Common Core State Standards,2010,http://www.corestandards.org/assets/CCSSI_Math%20Standards.pdf
CCSS.Math.Content.5.NF.B.6,"Solve real world problems involving multiplication of fractions and mixed numbers, e.g., by using visual fraction models or equations to represent the problem.",Mathematics,Grade_05,,,Common Core State Standards,2010,http://www.corestandards.org/assets/CCSSI_Math%20Standards.pdf
CCSS.Math.Content.5.NF.B.5b,Explaining why multiplying a given number by a fraction greater than 1 results in a product greater than the given number (recognizing multiplication by whole numbers greater than 1 as a familiar case); explaining why multiplying a given number by a fraction less than 1 results in a product smaller than the given number; and relating the principle of fraction equivalence a/b = (n×a)/(n×b) to the effect of multiplying a/b by 1.,Mathematics,Grade_05,,,Common Core State Standards,2010,http://www.corestandards.org/assets/CCSSI_Math%20Standards.pdf
CCSS.Math.Content.5.NF.B.5a,"Comparing the size of a product to the size of one factor on the basis of the size of the other factor, without performing the indicated multiplication.",Mathematics,Grade_05,,,Common Core State Standards,2010,http://www.corestandards.org/assets/CCSSI_Math%20Standards.pdf
CCSS.Math.Content.5.NF.B.5,"Interpret multiplication as scaling (resizing), by:",Mathematics,Grade_05,,,Common Core State Standards,2010,http://www.corestandards.org/assets/CCSSI_Math%20Standards.pdf
CCSS.Math.Content.5.NF.B.4b,"Find the area of a rectangle with fractional side lengths by tiling it with unit squares of the appropriate unit fraction side lengths, and show that the area is the same as would be found by multiplying the side lengths. Multiply fractional side lengths to find areas of rectangles, and represent fraction products as rectangular areas.",Mathematics,Grade_05,,,Common Core State Standards,2010,http://www.corestandards.org/assets/CCSSI_Math%20Standards.pdf
CCSS.Math.Content.5.NF.B.4a,"Interpret the product (a/b) × q as a parts of a partition of q into b equal parts; equivalently, as the result of a sequence of operations a × q ÷ b.",Mathematics,Grade_05,,,Common Core State Standards,2010,http://www.corestandards.org/assets/CCSSI_Math%20Standards.pdf
CCSS.Math.Content.5.NF.B.4,Apply and extend previous understandings of multiplication to multiply a fraction or whole number by a fraction.,Mathematics,Grade_05,,,Common Core State Standards,2010,http://www.corestandards.org/assets/CCSSI_Math%20Standards.pdf
CCSS.Math.Content.5.NF.B.3,"Interpret a fraction as division of the numerator by the denominator (a/b = a ÷ b). Solve word problems involving division of whole numbers leading to answers in the form of fractions or mixed numbers, e.g., by using visual fraction models or equations to represent the problem.",Mathematics,Grade_05,,,Common Core State Standards,2010,http://www.corestandards.org/assets/CCSSI_Math%20Standards.pdf
CCSS.Math.Content.5.NF.B,Apply and extend previous understandings of multiplication and division to multiply and divide fractions.,Mathematics,Grade_05,,,Common Core State Standards,2010,http://www.corestandards.org/assets/CCSSI_Math%20Standards.pdf
CCSS.Math.Content.5.NF.A.2,"Solve word problems involving addition and subtraction of fractions referring to the same whole, including cases of unlike denominators, e.g., by using visual fraction models or equations to represent the problem. Use benchmark fractions and number sense of fractions to estimate mentally and assess the reasonableness of answers.",Mathematics,Grade_05,,,Common Core State Standards,2010,http://www.corestandards.org/assets/CCSSI_Math%20Standards.pdf
CCSS.Math.Content.5.NF.A.1,Add and subtract fractions with unlike denominators (including mixed numbers) by replacing given fractions with equivalent fractions in such a way as to produce an equivalent sum or difference of fractions with like denominators.,Mathematics,Grade_05,,,Common Core State Standards,2010,http://www.corestandards.org/assets/CCSSI_Math%20Standards.pdf
CCSS.Math.Content.5.NF.A,Use equivalent fractions as a strategy to add and subtract fractions.,Mathematics,Grade_05,,,Common Core State Standards,2010,http://www.corestandards.org/assets/CCSSI_Math%20Standards.pdf
D1231310DFE401311CFB68A86D17958E,Number and Operations—Fractions,Mathematics,Grade_05,,,Common Core State Standards,2010,http://www.corestandards.org/assets/CCSSI_Math%20Standards.pdf
CCSS.Math.Content.5.G.B.4,Classify two-dimensional figures in a hierarchy based on properties.,Mathematics,Grade_05,,,Common Core State Standards,2010,http://www.corestandards.org/assets/CCSSI_Math%20Standards.pdf
CCSS.Math.Content.5.G.B.3,Understand that attributes belonging to a category of two-dimensional figures also belong to all subcategories of that category.,Mathematics,Grade_05,,,Common Core State Standards,2010,http://www.corestandards.org/assets/CCSSI_Math%20Standards.pdf
CCSS.Math.Content.5.G.B,Classify two-dimensional figures into categories based on their properties.,Mathematics,Grade_05,,,Common Core State Standards,2010,http://www.corestandards.org/assets/CCSSI_Math%20Standards.pdf
CCSS.Math.Content.5.G.A.2,"Represent real world and mathematical problems by graphing points in the first quadrant of the coordinate plane, and interpret coordinate values of points in the context of the situation.",Mathematics,Grade_05,,,Common Core State Standards,2010,http://www.corestandards.org/assets/CCSSI_Math%20Standards.pdf
CCSS.Math.Content.5.G.A.1,"Use a pair of perpendicular number lines, called axes, to define a coordinate system, with the intersection of the lines (the origin) arranged to coincide with the 0 on each line and a given point in the plane located by using an ordered pair of numbers, called its coordinates. Understand that the first number indicates how far to travel from the origin in the direction of one axis, and the second number indicates how far to travel in the direction of the second axis, with the convention that the names of the two axes and the coordinates correspond (e.g., x-axis and x-coordinate, y-axis and y-coordinate).",Mathematics,Grade_05,,,Common Core State Standards,2010,http://www.corestandards.org/assets/CCSSI_Math%20Standards.pdf
CCSS.Math.Content.5.G.A,Graph points on the coordinate plane to solve real-world and mathematical problems.,Mathematics,Grade_05,,,Common Core State Standards,2010,http://www.corestandards.org/assets/CCSSI_Math%20Standards.pdf
D1202CA0DFE401311CFA68A86D17958E,Geometry,Mathematics,Grade_05,,,Common Core State Standards,2010,http://www.corestandards.org/assets/CCSSI_Math%20Standards.pdf
CCSS.Math.Content.5.MD.C.5c,"Recognize volume as additive. Find volumes of solid figures composed of two non-overlapping right rectangular prisms by adding the volumes of the non-overlapping parts, applying this technique to solve real world problems.",Mathematics,Grade_05,,,Common Core State Standards,2010,http://www.corestandards.org/assets/CCSSI_Math%20Standards.pdf
CCSS.Math.Content.5.MD.C.5b,Apply the formulas V = l × w × h and V = b × h for rectangular prisms to find volumes of right rectangular prisms with whole-number edge lengths in the context of solving real world and mathematical problems.,Mathematics,Grade_05,,,Common Core State Standards,2010,http://www.corestandards.org/assets/CCSSI_Math%20Standards.pdf
CCSS.Math.Content.5.MD.C.5a,"Find the volume of a right rectangular prism with whole-number side lengths by packing it with unit cubes, and show that the volume is the same as would be found by multiplying the edge lengths, equivalently by multiplying the height by the area of the base. Represent threefold whole-number products as volumes, e.g., to represent the associative property of multiplication.",Mathematics,Grade_05,,,Common Core State Standards,2010,http://www.corestandards.org/assets/CCSSI_Math%20Standards.pdf
