Standard_ID,Standard_Text,Subject,Grade_Level,Range,Interdisciplinary,Framework_Type,Adoption_Date,Source_URL
ELD.PII.5.7.Br,"Condense clauses in a variety of ways (e.g., through various types of embedded clauses and some nominalizations as in, They were a very strong army. They had a lot of enemies. They crushed their enemies because they were strong. → Their strength helped them crush their numerous enemies) to create precise and detailed sentences.",English Language Development (2012-),Grade_05,,,California,2012,http://www.cde.ca.gov/sp/el/er/documents/eldstndspublication14.pdf
ELD.PII.5.7.Ex,"Condense clauses in an increasing variety of ways (e.g., through a growing number of types of embedded clauses and other condensing as in, The book is mine. The book is about science. The book is on the desk. → The science book that's on the desk is mine) to create precise and detailed sentences.",English Language Development (2012-),Grade_05,,,California,2012,http://www.cde.ca.gov/sp/el/er/documents/eldstndspublication14.pdf
ELD.PII.5.7.Em,"Condense clauses in simple ways (e.g., through simple embedded clauses as in, The book is on the desk. The book is mine. → The book that is on the desk is mine) to create precise and detailed sentences.",English Language Development (2012-),Grade_05,,,California,2012,http://www.cde.ca.gov/sp/el/er/documents/eldstndspublication14.pdf
011733FA206E46C08AC0FA4C719E4369,Condensing ideas,English Language Development (2012-),Grade_05,,,California,2012,http://www.cde.ca.gov/sp/el/er/documents/eldstndspublication14.pdf
ELD.PII.5.6.Br,"Combine clauses in a wide variety of ways (e.g., creating compound and complex sentences) to make connections between and join ideas, for example, to express cause/effect (e.g., The deer ran because the mountain lion approached them), to make a concession (e.g., She studied all night even though she wasn't feeling well), to link two ideas that happen at the same time (e.g., The cubs played while their mother hunted), or to provide reasons to support ideas (e.g., The author persuades the reader by ___).",English Language Development (2012-),Grade_05,,,California,2012,http://www.cde.ca.gov/sp/el/er/documents/eldstndspublication14.pdf
ELD.PII.5.6.Ex,"Combine clauses in an increasing variety of ways (e.g., creating compound and complex sentences) to make connections between and join ideas, for example, to express cause/effect (e.g., The deer ran because the mountain lion came), to make a concession (e.g., She studied all night even though she wasn't feeling well), or to provide reasons to support ideas (e.g., X is an extremely good book because ___).",English Language Development (2012-),Grade_05,,,California,2012,http://www.cde.ca.gov/sp/el/er/documents/eldstndspublication14.pdf
ELD.PII.5.6.Em,"Combine clauses in a few basic ways to make connections between and join ideas (e.g., You must X because X) or to provide evidence to support ideas or opinions (e.g., creating compound sentences using and, but, so).",English Language Development (2012-),Grade_05,,,California,2012,http://www.cde.ca.gov/sp/el/er/documents/eldstndspublication14.pdf
74218C91C8C646D9A15F909A606752E8,Connecting ideas,English Language Development (2012-),Grade_05,,,California,2012,http://www.cde.ca.gov/sp/el/er/documents/eldstndspublication14.pdf
A5B72685ABC64F89B17B40ECB9FDD89B,Connecting and Condensing Ideas,English Language Development (2012-),Grade_05,,,California,2012,http://www.cde.ca.gov/sp/el/er/documents/eldstndspublication14.pdf
ELD.PII.5.5.Br,"Expand and enrich sentences with adverbials (e.g., adverbs, adverb phrases, prepositional phrases) to provide details (e.g., time, manner, place, cause, and the like) about a variety of familiar and new activities and processes.",English Language Development (2012-),Grade_05,,,California,2012,http://www.cde.ca.gov/sp/el/er/documents/eldstndspublication14.pdf
ELD.PII.5.5.Ex,"Expand and enrich sentences with adverbials (e.g., adverbs, adverb phrases, prepositional phrases) to provide details (e.g., time, manner, place, cause, and the like) about a familiar or new activity or process.",English Language Development (2012-),Grade_05,,,California,2012,http://www.cde.ca.gov/sp/el/er/documents/eldstndspublication14.pdf
ELD.PII.5.5.Em,"Expand and enrich sentences with adverbials (e.g., adverbs, adverb phrases, prepositional phrases) to provide details (e.g., time, manner, place, cause, and the like) about a familiar activity or process.",English Language Development (2012-),Grade_05,,,California,2012,http://www.cde.ca.gov/sp/el/er/documents/eldstndspublication14.pdf
EE479DB7AFAC46DD994B70AFA73F6518,Modifying to add details,English Language Development (2012-),Grade_05,,,California,2012,http://www.cde.ca.gov/sp/el/er/documents/eldstndspublication14.pdf
ELD.PII.5.4.Br,"Expand noun phrases in an increasing variety of ways (e.g., adding comparative/superlative and general academic adjectives to noun phrases or more complex clause embedding) in order to enrich the meaning of sentences and add details about ideas, people, things, and the like.",English Language Development (2012-),Grade_05,,,California,2012,http://www.cde.ca.gov/sp/el/er/documents/eldstndspublication14.pdf
ELD.PII.5.4.Ex,"Expand noun phrases in a variety of ways (e.g., adding comparative/superlative adjectives to noun phrases or simple clause embedding) in order to enrich the meaning of sentences and add details about ideas, people, things, and the like.",English Language Development (2012-),Grade_05,,,California,2012,http://www.cde.ca.gov/sp/el/er/documents/eldstndspublication14.pdf
ELD.PII.5.4.Em,"Expand noun phrases in simple ways (e.g., adding an adjective to a noun) in order to enrich the meaning of sentences and add details about ideas, people, things, and the like.",English Language Development (2012-),Grade_05,,,California,2012,http://www.cde.ca.gov/sp/el/er/documents/eldstndspublication14.pdf
64FCC7F54AD0426EBC2E8119EA23299C,Using nouns and noun phrases,English Language Development (2012-),Grade_05,,,California,2012,http://www.cde.ca.gov/sp/el/er/documents/eldstndspublication14.pdf
ELD.PII.5.3.Br,"Use various verb types (e.g., doing, saying, being/having, thinking/feeling) and tenses appropriate to the task and text type (e.g., timeless present for science description, mixture of past and present for narrative or history explanation) on a variety of topics.",English Language Development (2012-),Grade_05,,,California,2012,http://www.cde.ca.gov/sp/el/er/documents/eldstndspublication14.pdf
ELD.PII.5.3.Ex,"Use various verb types (e.g., doing, saying, being/having, thinking/feeling) and tenses appropriate to the task, text type, and discipline (e.g., simple past for recounting an experience, timeless present for a science description) on an increasing variety of topics.",English Language Development (2012-),Grade_05,,,California,2012,http://www.cde.ca.gov/sp/el/er/documents/eldstndspublication14.pdf
ELD.PII.5.3.Em,"Use frequently used verbs (e.g., take, like, eat) and various verb types (e.g., doing, saying, being/having, thinking/feeling) and tenses appropriate to the text type and discipline (e.g., simple past for recounting an experience) on familiar topics.",English Language Development (2012-),Grade_05,,,California,2012,http://www.cde.ca.gov/sp/el/er/documents/eldstndspublication14.pdf
075313AE499C4C149757486A50415906,Using verbs and verb phrases,English Language Development (2012-),Grade_05,,,California,2012,http://www.cde.ca.gov/sp/el/er/documents/eldstndspublication14.pdf
6CB09A1771294357BB826DD58560DC2A,Expanding and Enriching Ideas,English Language Development (2012-),Grade_05,,,California,2012,http://www.cde.ca.gov/sp/el/er/documents/eldstndspublication14.pdf
ELD.PII.5.1b.Br,"Apply increasing understanding of how ideas, events, or reasons are linked throughout a text using an increasing variety of academic connecting and transitional words or phrases (e.g., consequently, specifically, however) to comprehending texts and writing cohesive texts.",English Language Development (2012-),Grade_05,,,California,2012,http://www.cde.ca.gov/sp/el/er/documents/eldstndspublication14.pdf
ELD.PII.5.1a.Br,"Apply increasing understanding of language resources for referring the reader back or forward in text (e.g., how pronouns, synonyms, or nominalizations refer back to nouns in text) to comprehending texts and writing cohesive texts.",English Language Development (2012-),Grade_05,,,California,2012,http://www.cde.ca.gov/sp/el/er/documents/eldstndspublication14.pdf
ELD.PII.5.1b.Ex,"Apply growing understanding of how ideas, events, or reasons are linked throughout a text using a variety of connecting words or phrases (e.g., for example, in the first place, as a result) to comprehending texts and writing texts with increasing cohesion.",English Language Development (2012-),Grade_05,,,California,2012,http://www.cde.ca.gov/sp/el/er/documents/eldstndspublication14.pdf
ELD.PII.5.1a.Ex,"Apply growing understanding of language resources for referring the reader back or forward in text (e.g., how pronouns or synonyms refer back to nouns in text) to comprehending texts and writing texts with increasing cohesion.",English Language Development (2012-),Grade_05,,,California,2012,http://www.cde.ca.gov/sp/el/er/documents/eldstndspublication14.pdf
ELD.PII.5.1b.Em,"Apply basic understanding of how ideas, events, or reasons are linked throughout a text using a select set of everyday connecting words or phrases (e.g., first/next, at the beginning) to comprehending texts and writing basic texts.",English Language Development (2012-),Grade_05,,,California,2012,http://www.cde.ca.gov/sp/el/er/documents/eldstndspublication14.pdf
ELD.PII.5.1a.Em,"Apply basic understanding of language resources for referring the reader back or forward in text (e.g., how pronouns refer back to nouns in text) to comprehending texts and writing basic texts.",English Language Development (2012-),Grade_05,,,California,2012,http://www.cde.ca.gov/sp/el/er/documents/eldstndspublication14.pdf
158C8DC1040D469993C966A39B8FF2BF,Understanding cohesion,English Language Development (2012-),Grade_05,,,California,2012,http://www.cde.ca.gov/sp/el/er/documents/eldstndspublication14.pdf
ELD.PII.5.1.Br,"Apply increasing understanding of how different text types are organized to express ideas (e.g., how a historical account is organized chronologically versus how opinions/arguments are structured logically around reasons and evidence) to comprehending texts and writing cohesive texts.",English Language Development (2012-),Grade_05,,,California,2012,http://www.cde.ca.gov/sp/el/er/documents/eldstndspublication14.pdf
ELD.PII.5.1.Ex,"Apply growing understanding of how different text types are organized to express ideas (e.g., how a narrative is organized sequentially with predictable stages versus how opinions/arguments are structured logically around reasons and evidence) to comprehending texts and writing texts with increasing cohesion.",English Language Development (2012-),Grade_05,,,California,2012,http://www.cde.ca.gov/sp/el/er/documents/eldstndspublication14.pdf
ELD.PII.5.1.Em,"Apply basic understanding of how different text types are organized to express ideas (e.g., how a narrative is organized sequentially with predictable stages versus how opinions/arguments are organized around ideas) to comprehending texts and writing basic texts.",English Language Development (2012-),Grade_05,,,California,2012,http://www.cde.ca.gov/sp/el/er/documents/eldstndspublication14.pdf
5EA3288623074CA8872C47238E15E898,Understanding text structure,English Language Development (2012-),Grade_05,,,California,2012,http://www.cde.ca.gov/sp/el/er/documents/eldstndspublication14.pdf
C2671883351249EEACE43D5D4CD70104,Structuring Cohesive Texts,English Language Development (2012-),Grade_05,,,California,2012,http://www.cde.ca.gov/sp/el/er/documents/eldstndspublication14.pdf
A2C63D8FF726488488B5E07416B65970,Learning About How English Works,English Language Development (2012-),Grade_05,,,California,2012,http://www.cde.ca.gov/sp/el/er/documents/eldstndspublication14.pdf
ELD.PI.5.12b.Br,"Select a variety of appropriate affixes for accuracy and precision (e.g., She's walking. I'm uncomfortable. They left reluctantly).",English Language Development (2012-),Grade_05,,,California,2012,http://www.cde.ca.gov/sp/el/er/documents/eldstndspublication14.pdf
ELD.PI.5.12a.Br,"Use a wide variety of general academic and domain-specific words, synonyms, antonyms, and figurative language to create precision and shades of meaning while speaking and writing.",English Language Development (2012-),Grade_05,,,California,2012,http://www.cde.ca.gov/sp/el/er/documents/eldstndspublication14.pdf
ELD.PI.5.12b.Ex,"Select a growing number of frequently used affixes for accuracy and precision (e.g., She walked. He likes…, I'm unhappy).",English Language Development (2012-),Grade_05,,,California,2012,http://www.cde.ca.gov/sp/el/er/documents/eldstndspublication14.pdf
ELD.PI.5.12a.Ex,"Use a growing number of general academic and domain-specific words, synonyms, and antonyms to create precision and shades of meaning while speaking and writing.",English Language Development (2012-),Grade_05,,,California,2012,http://www.cde.ca.gov/sp/el/er/documents/eldstndspublication14.pdf
ELD.PI.5.12b.Em,"Select a few frequently used affixes for accuracy and precision (e.g., She walks, I'm unhappy).",English Language Development (2012-),Grade_05,,,California,2012,http://www.cde.ca.gov/sp/el/er/documents/eldstndspublication14.pdf
ELD.PI.5.12a.Em,Use a select number of general academic and domain-specific words to create precision while speaking and writing.,English Language Development (2012-),Grade_05,,,California,2012,http://www.cde.ca.gov/sp/el/er/documents/eldstndspublication14.pdf
E68FDA945496410F88DFFAC8B8E47E0A,Selecting and applying varied and precise vocabulary and language structures to effectively convey ideas,English Language Development (2012-),Grade_05,,,California,2012,http://www.cde.ca.gov/sp/el/er/documents/eldstndspublication14.pdf
ELD.PI.5.11b.Br,"Express attitude and opinions or temper statements with nuanced modal expressions (e.g., probably/certainly, should/would) and phrasing (e.g., In my opinion…).",English Language Development (2012-),Grade_05,,,California,2012,http://www.cde.ca.gov/sp/el/er/documents/eldstndspublication14.pdf
ELD.PI.5.11a.Br,"Support opinions or persuade others by expressing appropriate/accurate reasons using detailed textual evidence (e.g., quoting the text directly or specific events from text) or relevant background knowledge about content, with mild support.",English Language Development (2012-),Grade_05,,,California,2012,http://www.cde.ca.gov/sp/el/er/documents/eldstndspublication14.pdf
ELD.PI.5.11b.Ex,"Express attitude and opinions or temper statements with familiar modal expressions (e.g., maybe/probably, can/must).",English Language Development (2012-),Grade_05,,,California,2012,http://www.cde.ca.gov/sp/el/er/documents/eldstndspublication14.pdf
ELD.PI.5.11a.Ex,"Support opinions or persuade others by expressing appropriate/accurate reasons using some textual evidence (e.g., paraphrasing facts from a text) or relevant background knowledge about content, with moderate support.",English Language Development (2012-),Grade_05,,,California,2012,http://www.cde.ca.gov/sp/el/er/documents/eldstndspublication14.pdf
ELD.PI.5.11b.Em,"Express ideas and opinions or temper statements using basic modal expressions (e.g., can, has to, maybe).",English Language Development (2012-),Grade_05,,,California,2012,http://www.cde.ca.gov/sp/el/er/documents/eldstndspublication14.pdf
ELD.PI.5.11a.Em,"Support opinions by expressing appropriate/accurate reasons using textual evidence (e.g., referring to text) or relevant background knowledge about content, with substantial support.",English Language Development (2012-),Grade_05,,,California,2012,http://www.cde.ca.gov/sp/el/er/documents/eldstndspublication14.pdf
CE1E044EFC924E269251227298B2498C,Supporting own opinions and evaluating others' opinions in speaking and writing,English Language Development (2012-),Grade_05,,,California,2012,http://www.cde.ca.gov/sp/el/er/documents/eldstndspublication14.pdf
ELD.PI.5.10b.Br,"Write clear and coherent summaries of texts and experiences using complete and concise sentences and key words (e.g., from notes or graphic organizers).",English Language Development (2012-),Grade_05,,,California,2012,http://www.cde.ca.gov/sp/el/er/documents/eldstndspublication14.pdf
ELD.PI.5.10a.Br,"Write longer and more detailed literary and informational texts (e.g., an explanation of how camels survive without water for a long time) collaboratively (e.g., joint construction of texts with an adult or with peers) and independently by using appropriate text organization and growing understanding of register.",English Language Development (2012-),Grade_05,,,California,2012,http://www.cde.ca.gov/sp/el/er/documents/eldstndspublication14.pdf
ELD.PI.5.10b.Ex,"Write increasingly concise summaries of texts and experiences using complete sentences and key words (e.g., from notes or graphic organizers).",English Language Development (2012-),Grade_05,,,California,2012,http://www.cde.ca.gov/sp/el/er/documents/eldstndspublication14.pdf
ELD.PI.5.10a.Ex,"Write longer literary and informational texts (e.g., an informative report on different kinds of camels) collaboratively (e.g., joint construction of texts with an adult or with peers) and with increasing independence by using appropriate text organization.",English Language Development (2012-),Grade_05,,,California,2012,http://www.cde.ca.gov/sp/el/er/documents/eldstndspublication14.pdf
ELD.PI.5.10b.Em,"Write brief summaries of texts and experiences using complete sentences and key words (e.g., from notes or graphic organizers).",English Language Development (2012-),Grade_05,,,California,2012,http://www.cde.ca.gov/sp/el/er/documents/eldstndspublication14.pdf
ELD.PI.5.10a.Em,"Write short literary and informational texts (e.g., a description of a camel) collaboratively (e.g., joint construction of texts with an adult or with peers) and sometimes independently.",English Language Development (2012-),Grade_05,,,California,2012,http://www.cde.ca.gov/sp/el/er/documents/eldstndspublication14.pdf
B546C6594DC5463AAE02A917837A50BC,"Writing literary and informational texts to present, describe, and explain ideas and information, using appropriate technology",English Language Development (2012-),Grade_05,,,California,2012,http://www.cde.ca.gov/sp/el/er/documents/eldstndspublication14.pdf
ELD.PI.5.9.Br,"Plan and deliver oral presentations on a variety of topics in a variety of content areas (e.g., providing an opinion speech on a current event, reciting a poem, recounting an experience, explaining a science process), with light support.",English Language Development (2012-),Grade_05,,,California,2012,http://www.cde.ca.gov/sp/el/er/documents/eldstndspublication14.pdf
ELD.PI.5.9.Ex,"Plan and deliver longer oral presentations on a variety of topics and content areas (e.g., providing an opinion speech on a current event, reciting a poem, recounting an experience, explaining a science process), with moderate support.",English Language Development (2012-),Grade_05,,,California,2012,http://www.cde.ca.gov/sp/el/er/documents/eldstndspublication14.pdf
ELD.PI.5.9.Em,"Plan and deliver brief oral presentations on a variety of topics and content areas (e.g., providing a report on a current event, reciting a poem, recounting an experience, explaining a science process), with moderate support, such as graphic organizers.",English Language Development (2012-),Grade_05,,,California,2012,http://www.cde.ca.gov/sp/el/er/documents/eldstndspublication14.pdf
0976A6F2CAB64571B9CE2A380BE50D2F,Expressing information and ideas in formal oral presentations on academic topics,English Language Development (2012-),Grade_05,,,California,2012,http://www.cde.ca.gov/sp/el/er/documents/eldstndspublication14.pdf
36FF293FFDAC481BB0618EAA75F8DF10,Productive (creation of oral presentations and written texts),English Language Development (2012-),Grade_05,,,California,2012,http://www.cde.ca.gov/sp/el/er/documents/eldstndspublication14.pdf
ELD.PI.5.8.Br,"Distinguish how different words with related meanings (e.g., fun versus thrilling, possibly versus certainly) and figurative language (e.g., the stream slithered through the parched land) produce shades of meaning and different effects on the audience.",English Language Development (2012-),Grade_05,,,California,2012,http://www.cde.ca.gov/sp/el/er/documents/eldstndspublication14.pdf
ELD.PI.5.8.Ex,"Distinguish how different words with similar meanings (e.g., describing an event as sad versus tragic) and figurative language (e.g., she ran like a cheetah) produce shades of meaning and different effects on the audience.",English Language Development (2012-),Grade_05,,,California,2012,http://www.cde.ca.gov/sp/el/er/documents/eldstndspublication14.pdf
ELD.PI.5.8.Em,"Distinguish how different words with similar meanings produce different effects on the audience (e.g., describing a character as angry versus furious).",English Language Development (2012-),Grade_05,,,California,2012,http://www.cde.ca.gov/sp/el/er/documents/eldstndspublication14.pdf
FEB8202A07204EBE96878BD6F11D21B0,"Analyzing how writers and speakers use vocabulary and other language resources for specific purposes (to explain, persuade, entertain, etc.) depending on modality, text type, purpose, audience, topic, and content area",English Language Development (2012-),Grade_05,,,California,2012,http://www.cde.ca.gov/sp/el/er/documents/eldstndspublication14.pdf
ELD.PI.5.7.Br,"Explain how well writers and speakers use specific language resources to support an opinion or present an idea (e.g., the clarity or appealing nature of language used to provide evidence or describe characters, or if the phrasing used to introduce a topic is appropriate), with light support.",English Language Development (2012-),Grade_05,,,California,2012,http://www.cde.ca.gov/sp/el/er/documents/eldstndspublication14.pdf
ELD.PI.5.7.Ex,"Explain how well writers and speakers use language resources to support an opinion or present an idea (e.g., whether the vocabulary used to provide evidence is strong enough, or if the phrasing used to signal a shift in meaning does this well), with moderate support.",English Language Development (2012-),Grade_05,,,California,2012,http://www.cde.ca.gov/sp/el/er/documents/eldstndspublication14.pdf
ELD.PI.5.7.Em,"Describe the specific language writers or speakers use to present or support an idea (e.g., the specific vocabulary or phrasing used to provide evidence), with prompting and substantial support.",English Language Development (2012-),Grade_05,,,California,2012,http://www.cde.ca.gov/sp/el/er/documents/eldstndspublication14.pdf
D434C6A4184D459CA776C45766F6A37B,"Evaluating how well writers and speakers use language to support ideas and opinions with details or reasons depending on modality, text type, purpose, audience, topic, and content area",English Language Development (2012-),Grade_05,,,California,2012,http://www.cde.ca.gov/sp/el/er/documents/eldstndspublication14.pdf
ELD.PI.5.6b.Br,"Use knowledge of morphology (e.g., affixes, roots, and base words), linguistic context, and reference materials to determine the meaning of unknown words on familiar and new topics.",English Language Development (2012-),Grade_05,,,California,2012,http://www.cde.ca.gov/sp/el/er/documents/eldstndspublication14.pdf
ELD.PI.5.6a.Br,"Explain ideas, phenomena, processes, and text relationships (e.g., compare/contrast, cause/effect, problem/solution) based on close reading of a variety of grade-level texts and viewing of multimedia, with light support.",English Language Development (2012-),Grade_05,,,California,2012,http://www.cde.ca.gov/sp/el/er/documents/eldstndspublication14.pdf
ELD.PI.5.6b.Ex,"Use knowledge of morphology (e.g., affixes, roots, and base words), linguistic context, and reference materials to determine the meaning of unknown words on familiar and new topics.",English Language Development (2012-),Grade_05,,,California,2012,http://www.cde.ca.gov/sp/el/er/documents/eldstndspublication14.pdf
ELD.PI.5.6a.Ex,"Explain ideas, phenomena, processes, and text relationships (e.g., compare/contrast, cause/effect, problem/solution) based on close reading of a variety of grade-level texts and viewing of multimedia, with moderate support.",English Language Development (2012-),Grade_05,,,California,2012,http://www.cde.ca.gov/sp/el/er/documents/eldstndspublication14.pdf
ELD.PI.5.6b.Em,"Use knowledge of frequently-used affixes (e.g., un-, mis-), linguistic context, reference materials, and visual cues to determine the meaning of unknown words on familiar topics.",English Language Development (2012-),Grade_05,,,California,2012,http://www.cde.ca.gov/sp/el/er/documents/eldstndspublication14.pdf
ELD.PI.5.6a.Em,"Explain ideas, phenomena, processes, and text relationships (e.g., compare/contrast, cause/effect, problem/solution) based on close reading of a variety of grade-level texts and viewing of multimedia, with substantial support.",English Language Development (2012-),Grade_05,,,California,2012,http://www.cde.ca.gov/sp/el/er/documents/eldstndspublication14.pdf
4F1654672E4E4681A2E16BC3ECB2962C,Reading closely literary and informational texts and viewing multimedia to determine how meaning is conveyed explicitly and implicitly through language,English Language Development (2012-),Grade_05,,,California,2012,http://www.cde.ca.gov/sp/el/er/documents/eldstndspublication14.pdf
