Standard_ID,Standard_Text,Subject,Grade_Level,Range,Interdisciplinary,Framework_Type,Adoption_Date,Source_URL
RL.6.9,"Compare and contrast texts in different forms or genres (e.g., stories and poems; historical novels and fantasy stories) in terms of their approaches to similar themes and topics.",English Language Arts & Literacy (2010-),Grade_06,,English Language Arts,California,2010,http://www.cde.ca.gov/be/st/ss/documents/finalelaccssstandards.pdf
B05F98A06E974B51A73810C8DB9AFFA5,(Not applicable to literature),English Language Arts & Literacy (2010-),Grade_06,,English Language Arts,California,2010,http://www.cde.ca.gov/be/st/ss/documents/finalelaccssstandards.pdf
RL.6.7,"Compare and contrast the experience of reading a story, drama, or poem to listening to or viewing an audio, video, or live version of the text, including contrasting what they ""see"" and ""hear"" when reading the text to what they perceive when they listen or watch.",English Language Arts & Literacy (2010-),Grade_06,,English Language Arts,California,2010,http://www.cde.ca.gov/be/st/ss/documents/finalelaccssstandards.pdf
1B32231E2098444480BBF208C810FC1C,Integration of Knowledge and Ideas,English Language Arts & Literacy (2010-),Grade_06,,English Language Arts,California,2010,http://www.cde.ca.gov/be/st/ss/documents/finalelaccssstandards.pdf
RL.6.6,Explain how an author develops the point of view of the narrator or speaker in a text.,English Language Arts & Literacy (2010-),Grade_06,,English Language Arts,California,2010,http://www.cde.ca.gov/be/st/ss/documents/finalelaccssstandards.pdf
RL.6.5,"Analyze how a particular sentence, chapter, scene, or stanza fits into the overall structure of a text and contributes to the development of the theme, setting, or plot.",English Language Arts & Literacy (2010-),Grade_06,,English Language Arts,California,2010,http://www.cde.ca.gov/be/st/ss/documents/finalelaccssstandards.pdf
RL.6.4,"Determine the meaning of words and phrases as they are used in a text, including figurative and connotative meanings; analyze the impact of a specific word choice on meaning and tone. (See grade 6 Language standards 4–6 for additional expectations.)",English Language Arts & Literacy (2010-),Grade_06,,English Language Arts,California,2010,http://www.cde.ca.gov/be/st/ss/documents/finalelaccssstandards.pdf
7080D3B0ACD5455392EFFAAA4B1A2E8F,Craft and Structure,English Language Arts & Literacy (2010-),Grade_06,,English Language Arts,California,2010,http://www.cde.ca.gov/be/st/ss/documents/finalelaccssstandards.pdf
RL.6.3,Describe how a particular story's or drama's plot unfolds in a series of episodes as well as how the characters respond or change as the plot moves toward a resolution.,English Language Arts & Literacy (2010-),Grade_06,,English Language Arts,California,2010,http://www.cde.ca.gov/be/st/ss/documents/finalelaccssstandards.pdf
RL.6.2,Determine a theme or central idea of a text and how it is conveyed through particular details; provide a summary of the text distinct from personal opinions or judgments.,English Language Arts & Literacy (2010-),Grade_06,,English Language Arts,California,2010,http://www.cde.ca.gov/be/st/ss/documents/finalelaccssstandards.pdf
RL.6.1,Cite textual evidence to support analysis of what the text says explicitly as well as inferences drawn from the text.,English Language Arts & Literacy (2010-),Grade_06,,English Language Arts,California,2010,http://www.cde.ca.gov/be/st/ss/documents/finalelaccssstandards.pdf
3CECF82FCE994FD9A8781F00D7BAD728,Key Ideas and Details,English Language Arts & Literacy (2010-),Grade_06,,English Language Arts,California,2010,http://www.cde.ca.gov/be/st/ss/documents/finalelaccssstandards.pdf
4BFD07DE43214C51932B6FD11F981764,Reading Standards for Literature,English Language Arts & Literacy (2010-),Grade_06,,English Language Arts,California,2010,http://www.cde.ca.gov/be/st/ss/documents/finalelaccssstandards.pdf
R.CCR.10,Read and comprehend complex literary and informational texts independently and proficiently.,English Language Arts & Literacy (2010-),Grade_06,,English Language Arts,California,2010,http://www.cde.ca.gov/be/st/ss/documents/finalelaccssstandards.pdf
6F123CC954364CBB8FB35E4C5BCB6F0F,Range of Reading and Level of Text Complexity,English Language Arts & Literacy (2010-),Grade_06,,English Language Arts,California,2010,http://www.cde.ca.gov/be/st/ss/documents/finalelaccssstandards.pdf
R.CCR.9,Analyze how two or more texts address similar themes or topics in order to build knowledge or to compare the approaches the authors take.,English Language Arts & Literacy (2010-),Grade_06,,English Language Arts,California,2010,http://www.cde.ca.gov/be/st/ss/documents/finalelaccssstandards.pdf
R.CCR.8,"Delineate and evaluate the argument and specific claims in a text, including the validity of the reasoning as well as the relevance and sufficiency of the evidence.",English Language Arts & Literacy (2010-),Grade_06,,English Language Arts,California,2010,http://www.cde.ca.gov/be/st/ss/documents/finalelaccssstandards.pdf
R.CCR.7,"Integrate and evaluate content presented in diverse media and formats, including visually and quantitatively, as well as in words.",English Language Arts & Literacy (2010-),Grade_06,,English Language Arts,California,2010,http://www.cde.ca.gov/be/st/ss/documents/finalelaccssstandards.pdf
C21E90C8F25F4226996B3DDF2EF2139B,Integration of Knowledge and Ideas,English Language Arts & Literacy (2010-),Grade_06,,English Language Arts,California,2010,http://www.cde.ca.gov/be/st/ss/documents/finalelaccssstandards.pdf
R.CCR.6,Assess how point of view or purpose shapes the content and style of a text.,English Language Arts & Literacy (2010-),Grade_06,,English Language Arts,California,2010,http://www.cde.ca.gov/be/st/ss/documents/finalelaccssstandards.pdf
R.CCR.5,"Analyze the structure of texts, including how specific sentences, paragraphs, and larger portions of the text (e.g., a section, chapter, scene, or stanza) relate to each other and the whole.",English Language Arts & Literacy (2010-),Grade_06,,English Language Arts,California,2010,http://www.cde.ca.gov/be/st/ss/documents/finalelaccssstandards.pdf
R.CCR.4,"Interpret words and phrases as they are used in a text, including determining technical, connotative, and figurative meanings, and analyze how specific word choices shape meaning or tone.",English Language Arts & Literacy (2010-),Grade_06,,English Language Arts,California,2010,http://www.cde.ca.gov/be/st/ss/documents/finalelaccssstandards.pdf
3DB9B87636B14189BE6CFFA0F6B3A7D7,Craft and Structure,English Language Arts & Literacy (2010-),Grade_06,,English Language Arts,California,2010,http://www.cde.ca.gov/be/st/ss/documents/finalelaccssstandards.pdf
R.CCR.3,"Analyze how and why individuals, events, and ideas develop and interact over the course of a text.",English Language Arts & Literacy (2010-),Grade_06,,English Language Arts,California,2010,http://www.cde.ca.gov/be/st/ss/documents/finalelaccssstandards.pdf
R.CCR.2,Determine central ideas or themes of a text and analyze their development; summarize the key supporting details and ideas.,English Language Arts & Literacy (2010-),Grade_06,,English Language Arts,California,2010,http://www.cde.ca.gov/be/st/ss/documents/finalelaccssstandards.pdf
R.CCR.1,Read closely to determine what the text says explicitly and to make logical inferences from it; cite specific textual evidence when writing or speaking to support conclusions drawn from the text.,English Language Arts & Literacy (2010-),Grade_06,,English Language Arts,California,2010,http://www.cde.ca.gov/be/st/ss/documents/finalelaccssstandards.pdf
8BB6E334D6B5495B960AE273A6E10C0D,Key Ideas and Details,English Language Arts & Literacy (2010-),Grade_06,,English Language Arts,California,2010,http://www.cde.ca.gov/be/st/ss/documents/finalelaccssstandards.pdf
997B4F4CFFD9431CB74D17345248D56F,College and Career Readiness Anchor Standards for Reading,English Language Arts & Literacy (2010-),Grade_06,,English Language Arts,California,2010,http://www.cde.ca.gov/be/st/ss/documents/finalelaccssstandards.pdf
