Standard_ID,Standard_Text,Subject,Grade_Level,Range,Interdisciplinary,Framework_Type,Adoption_Date,Source_URL
L.6.6,Acquire and use accurately grade-appropriate general academic and domain-specific words and phrases; gather vocabulary knowledge when considering a word or phrase important to comprehension or expression.,English Language Arts & Literacy (2010-),Grade_06,,English Language Arts,California,2010,http://www.cde.ca.gov/be/st/ss/documents/finalelaccssstandards.pdf
L.6.5c,"Distinguish among the connotations (associations) of words with similar denotations (definitions) (e.g., stingy, scrimping, economical, unwasteful, thrifty).",English Language Arts & Literacy (2010-),Grade_06,,English Language Arts,California,2010,http://www.cde.ca.gov/be/st/ss/documents/finalelaccssstandards.pdf
L.6.5b,"Use the relationship between particular words (e.g., cause/effect, part/whole, item/category) to better understand each of the words.",English Language Arts & Literacy (2010-),Grade_06,,English Language Arts,California,2010,http://www.cde.ca.gov/be/st/ss/documents/finalelaccssstandards.pdf
L.6.5a,"Interpret figures of speech (e.g., personification) in context.",English Language Arts & Literacy (2010-),Grade_06,,English Language Arts,California,2010,http://www.cde.ca.gov/be/st/ss/documents/finalelaccssstandards.pdf
L.6.5,"Demonstrate understanding of figurative language, word relationships, and nuances in word meanings.",English Language Arts & Literacy (2010-),Grade_06,,English Language Arts,California,2010,http://www.cde.ca.gov/be/st/ss/documents/finalelaccssstandards.pdf
L.6.4d,"Verify the preliminary determination of the meaning of a word or phrase (e.g., by checking the inferred meaning in context or in a dictionary).",English Language Arts & Literacy (2010-),Grade_06,,English Language Arts,California,2010,http://www.cde.ca.gov/be/st/ss/documents/finalelaccssstandards.pdf
L.6.4c,"Consult reference materials (e.g., dictionaries, glossaries, thesauruses), both print and digital, to find the pronunciation of a word or determine or clarify its precise meaning or its part of speech.",English Language Arts & Literacy (2010-),Grade_06,,English Language Arts,California,2010,http://www.cde.ca.gov/be/st/ss/documents/finalelaccssstandards.pdf
L.6.4b,"Use common, grade-appropriate Greek or Latin affixes and roots as clues to the meaning of a word (e.g., audience, auditory, audible).",English Language Arts & Literacy (2010-),Grade_06,,English Language Arts,California,2010,http://www.cde.ca.gov/be/st/ss/documents/finalelaccssstandards.pdf
L.6.4a,"Use context (e.g., the overall meaning of a sentence or paragraph; a word's position or function in a sentence) as a clue to the meaning of a word or phrase.",English Language Arts & Literacy (2010-),Grade_06,,English Language Arts,California,2010,http://www.cde.ca.gov/be/st/ss/documents/finalelaccssstandards.pdf
L.6.4,"Determine or clarify the meaning of unknown and multiple-meaning words and phrases based on grade 6 reading and content, choosing flexibly from a range of strategies.",English Language Arts & Literacy (2010-),Grade_06,,English Language Arts,California,2010,http://www.cde.ca.gov/be/st/ss/documents/finalelaccssstandards.pdf
FD61FA3DD33B48B88BD376C54C4809A6,Vocabulary Acquisition and Use,English Language Arts & Literacy (2010-),Grade_06,,English Language Arts,California,2010,http://www.cde.ca.gov/be/st/ss/documents/finalelaccssstandards.pdf
L.6.3b,Maintain consistency in style and tone.,English Language Arts & Literacy (2010-),Grade_06,,English Language Arts,California,2010,http://www.cde.ca.gov/be/st/ss/documents/finalelaccssstandards.pdf
L.6.3a,"Vary sentence patterns for meaning, reader/listener interest, and style.",English Language Arts & Literacy (2010-),Grade_06,,English Language Arts,California,2010,http://www.cde.ca.gov/be/st/ss/documents/finalelaccssstandards.pdf
L.6.3,"Use knowledge of language and its conventions when writing, speaking, reading, or listening.",English Language Arts & Literacy (2010-),Grade_06,,English Language Arts,California,2010,http://www.cde.ca.gov/be/st/ss/documents/finalelaccssstandards.pdf
1E318FC6F1934E7F95A8296368E42246,Knowledge of Language,English Language Arts & Literacy (2010-),Grade_06,,English Language Arts,California,2010,http://www.cde.ca.gov/be/st/ss/documents/finalelaccssstandards.pdf
L.6.2b,Spell correctly.,English Language Arts & Literacy (2010-),Grade_06,,English Language Arts,California,2010,http://www.cde.ca.gov/be/st/ss/documents/finalelaccssstandards.pdf
L.6.2a,"Use punctuation (commas, parentheses, dashes) to set off nonrestrictive/parenthetical elements.",English Language Arts & Literacy (2010-),Grade_06,,English Language Arts,California,2010,http://www.cde.ca.gov/be/st/ss/documents/finalelaccssstandards.pdf
L.6.2,"Demonstrate command of the conventions of standard English capitalization, punctuation, and spelling when writing.",English Language Arts & Literacy (2010-),Grade_06,,English Language Arts,California,2010,http://www.cde.ca.gov/be/st/ss/documents/finalelaccssstandards.pdf
L.6.1e,"Recognize variations from standard English in their own and others' writing and speaking, and identify and use strategies to improve expression in conventional language.",English Language Arts & Literacy (2010-),Grade_06,,English Language Arts,California,2010,http://www.cde.ca.gov/be/st/ss/documents/finalelaccssstandards.pdf
L.6.1d,"Recognize and correct vague pronouns (i.e., ones with unclear or ambiguous antecedents).",English Language Arts & Literacy (2010-),Grade_06,,English Language Arts,California,2010,http://www.cde.ca.gov/be/st/ss/documents/finalelaccssstandards.pdf
L.6.1c,Recognize and correct inappropriate shifts in pronoun number and person.,English Language Arts & Literacy (2010-),Grade_06,,English Language Arts,California,2010,http://www.cde.ca.gov/be/st/ss/documents/finalelaccssstandards.pdf
L.6.1b,"Use all pronouns, including intensive pronouns (e.g., myself, ourselves) correctly.",English Language Arts & Literacy (2010-),Grade_06,,English Language Arts,California,2010,http://www.cde.ca.gov/be/st/ss/documents/finalelaccssstandards.pdf
L.6.1a,"Ensure that pronouns are in the proper case (subjective, objective, possessive).",English Language Arts & Literacy (2010-),Grade_06,,English Language Arts,California,2010,http://www.cde.ca.gov/be/st/ss/documents/finalelaccssstandards.pdf
L.6.1,Demonstrate command of the conventions of standard English grammar and usage when writing or speaking.,English Language Arts & Literacy (2010-),Grade_06,,English Language Arts,California,2010,http://www.cde.ca.gov/be/st/ss/documents/finalelaccssstandards.pdf
532146641E7242F4AB08CC535C4743BE,Conventions of Standard English,English Language Arts & Literacy (2010-),Grade_06,,English Language Arts,California,2010,http://www.cde.ca.gov/be/st/ss/documents/finalelaccssstandards.pdf
45C87D9C9B5448B8A933741F52AEB589,Language Standards,English Language Arts & Literacy (2010-),Grade_06,,English Language Arts,California,2010,http://www.cde.ca.gov/be/st/ss/documents/finalelaccssstandards.pdf
L.CCR.6,"Acquire and use accurately a range of general academic and domain-specific words and phrases sufficient for reading, writing, speaking, and listening at the college and career readiness level; demonstrate independence in gathering vocabulary knowledge when considering a word or phrase important to comprehension or expression.",English Language Arts & Literacy (2010-),Grade_06,,English Language Arts,California,2010,http://www.cde.ca.gov/be/st/ss/documents/finalelaccssstandards.pdf
L.CCR.5,"Demonstrate understanding of figurative language, word relationships, and nuances in word meanings.",English Language Arts & Literacy (2010-),Grade_06,,English Language Arts,California,2010,http://www.cde.ca.gov/be/st/ss/documents/finalelaccssstandards.pdf
L.CCR.4,"Determine or clarify the meaning of unknown and multiple-meaning words and phrases by using context clues, analyzing meaningful word parts, and consulting general and specialized reference materials, as appropriate.",English Language Arts & Literacy (2010-),Grade_06,,English Language Arts,California,2010,http://www.cde.ca.gov/be/st/ss/documents/finalelaccssstandards.pdf
6597EFBF6EF242859DEFBE6C44309EAE,Vocabulary Acquisition and Use,English Language Arts & Literacy (2010-),Grade_06,,English Language Arts,California,2010,http://www.cde.ca.gov/be/st/ss/documents/finalelaccssstandards.pdf
L.CCR.3,"Apply knowledge of language to understand how language functions in different contexts, to make effective choices for meaning or style, and to comprehend more fully when reading or listening.",English Language Arts & Literacy (2010-),Grade_06,,English Language Arts,California,2010,http://www.cde.ca.gov/be/st/ss/documents/finalelaccssstandards.pdf
59AF45C9A02543E4861957CE01E6C0F0,Knowledge of Language,English Language Arts & Literacy (2010-),Grade_06,,English Language Arts,California,2010,http://www.cde.ca.gov/be/st/ss/documents/finalelaccssstandards.pdf
L.CCR.2,"Demonstrate command of the conventions of standard English capitalization, punctuation, and spelling when writing.",English Language Arts & Literacy (2010-),Grade_06,,English Language Arts,California,2010,http://www.cde.ca.gov/be/st/ss/documents/finalelaccssstandards.pdf
L.CCR.1,Demonstrate command of the conventions of standard English grammar and usage when writing or speaking.,English Language Arts & Literacy (2010-),Grade_06,,English Language Arts,California,2010,http://www.cde.ca.gov/be/st/ss/documents/finalelaccssstandards.pdf
ED0D430AE6E54BCA9CBA17DBDFBCD25C,Conventions of Standard English,English Language Arts & Literacy (2010-),Grade_06,,English Language Arts,California,2010,http://www.cde.ca.gov/be/st/ss/documents/finalelaccssstandards.pdf
5C88CEC0B3C9471C8EE0D2733A3BC062,College and Career Readiness Anchor Standards for Language,English Language Arts & Literacy (2010-),Grade_06,,English Language Arts,California,2010,http://www.cde.ca.gov/be/st/ss/documents/finalelaccssstandards.pdf
SL.6.6,"Adapt speech to a variety of contexts and tasks, demonstrating command of formal English when indicated or appropriate.",English Language Arts & Literacy (2010-),Grade_06,,English Language Arts,California,2010,http://www.cde.ca.gov/be/st/ss/documents/finalelaccssstandards.pdf
SL.6.5,"Include multimedia components (e.g., graphics, images, music, sound) and visual displays in presentations to clarify information.",English Language Arts & Literacy (2010-),Grade_06,,English Language Arts,California,2010,http://www.cde.ca.gov/be/st/ss/documents/finalelaccssstandards.pdf
SL.6.4a,"Plan and deliver an informative/explanatory presentation that: develops a topic with relevant facts, definitions, and concrete details; uses appropriate transitions to clarify relationships; uses precise language and domain specific vocabulary; and provides a strong conclusion.",English Language Arts & Literacy (2010-),Grade_06,,English Language Arts,California,2010,http://www.cde.ca.gov/be/st/ss/documents/finalelaccssstandards.pdf
SL.6.4,"Present claims and findings (e.g., argument, narrative, informative, response to literature presentations), sequencing ideas logically and using pertinent descriptions, facts, and details to accentuate main ideas or themes; use appropriate eye contact, adequate volume, and clear pronunciation.",English Language Arts & Literacy (2010-),Grade_06,,English Language Arts,California,2010,http://www.cde.ca.gov/be/st/ss/documents/finalelaccssstandards.pdf
0502D9ADF17E409E9FE9EA24D1AB2BC5,Presentation of Knowledge and Ideas,English Language Arts & Literacy (2010-),Grade_06,,English Language Arts,California,2010,http://www.cde.ca.gov/be/st/ss/documents/finalelaccssstandards.pdf
SL.6.3,"Delineate a speaker's argument and specific claims, distinguishing claims that are supported by reasons and evidence from claims that are not.",English Language Arts & Literacy (2010-),Grade_06,,English Language Arts,California,2010,http://www.cde.ca.gov/be/st/ss/documents/finalelaccssstandards.pdf
SL.6.2,"Interpret information presented in diverse media and formats (e.g., visually, quantitatively, orally) and explain how it contributes to a topic, text, or issue under study.",English Language Arts & Literacy (2010-),Grade_06,,English Language Arts,California,2010,http://www.cde.ca.gov/be/st/ss/documents/finalelaccssstandards.pdf
SL.6.1d,Review the key ideas expressed and demonstrate understanding of multiple perspectives through reflection and paraphrasing.,English Language Arts & Literacy (2010-),Grade_06,,English Language Arts,California,2010,http://www.cde.ca.gov/be/st/ss/documents/finalelaccssstandards.pdf
SL.6.1c,"Pose and respond to specific questions with elaboration and detail by making comments that contribute to the topic, text, or issue under discussion.",English Language Arts & Literacy (2010-),Grade_06,,English Language Arts,California,2010,http://www.cde.ca.gov/be/st/ss/documents/finalelaccssstandards.pdf
SL.6.1b,"Follow rules for collegial discussions, set specific goals and deadlines, and define individual roles as needed.",English Language Arts & Literacy (2010-),Grade_06,,English Language Arts,California,2010,http://www.cde.ca.gov/be/st/ss/documents/finalelaccssstandards.pdf
SL.6.1a,"Come to discussions prepared, having read or studied required material; explicitly draw on that preparation by referring to evidence on the topic, text, or issue to probe and reflect on ideas under discussion.",English Language Arts & Literacy (2010-),Grade_06,,English Language Arts,California,2010,http://www.cde.ca.gov/be/st/ss/documents/finalelaccssstandards.pdf
SL.6.1,"Engage effectively in a range of collaborative discussions (one-on-one, in groups, and teacher-led) with diverse partners on grade 6 topics, texts, and issues, building on others' ideas and expressing their own clearly.",English Language Arts & Literacy (2010-),Grade_06,,English Language Arts,California,2010,http://www.cde.ca.gov/be/st/ss/documents/finalelaccssstandards.pdf
BBCD10CFD21843A38BBEC7C9568DD01F,Comprehension and Collaboration,English Language Arts & Literacy (2010-),Grade_06,,English Language Arts,California,2010,http://www.cde.ca.gov/be/st/ss/documents/finalelaccssstandards.pdf
94580CC46740454191D5363052398DA8,Speaking and Listening Standards,English Language Arts & Literacy (2010-),Grade_06,,English Language Arts,California,2010,http://www.cde.ca.gov/be/st/ss/documents/finalelaccssstandards.pdf
SL.CCR.6,"Adapt speech to a variety of contexts and communicative tasks, demonstrating command of formal English when indicated or appropriate.",English Language Arts & Literacy (2010-),Grade_06,,English Language Arts,California,2010,http://www.cde.ca.gov/be/st/ss/documents/finalelaccssstandards.pdf
SL.CCR.5,Make strategic use of digital media and visual displays of data to express information and enhance understanding of presentations.,English Language Arts & Literacy (2010-),Grade_06,,English Language Arts,California,2010,http://www.cde.ca.gov/be/st/ss/documents/finalelaccssstandards.pdf
SL.CCR.4,"Present information, findings, and supporting evidence such that listeners can follow the line of reasoning and the organization, development, and style are appropriate to task, purpose, and audience.",English Language Arts & Literacy (2010-),Grade_06,,English Language Arts,California,2010,http://www.cde.ca.gov/be/st/ss/documents/finalelaccssstandards.pdf
342613935E114D148301E7039CC215B8,Presentation of Knowledge and Ideas,English Language Arts & Literacy (2010-),Grade_06,,English Language Arts,California,2010,http://www.cde.ca.gov/be/st/ss/documents/finalelaccssstandards.pdf
SL.CCR.3,"Evaluate a speaker's point of view, reasoning, and use of evidence and rhetoric.",English Language Arts & Literacy (2010-),Grade_06,,English Language Arts,California,2010,http://www.cde.ca.gov/be/st/ss/documents/finalelaccssstandards.pdf
SL.CCR.2,"Integrate and evaluate information presented in diverse media and formats, including visually, quantitatively, and orally.",English Language Arts & Literacy (2010-),Grade_06,,English Language Arts,California,2010,http://www.cde.ca.gov/be/st/ss/documents/finalelaccssstandards.pdf
SL.CCR.1,"Prepare for and participate effectively in a range of conversations and collaborations with diverse partners, building on others' ideas and expressing their own clearly and persuasively.",English Language Arts & Literacy (2010-),Grade_06,,English Language Arts,California,2010,http://www.cde.ca.gov/be/st/ss/documents/finalelaccssstandards.pdf
9561544E696D448299E04D08E5981017,Comprehension and Collaboration,English Language Arts & Literacy (2010-),Grade_06,,English Language Arts,California,2010,http://www.cde.ca.gov/be/st/ss/documents/finalelaccssstandards.pdf
22F4AF1034B841FE85D549564F7CB752,College and Career Readiness Anchor Standards for Speaking and Listening,English Language Arts & Literacy (2010-),Grade_06,,English Language Arts,California,2010,http://www.cde.ca.gov/be/st/ss/documents/finalelaccssstandards.pdf
WHST.6-8.10,"Write routinely over extended time frames (time for reflection and revision) and shorter time frames (a single sitting or a day or two) for a range of discipline-specific tasks, purposes, and audiences.",English Language Arts & Literacy (2010-),Grade_06,,English Language Arts,California,2010,http://www.cde.ca.gov/be/st/ss/documents/finalelaccssstandards.pdf
5F2FF54B6E7E4F2B9D88ECC0B9340A40,Range of Writing,English Language Arts & Literacy (2010-),Grade_06,,English Language Arts,California,2010,http://www.cde.ca.gov/be/st/ss/documents/finalelaccssstandards.pdf
WHST.6-8.9,"Draw evidence from informational texts to support analysis, reflection, and research.",English Language Arts & Literacy (2010-),Grade_06,,English Language Arts,California,2010,http://www.cde.ca.gov/be/st/ss/documents/finalelaccssstandards.pdf
WHST.6-8.8,"Gather relevant information from multiple print and digital sources, using search terms effectively; assess the credibility and accuracy of each source; and quote or paraphrase the data and conclusions of others while avoiding plagiarism and following a standard format for citation.",English Language Arts & Literacy (2010-),Grade_06,,English Language Arts,California,2010,http://www.cde.ca.gov/be/st/ss/documents/finalelaccssstandards.pdf
WHST.6-8.7,"Conduct short research projects to answer a question (including a self-generated question), drawing on several sources and generating additional related, focused questions that allow for multiple avenues of exploration.",English Language Arts & Literacy (2010-),Grade_06,,English Language Arts,California,2010,http://www.cde.ca.gov/be/st/ss/documents/finalelaccssstandards.pdf
F56223662BE84C2DA0E97B032C3861E4,Research to Build and Present Knowledge,English Language Arts & Literacy (2010-),Grade_06,,English Language Arts,California,2010,http://www.cde.ca.gov/be/st/ss/documents/finalelaccssstandards.pdf
WHST.6-8.6,"Use technology, including the Internet, to produce and publish writing and present the relationships between information and ideas clearly and efficiently.",English Language Arts & Literacy (2010-),Grade_06,,English Language Arts,California,2010,http://www.cde.ca.gov/be/st/ss/documents/finalelaccssstandards.pdf
WHST.6-8.5,"With some guidance and support from peers and adults, develop and strengthen writing as needed by planning, revising, editing, rewriting, or trying a new approach, focusing on how well purpose and audience have been addressed.",English Language Arts & Literacy (2010-),Grade_06,,English Language Arts,California,2010,http://www.cde.ca.gov/be/st/ss/documents/finalelaccssstandards.pdf
WHST.6-8.4,"Produce clear and coherent writing in which the development, organization, and style are appropriate to task, purpose, and audience.",English Language Arts & Literacy (2010-),Grade_06,,English Language Arts,California,2010,http://www.cde.ca.gov/be/st/ss/documents/finalelaccssstandards.pdf
C633D592209B453996F4B3FFBAD37342,Production and Distribution of Writing,English Language Arts & Literacy (2010-),Grade_06,,English Language Arts,California,2010,http://www.cde.ca.gov/be/st/ss/documents/finalelaccssstandards.pdf
WHST.6-8.2f,Provide a concluding statement or section that follows from and supports the information or explanation presented.,English Language Arts & Literacy (2010-),Grade_06,,English Language Arts,California,2010,http://www.cde.ca.gov/be/st/ss/documents/finalelaccssstandards.pdf
WHST.6-8.2e,Establish and maintain a formal style and objective tone.,English Language Arts & Literacy (2010-),Grade_06,,English Language Arts,California,2010,http://www.cde.ca.gov/be/st/ss/documents/finalelaccssstandards.pdf
WHST.6-8.2d,Use precise language and domain-specific vocabulary to inform about or explain the topic.,English Language Arts & Literacy (2010-),Grade_06,,English Language Arts,California,2010,http://www.cde.ca.gov/be/st/ss/documents/finalelaccssstandards.pdf
WHST.6-8.2c,Use appropriate and varied transitions to create cohesion and clarify the relationships among ideas and concepts.,English Language Arts & Literacy (2010-),Grade_06,,English Language Arts,California,2010,http://www.cde.ca.gov/be/st/ss/documents/finalelaccssstandards.pdf
WHST.6-8.2b,"Develop the topic with relevant, well-chosen facts, definitions, concrete details, quotations, or other information and examples.",English Language Arts & Literacy (2010-),Grade_06,,English Language Arts,California,2010,http://www.cde.ca.gov/be/st/ss/documents/finalelaccssstandards.pdf
WHST.6-8.2a,"Introduce a topic clearly, previewing what is to follow; organize ideas, concepts, and information into broader categories as appropriate to achieving purpose; include formatting (e.g., headings), graphics (e.g., charts, tables), and multimedia when useful to aiding comprehension.",English Language Arts & Literacy (2010-),Grade_06,,English Language Arts,California,2010,http://www.cde.ca.gov/be/st/ss/documents/finalelaccssstandards.pdf
WHST.6-8.2,"Write informative/explanatory texts, including the narration of historical events, scientific procedures/experiments, or technical processes.",English Language Arts & Literacy (2010-),Grade_06,,English Language Arts,California,2010,http://www.cde.ca.gov/be/st/ss/documents/finalelaccssstandards.pdf
WHST.6-8.1e,Provide a concluding statement or section that follows from or supports the argument presented.,English Language Arts & Literacy (2010-),Grade_06,,English Language Arts,California,2010,http://www.cde.ca.gov/be/st/ss/documents/finalelaccssstandards.pdf
WHST.6-8.1d,Establish and maintain a formal style.,English Language Arts & Literacy (2010-),Grade_06,,English Language Arts,California,2010,http://www.cde.ca.gov/be/st/ss/documents/finalelaccssstandards.pdf
WHST.6-8.1c,"Use words, phrases, and clauses to create cohesion and clarify the relationships among claim(s), counterclaims, reasons, and evidence.",English Language Arts & Literacy (2010-),Grade_06,,English Language Arts,California,2010,http://www.cde.ca.gov/be/st/ss/documents/finalelaccssstandards.pdf
WHST.6-8.1b,"Support claim(s) with logical reasoning and relevant, accurate data and evidence that demonstrate an understanding of the topic or text, using credible sources.",English Language Arts & Literacy (2010-),Grade_06,,English Language Arts,California,2010,http://www.cde.ca.gov/be/st/ss/documents/finalelaccssstandards.pdf
WHST.6-8.1a,"Introduce claim(s) about a topic or issue, acknowledge and distinguish the claim(s) from alternate or opposing claims, and organize the reasons and evidence logically.",English Language Arts & Literacy (2010-),Grade_06,,English Language Arts,California,2010,http://www.cde.ca.gov/be/st/ss/documents/finalelaccssstandards.pdf
WHST.6-8.1,Write arguments focused on discipline-specific content.,English Language Arts & Literacy (2010-),Grade_06,,English Language Arts,California,2010,http://www.cde.ca.gov/be/st/ss/documents/finalelaccssstandards.pdf
D06D8C344EE54A7FB53968582507F1FE,Text Types and Purposes,English Language Arts & Literacy (2010-),Grade_06,,English Language Arts,California,2010,http://www.cde.ca.gov/be/st/ss/documents/finalelaccssstandards.pdf
D0B9CF5187524A8F989F58B0C59EB87D,"Writing Standards for Literacy in History/Social Studies, Science, and Technical Subjects 6—12",English Language Arts & Literacy (2010-),Grade_06,,English Language Arts,California,2010,http://www.cde.ca.gov/be/st/ss/documents/finalelaccssstandards.pdf
W.6.10,"Write routinely over extended time frames (time for research, reflection, and revision) and shorter time frames (a single sitting or a day or two) for a range of discipline-specific tasks, purposes, and audiences.",English Language Arts & Literacy (2010-),Grade_06,,English Language Arts,California,2010,http://www.cde.ca.gov/be/st/ss/documents/finalelaccssstandards.pdf
943E9B4569AA4D1385DCBC5CBFB7D6BD,Range of Writing,English Language Arts & Literacy (2010-),Grade_06,,English Language Arts,California,2010,http://www.cde.ca.gov/be/st/ss/documents/finalelaccssstandards.pdf
W.6.9b,"Apply grade 6 Reading standards to literary nonfiction (e.g., ""Trace and evaluate the argument and specific claims in a text, distinguishing claims that are supported by reasons and evidence from claims that are not"").",English Language Arts & Literacy (2010-),Grade_06,,English Language Arts,California,2010,http://www.cde.ca.gov/be/st/ss/documents/finalelaccssstandards.pdf
W.6.9a,"Apply grade 6 Reading standards to literature (e.g., ""Compare and contrast texts in different forms or genres [e.g., stories and poems; historical novels and fantasy stories] in terms of their approaches to similar themes and topics"").",English Language Arts & Literacy (2010-),Grade_06,,English Language Arts,California,2010,http://www.cde.ca.gov/be/st/ss/documents/finalelaccssstandards.pdf
