Standard_ID,Standard_Text,Subject,Grade_Level,Range,Interdisciplinary,Framework_Type,Adoption_Date,Source_URL
SEP-1-i,"Ask questions * that arise from careful observation of phenomena, models, or unexpected results, to clarify and/or seek additional information. * to identify and/or clarify evidence and/or the premise(s) of an argument. * to determine relationships between independent and dependent variables and relationships in models.. * to clarify and/or refine a model, an explanation, or an engineering problem.",Science,Grade_06,6-8,,California,,http://www.nextgenscience.org/sites/default/files/Appendix%20F%20%20Science%20and%20Engineering%20Practices%20in%20the%20NGSS%20-%20FINAL%20060513.pdf
SEP-1,"Asking Questions and Defining Problems 
Asking questions and defining problems in 6–8 builds on K–5 experiences and progresses to specifying relationships between variables, and clarifying arguments and models ",Science,Grade_06,6-8,,California,,http://www.nextgenscience.org/sites/default/files/Appendix%20F%20%20Science%20and%20Engineering%20Practices%20in%20the%20NGSS%20-%20FINAL%20060513.pdf
CC-7-iv,Systems in dynamic equilibrium are stable due to a balance of feedback mechanisms.,Science,Grade_06,6-8,,California,,http://www.nextgenscience.org/sites/default/files/Appendix%20G%20-%20Crosscutting%20Concepts%20FINAL%20edited%204.10.13.pdf
CC-7-iii,Stability might be disturbed either by sudden events or gradual changes that accumulate over time. ,Science,Grade_06,6-8,,California,,http://www.nextgenscience.org/sites/default/files/Appendix%20G%20-%20Crosscutting%20Concepts%20FINAL%20edited%204.10.13.pdf
CC-7-ii,Small changes in one part of a system might cause large changes in another part. ,Science,Grade_06,6-8,,California,,http://www.nextgenscience.org/sites/default/files/Appendix%20G%20-%20Crosscutting%20Concepts%20FINAL%20edited%204.10.13.pdf
CC-7-i,"Explanations of stability and change in natural or designed systems can be constructed by examining the changes over time and forces at different scales, including the atomic scale. ",Science,Grade_06,6-8,,California,,http://www.nextgenscience.org/sites/default/files/Appendix%20G%20-%20Crosscutting%20Concepts%20FINAL%20edited%204.10.13.pdf
CC-7,"Stability and Change – For both designed and natural systems, conditions that affect stability and factors that control rates of change are critical elements to consider and understand.",Science,Grade_06,6-8,,California,,http://www.nextgenscience.org/sites/default/files/Appendix%20G%20-%20Crosscutting%20Concepts%20FINAL%20edited%204.10.13.pdf
CC-6-ii,"Structures can be designed to serve particular functions by taking into account properties of different materials, and how materials can be shaped and used.",Science,Grade_06,6-8,,California,,http://www.nextgenscience.org/sites/default/files/Appendix%20G%20-%20Crosscutting%20Concepts%20FINAL%20edited%204.10.13.pdf
CC-6-i,"Complex and microscopic structures and systems can be visualized, modeled, and used to describe how their function depends on the shapes, composition, and relationships among its parts; therefore, complex natural and designed structures/systems can be analyzed to determine how they function. ",Science,Grade_06,6-8,,California,,http://www.nextgenscience.org/sites/default/files/Appendix%20G%20-%20Crosscutting%20Concepts%20FINAL%20edited%204.10.13.pdf
CC-6,Structure and Function – The way an object is shaped or structured determines many of its properties and functions,Science,Grade_06,6-8,,California,,http://www.nextgenscience.org/sites/default/files/Appendix%20G%20-%20Crosscutting%20Concepts%20FINAL%20edited%204.10.13.pdf
CC-5-iv,The transfer of energy can be tracked as energy flows through a designed or natural system.,Science,Grade_06,6-8,,California,,http://www.nextgenscience.org/sites/default/files/Appendix%20G%20-%20Crosscutting%20Concepts%20FINAL%20edited%204.10.13.pdf
CC-5-iii,"Energy may take different forms (e.g. energy in fields, thermal energy, energy of motion). ",Science,Grade_06,6-8,,California,,http://www.nextgenscience.org/sites/default/files/Appendix%20G%20-%20Crosscutting%20Concepts%20FINAL%20edited%204.10.13.pdf
CC-5-ii,"Within a natural or designed system, the transfer of energy drives the motion and/or cycling of matter. ",Science,Grade_06,6-8,,California,,http://www.nextgenscience.org/sites/default/files/Appendix%20G%20-%20Crosscutting%20Concepts%20FINAL%20edited%204.10.13.pdf
CC-5-i,Matter is conserved because atoms are conserved in physical and chemical processes. ,Science,Grade_06,6-8,,California,,http://www.nextgenscience.org/sites/default/files/Appendix%20G%20-%20Crosscutting%20Concepts%20FINAL%20edited%204.10.13.pdf
CC-5,"Energy and Matter: Flows, Cycles, and Conservation – Tracking energy and matter flows, into, out of, and within systems helps one understand their system’s behavior",Science,Grade_06,6-8,,California,,http://www.nextgenscience.org/sites/default/files/Appendix%20G%20-%20Crosscutting%20Concepts%20FINAL%20edited%204.10.13.pdf
CC-4-iii,Models are limited in that they only represent certain aspects of the system under study,Science,Grade_06,6-8,,California,,http://www.nextgenscience.org/sites/default/files/Appendix%20G%20-%20Crosscutting%20Concepts%20FINAL%20edited%204.10.13.pdf
CC-4-ii,"Models can be used to represent systems and their interactions—such as inputs, processes and outputs—and energy, matter, and information flows within systems. ",Science,Grade_06,6-8,,California,,http://www.nextgenscience.org/sites/default/files/Appendix%20G%20-%20Crosscutting%20Concepts%20FINAL%20edited%204.10.13.pdf
CC-4-i,Systems may interact with other systems; they may have sub-systems and be a part of larger complex systems. ,Science,Grade_06,6-8,,California,,http://www.nextgenscience.org/sites/default/files/Appendix%20G%20-%20Crosscutting%20Concepts%20FINAL%20edited%204.10.13.pdf
CC-4,Systems and System Models – A system is an organized group of related objects or components; models can be used for understanding and predicting the behavior of systems.,Science,Grade_06,6-8,,California,,http://www.nextgenscience.org/sites/default/files/Appendix%20G%20-%20Crosscutting%20Concepts%20FINAL%20edited%204.10.13.pdf
CC-3-v,Phenomena that can be observed at one scale may not be observable at another scale,Science,Grade_06,6-8,,California,,http://www.nextgenscience.org/sites/default/files/Appendix%20G%20-%20Crosscutting%20Concepts%20FINAL%20edited%204.10.13.pdf
CC-3-iv,Scientific relationships can be represented through the use of algebraic expressions and equations. ,Science,Grade_06,6-8,,California,,http://www.nextgenscience.org/sites/default/files/Appendix%20G%20-%20Crosscutting%20Concepts%20FINAL%20edited%204.10.13.pdf
CC-3-iii,"Proportional relationships (e.g., speed as the ratio of distance traveled to time taken) among different types of quantities provide information about the magnitude of properties and processes. ",Science,Grade_06,6-8,,California,,http://www.nextgenscience.org/sites/default/files/Appendix%20G%20-%20Crosscutting%20Concepts%20FINAL%20edited%204.10.13.pdf
CC-3-ii,The observed function of natural and designed systems may change with scale. ,Science,Grade_06,6-8,,California,,http://www.nextgenscience.org/sites/default/files/Appendix%20G%20-%20Crosscutting%20Concepts%20FINAL%20edited%204.10.13.pdf
CC-3-i,"Time, space, and energy phenomena can be observed at various scales using models to study systems that are too large or too small. ",Science,Grade_06,6-8,,California,,http://www.nextgenscience.org/sites/default/files/Appendix%20G%20-%20Crosscutting%20Concepts%20FINAL%20edited%204.10.13.pdf
CC-3,"Scale, Proportion, and Quantity – In considering phenomena, it is critical to recognize what is relevant at different size, time, and energy scales, and to recognize proportional relationships between different quantities as scales change.",Science,Grade_06,6-8,,California,,http://www.nextgenscience.org/sites/default/files/Appendix%20G%20-%20Crosscutting%20Concepts%20FINAL%20edited%204.10.13.pdf
CC-2-iii,"Phenomena may have more than one cause, and some cause and effect relationships in systems can only be described using probability.",Science,Grade_06,6-8,,California,,http://www.nextgenscience.org/sites/default/files/Appendix%20G%20-%20Crosscutting%20Concepts%20FINAL%20edited%204.10.13.pdf
CC-2-ii,Cause and effect relationships may be used to predict phenomena in natural or designed systems.,Science,Grade_06,6-8,,California,,http://www.nextgenscience.org/sites/default/files/Appendix%20G%20-%20Crosscutting%20Concepts%20FINAL%20edited%204.10.13.pdf
CC-2-i,"Relationships can be classified as causal or correlational, and correlation does not necessarily imply causation. ",Science,Grade_06,6-8,,California,,http://www.nextgenscience.org/sites/default/files/Appendix%20G%20-%20Crosscutting%20Concepts%20FINAL%20edited%204.10.13.pdf
CC-2,"Cause and Effect: Mechanism and Prediction – Events have causes, sometimes simple, sometimes multifaceted. Deciphering causal relationships, and the mechanisms by which they are mediated, is a major activity of science and engineering.",Science,Grade_06,6-8,,California,,http://www.nextgenscience.org/sites/default/files/Appendix%20G%20-%20Crosscutting%20Concepts%20FINAL%20edited%204.10.13.pdf
CC-1-iv,"Graphs, charts, and images can be used to identify patterns in data.",Science,Grade_06,6-8,,California,,http://www.nextgenscience.org/sites/default/files/Appendix%20G%20-%20Crosscutting%20Concepts%20FINAL%20edited%204.10.13.pdf
CC-1-iii   ,Patterns can be used to identify cause and effect relationships. ,Science,Grade_06,6-8,,California,,http://www.nextgenscience.org/sites/default/files/Appendix%20G%20-%20Crosscutting%20Concepts%20FINAL%20edited%204.10.13.pdf
CC-1-ii,Patterns in rates of change and other numerical relationships can provide information about natural and human designed systems. ,Science,Grade_06,6-8,,California,,http://www.nextgenscience.org/sites/default/files/Appendix%20G%20-%20Crosscutting%20Concepts%20FINAL%20edited%204.10.13.pdf
CC-1-i,Macroscopic patterns are related to the nature of microscopic and atomic-level structure. ,Science,Grade_06,6-8,,California,,http://www.nextgenscience.org/sites/default/files/Appendix%20G%20-%20Crosscutting%20Concepts%20FINAL%20edited%204.10.13.pdf
CC-1,Patterns – Observed patterns in nature guide organization and classification and prompt questions about relationships and causes underlying them.,Science,Grade_06,6-8,,California,,http://www.nextgenscience.org/sites/default/files/Appendix%20G%20-%20Crosscutting%20Concepts%20FINAL%20edited%204.10.13.pdf
