Standard_ID,Standard_Text,Subject,Grade_Level,Range,Interdisciplinary,Framework_Type,Adoption_Date,Source_URL
1.PT.3,"Students know lithospheric plates the size of continents and oceans move at rates
of centimeters per year in response to movements in the mantle. ",Science,Grade_06,,,California,,http://www.cde.ca.gov/be/st/ss/documents/sciencestnd.pdf
1.PT.2,"Students know Earth is composed of several layers: a cold, brittle lithosphere; a
hot, convecting mantle; and a dense, metallic core.",Science,Grade_06,,,California,,http://www.cde.ca.gov/be/st/ss/documents/sciencestnd.pdf
1.PT.1,"Students know evidence of plate tectonics is derived from the fit of the continents;
the location of earthquakes, volcanoes, and midocean ridges; and the distribution
of fossils, rock types, and ancient climatic zones. ",Science,Grade_06,,,California,,http://www.cde.ca.gov/be/st/ss/documents/sciencestnd.pdf
1.PT.0,"Plate Tectonics and Earth Structure: Plate tectonics accounts for important features of Earth’s surface and major geologic
events. As a basis for understanding this concept:",Science,Grade_06,,,California,,http://www.cde.ca.gov/be/st/ss/documents/sciencestnd.pdf
EP&C-5-b,"The process of making decisions about resources and natural systems, and how the assessment of social, economic, political, and environmental factors has changed over time.",Science,Grade_06,1-12,,California,,https://www.cde.ca.gov/ci/sc/cf/scifwprepubversion.asp
EP&C-5-a,There is a spectrum of what is considered in making decisions about resources and natural systems and how those factors influence decisions.,Science,Grade_06,1-12,,California,,https://www.cde.ca.gov/ci/sc/cf/scifwprepubversion.asp
EP&C-5,PRINCIPLE V: Decisions Affecting Resources and Natural Systems are Complex and Involve Many Factors Decisions affecting resources and natural systems are based on a wide range of considerations and decision‐making processes. ,Science,Grade_06,1-12,,California,,https://www.cde.ca.gov/ci/sc/cf/scifwprepubversion.asp
EP&C-4-c,"The capacity of natural systems to adjust to human-caused alterations depends on the nature of the system as well as the scope, scale, and duration of the activity and the nature of its byproducts",Science,Grade_06,1-12,,California,,https://www.cde.ca.gov/ci/sc/cf/scifwprepubversion.asp
EP&C-4-b,"The byproducts of human activity are not readily prevented from entering natural systems and may be beneficial, neutral, or detrimental in their effect.",Science,Grade_06,1-12,,California,,https://www.cde.ca.gov/ci/sc/cf/scifwprepubversion.asp
EP&C-4-a,The effects of human activities on natural systems are directly related to the quantities of resources consumed and to the quantity and characteristics of the resulting byproducts.,Science,Grade_06,1-12,,California,,https://www.cde.ca.gov/ci/sc/cf/scifwprepubversion.asp
EP&C-4,PRINCIPLE IV: There are no Permanent or Impermeable Boundaries that Prevent Matter from Flowing Between Systems The exchange of matter between natural systems and human societies affects the long‐ term functioning of both. ,Science,Grade_06,1-12,,California,,https://www.cde.ca.gov/ci/sc/cf/scifwprepubversion.asp
EP&C-3-c,Human practices can alter the cycles and processes that operate within natural systems.,Science,Grade_06,1-12,,California,,https://www.cde.ca.gov/ci/sc/cf/scifwprepubversion.asp
EP&C-3-b,Human practices depend upon and benefit from the cycles and processes that operate within natural systems.,Science,Grade_06,1-12,,California,,https://www.cde.ca.gov/ci/sc/cf/scifwprepubversion.asp
EP&C-3-a,Natural systems proceed through cycles and processes that are required for their functioning.,Science,Grade_06,1-12,,California,,https://www.cde.ca.gov/ci/sc/cf/scifwprepubversion.asp
EP&C-3,"PRINCIPLE III: Natural Systems Change in Ways that People Benefit from and can Influence Natural systems proceed through cycles that humans depend upon, benefit from and can alter. ",Science,Grade_06,1-12,,California,,https://www.cde.ca.gov/ci/sc/cf/scifwprepubversion.asp
EP&C-2-d,"The legal, economic, and political systems that govern the use and management of natural systems directly influence the geographic extent, composition, biological diversity, and viability of natural systems.",Science,Grade_06,1-12,,California,,https://www.cde.ca.gov/ci/sc/cf/scifwprepubversion.asp
EP&C-2-c,"The expansion and operation of human communities influences the geographic extent, composition, biological diversity, and viability of natural systems.",Science,Grade_06,1-12,,California,,https://www.cde.ca.gov/ci/sc/cf/scifwprepubversion.asp
EP&C-2-b,"Methods used to extract, harvest, transport, and consume natural resources influence the geographic extent, composition, biological diversity, and viability of natural systems.",Science,Grade_06,1-12,,California,,https://www.cde.ca.gov/ci/sc/cf/scifwprepubversion.asp
EP&C-2-a,"Direct and indirect changes to natural systems due to the growth of human populations and their consumption rates influence the geographic extent, composition, biological diversity, and viability of natural systems.",Science,Grade_06,1-12,,California,,https://www.cde.ca.gov/ci/sc/cf/scifwprepubversion.asp
EP&C-2,"PRINCIPLE II: People Influence Natural Systems The long‐term functioning and health of terrestrial, freshwater, coastal and marine ecosystems are influenced by their relationships with human societies. ",Science,Grade_06,1-12,,California,,https://www.cde.ca.gov/ci/sc/cf/scifwprepubversion.asp
EP&C-1-c,"That the quality, quantity, and reliability of the goods and ecosystem services provided by natural systems are directly affected by the health of those systems.",Science,Grade_06,1-12,,California,,https://www.cde.ca.gov/ci/sc/cf/scifwprepubversion.asp
EP&C-1-b,The ecosystem services provided by natural systems are essential to human life and to the functioning of our economies and cultures.,Science,Grade_06,1-12,,California,,https://www.cde.ca.gov/ci/sc/cf/scifwprepubversion.asp
EP&C-1-a,The goods produced by natural systems are essential to human life and to the functioning of our economies and cultures.,Science,Grade_06,1-12,,California,,https://www.cde.ca.gov/ci/sc/cf/scifwprepubversion.asp
EP&C-1,PRINCIPLE I: People Depend on Natural Systems The continuation and health of individual human lives and of human communities and societies depend on the health of the natural systems that provide essential goods and ecosystem services. ,Science,Grade_06,1-12,,California,,https://www.cde.ca.gov/ci/sc/cf/scifwprepubversion.asp
,,Science,Grade_06,6-8,,California,,http://www.nextgenscience.org/sites/default/files/Appendix%20F%20%20Science%20and%20Engineering%20Practices%20in%20the%20NGSS%20-%20FINAL%20060513.pdf
SEP-8-v,"Communicate scientific and/or technical information (e.g. about a proposed object, tool, process, system) in writing and/or through oral presentations",Science,Grade_06,6-8,,California,,http://www.nextgenscience.org/sites/default/files/Appendix%20F%20%20Science%20and%20Engineering%20Practices%20in%20the%20NGSS%20-%20FINAL%20060513.pdf
SEP-8-iv,"Evaluate data, hypotheses, and/or conclusions in scientific and technical texts in light of competing information or accounts.",Science,Grade_06,6-8,,California,,http://www.nextgenscience.org/sites/default/files/Appendix%20F%20%20Science%20and%20Engineering%20Practices%20in%20the%20NGSS%20-%20FINAL%20060513.pdf
SEP-8-iii,"Gather, read, synthesize information from multiple appropriate sources and assess the credibility, accuracy, and possible bias of each publication and methods used, and describe how they are supported or not supported by evidence. ",Science,Grade_06,6-8,,California,,http://www.nextgenscience.org/sites/default/files/Appendix%20F%20%20Science%20and%20Engineering%20Practices%20in%20the%20NGSS%20-%20FINAL%20060513.pdf
SEP-8-ii,Integrate qualitative and/or quantitative scientific and/or technical information in written text with that contained in media and visual displays to clarify claims and findings.,Science,Grade_06,6-8,,California,,http://www.nextgenscience.org/sites/default/files/Appendix%20F%20%20Science%20and%20Engineering%20Practices%20in%20the%20NGSS%20-%20FINAL%20060513.pdf
SEP-8-i,Critically read scientific texts adapted for classroom use to determine the central ideas and/or obtain scientific and/or technical information to describe patterns in and/or evidence about the natural and designed world(s).,Science,Grade_06,6-8,,California,,http://www.nextgenscience.org/sites/default/files/Appendix%20F%20%20Science%20and%20Engineering%20Practices%20in%20the%20NGSS%20-%20FINAL%20060513.pdf
SEP-8,"Obtaining, Evaluating, and Communicating Information
Obtaining, evaluating, and communicating information in 6–8 builds on K–5 experiences and progresses to evaluating the merit and validity of ideas and methods. ",Science,Grade_06,6-8,,California,,http://www.nextgenscience.org/sites/default/files/Appendix%20F%20%20Science%20and%20Engineering%20Practices%20in%20the%20NGSS%20-%20FINAL%20060513.pdf
SEP-7-v,Evaluate competing design solutions based on jointly developed and agreed-upon design criteria.,Science,Grade_06,6-8,,California,,http://www.nextgenscience.org/sites/default/files/Appendix%20F%20%20Science%20and%20Engineering%20Practices%20in%20the%20NGSS%20-%20FINAL%20060513.pdf
SEP-7-iv,"Make an oral or written argument that supports or refutes the advertised performance of a device, process, or system, based on empirical evidence concerning whether or not the technology meets relevant criteria and constraints.",Science,Grade_06,6-8,,California,,http://www.nextgenscience.org/sites/default/files/Appendix%20F%20%20Science%20and%20Engineering%20Practices%20in%20the%20NGSS%20-%20FINAL%20060513.pdf
SEP-7-iii,"Construct, use, and/or present an oral and written argument supported by empirical evidence and scientific reasoning to support or refute an explanation or a model for a phenomenon or a solution to a problem.",Science,Grade_06,6-8,,California,,http://www.nextgenscience.org/sites/default/files/Appendix%20F%20%20Science%20and%20Engineering%20Practices%20in%20the%20NGSS%20-%20FINAL%20060513.pdf
SEP-7-ii,"Respectfully provide and receive critiques about one’s explanations, procedures, models and questions by citing relevant evidence and posing and responding to questions that elicit pertinent elaboration and detail.",Science,Grade_06,6-8,,California,,http://www.nextgenscience.org/sites/default/files/Appendix%20F%20%20Science%20and%20Engineering%20Practices%20in%20the%20NGSS%20-%20FINAL%20060513.pdf
SEP-7-i,Compare and critique two arguments on the same topic and analyze whether they emphasize similar or different evidence and/or interpretations of facts.,Science,Grade_06,6-8,,California,,http://www.nextgenscience.org/sites/default/files/Appendix%20F%20%20Science%20and%20Engineering%20Practices%20in%20the%20NGSS%20-%20FINAL%20060513.pdf
SEP-7,"Engaging in Argument from Evidence
Engaging in argument from evidence in 6–8 builds on K–5 experiences and progresses to constructing a convincing argument that supports or refutes claims for either explanations or solutions about the natural and designed world(s).
",Science,Grade_06,6-8,,California,,http://www.nextgenscience.org/sites/default/files/Appendix%20F%20%20Science%20and%20Engineering%20Practices%20in%20the%20NGSS%20-%20FINAL%20060513.pdf
SEP-6-viii,"Optimize performance of a design by prioritizing criteria, making tradeoffs, testing, revising, and retesting",Science,Grade_06,6-8,,California,,http://www.nextgenscience.org/sites/default/files/Appendix%20F%20%20Science%20and%20Engineering%20Practices%20in%20the%20NGSS%20-%20FINAL%20060513.pdf
SEP-6-vii,"Undertake a design project, engaging in the design cycle, to construct and/or implement a solution that meets specific design criteria and constraints. ",Science,Grade_06,6-8,,California,,http://www.nextgenscience.org/sites/default/files/Appendix%20F%20%20Science%20and%20Engineering%20Practices%20in%20the%20NGSS%20-%20FINAL%20060513.pdf
SEP-6-vi,"Apply scientific ideas or principles to design, construct, and/or test a design of an object, tool, process or system. ",Science,Grade_06,6-8,,California,,http://www.nextgenscience.org/sites/default/files/Appendix%20F%20%20Science%20and%20Engineering%20Practices%20in%20the%20NGSS%20-%20FINAL%20060513.pdf
SEP-6-v,Apply scientific reasoning to show why the data or evidence is adequate for the explanation or conclusion.,Science,Grade_06,6-8,,California,,http://www.nextgenscience.org/sites/default/files/Appendix%20F%20%20Science%20and%20Engineering%20Practices%20in%20the%20NGSS%20-%20FINAL%20060513.pdf
SEP-6-iv,"Apply scientific ideas, principles, and/or evidence to construct, revise and/or use an explanation for realworld phenomena, examples, or events.",Science,Grade_06,6-8,,California,,http://www.nextgenscience.org/sites/default/files/Appendix%20F%20%20Science%20and%20Engineering%20Practices%20in%20the%20NGSS%20-%20FINAL%20060513.pdf
SEP-6-iii,Construct a scientific explanation based on valid and reliable evidence obtained from sources (including the students’ own experiments) and the assumption that theories and laws that describe the natural world operate today as they did in the past and will continue to do so in the future. ,Science,Grade_06,6-8,,California,,http://www.nextgenscience.org/sites/default/files/Appendix%20F%20%20Science%20and%20Engineering%20Practices%20in%20the%20NGSS%20-%20FINAL%20060513.pdf
SEP-6-ii,Construct an explanation using models or representations.,Science,Grade_06,6-8,,California,,http://www.nextgenscience.org/sites/default/files/Appendix%20F%20%20Science%20and%20Engineering%20Practices%20in%20the%20NGSS%20-%20FINAL%20060513.pdf
SEP-6-i,Construct an explanation that includes qualitative or quantitative relationships between variables that predict(s) and/or describe(s) phenomena. ,Science,Grade_06,6-8,,California,,http://www.nextgenscience.org/sites/default/files/Appendix%20F%20%20Science%20and%20Engineering%20Practices%20in%20the%20NGSS%20-%20FINAL%20060513.pdf
SEP-6,"Constructing Explanations and Designing Solutions
Constructing explanations and designing solutions in 6–8 builds on K– 5 experiences and progresses to include constructing explanations and designing solutions supported by multiple sources of evidence consistent with scientific ideas, principles, and theories. ",Science,Grade_06,6-8,,California,,http://www.nextgenscience.org/sites/default/files/Appendix%20F%20%20Science%20and%20Engineering%20Practices%20in%20the%20NGSS%20-%20FINAL%20060513.pdf
SEP-5-v,Use digital tools and/or mathematical concepts and arguments to test and compare proposed solutions to an engineering design problem.,Science,Grade_06,6-8,,California,,http://www.nextgenscience.org/sites/default/files/Appendix%20F%20%20Science%20and%20Engineering%20Practices%20in%20the%20NGSS%20-%20FINAL%20060513.pdf
SEP-5-iv,"Apply mathematical concepts and/or processes (such as ratio, rate, percent, basic operations, and simple algebra) to scientific and engineering questions and problems.",Science,Grade_06,6-8,,California,,http://www.nextgenscience.org/sites/default/files/Appendix%20F%20%20Science%20and%20Engineering%20Practices%20in%20the%20NGSS%20-%20FINAL%20060513.pdf
SEP-5-iii,Create algorithms (a series of ordered steps) to solve a problem. ,Science,Grade_06,6-8,,California,,http://www.nextgenscience.org/sites/default/files/Appendix%20F%20%20Science%20and%20Engineering%20Practices%20in%20the%20NGSS%20-%20FINAL%20060513.pdf
SEP-5-ii,Use mathematical representations to describe and/or support scientific conclusions and design solutions,Science,Grade_06,6-8,,California,,http://www.nextgenscience.org/sites/default/files/Appendix%20F%20%20Science%20and%20Engineering%20Practices%20in%20the%20NGSS%20-%20FINAL%20060513.pdf
SEP-5-i,"Use digital tools (e.g., computers) to analyze very large data sets for patterns and trends.",Science,Grade_06,6-8,,California,,http://www.nextgenscience.org/sites/default/files/Appendix%20F%20%20Science%20and%20Engineering%20Practices%20in%20the%20NGSS%20-%20FINAL%20060513.pdf
SEP-5,"Using Mathematics and Computational Thinking
Mathematical and computational thinking in 6–8 builds on K–5 experiences and progresses to identifying patterns in large data sets and using mathematical concepts to support explanations and arguments. ",Science,Grade_06,6-8,,California,,http://www.nextgenscience.org/sites/default/files/Appendix%20F%20%20Science%20and%20Engineering%20Practices%20in%20the%20NGSS%20-%20FINAL%20060513.pdf
SEP-4-viii,"Analyze data to define an optimal operational range for a proposed object, tool, process or system that best meets criteria for success.",Science,Grade_06,6-8,,California,,http://www.nextgenscience.org/sites/default/files/Appendix%20F%20%20Science%20and%20Engineering%20Practices%20in%20the%20NGSS%20-%20FINAL%20060513.pdf
SEP-4-vii,Analyze and interpret data to determine similarities and differences in findings.,Science,Grade_06,6-8,,California,,http://www.nextgenscience.org/sites/default/files/Appendix%20F%20%20Science%20and%20Engineering%20Practices%20in%20the%20NGSS%20-%20FINAL%20060513.pdf
SEP-4-vi,"Consider limitations of data analysis (e.g., measurement error), and/or seek to improve precision and accuracy of data with better technological tools and methods (e.g., multiple trials).",Science,Grade_06,6-8,,California,,http://www.nextgenscience.org/sites/default/files/Appendix%20F%20%20Science%20and%20Engineering%20Practices%20in%20the%20NGSS%20-%20FINAL%20060513.pdf
SEP-4-v,"Apply concepts of statistics and probability (including mean, median, mode, and variability) to analyze and characterize data, using digital tools when feasible.",Science,Grade_06,6-8,,California,,http://www.nextgenscience.org/sites/default/files/Appendix%20F%20%20Science%20and%20Engineering%20Practices%20in%20the%20NGSS%20-%20FINAL%20060513.pdf
SEP-4-iv,Analyze and interpret data to provide evidence for phenomena.,Science,Grade_06,6-8,,California,,http://www.nextgenscience.org/sites/default/files/Appendix%20F%20%20Science%20and%20Engineering%20Practices%20in%20the%20NGSS%20-%20FINAL%20060513.pdf
SEP-4-iii,Distinguish between causal and correlational relationships in data. ,Science,Grade_06,6-8,,California,,http://www.nextgenscience.org/sites/default/files/Appendix%20F%20%20Science%20and%20Engineering%20Practices%20in%20the%20NGSS%20-%20FINAL%20060513.pdf
SEP-4-ii,"Use graphical displays (e.g., maps, charts, graphs, and/or tables) of large data sets to identify temporal and spatial relationships. ",Science,Grade_06,6-8,,California,,http://www.nextgenscience.org/sites/default/files/Appendix%20F%20%20Science%20and%20Engineering%20Practices%20in%20the%20NGSS%20-%20FINAL%20060513.pdf
SEP-4-i,"Construct, analyze, and/or interpret graphical displays of data and/or large data sets to identify linear and nonlinear relationships.",Science,Grade_06,6-8,,California,,http://www.nextgenscience.org/sites/default/files/Appendix%20F%20%20Science%20and%20Engineering%20Practices%20in%20the%20NGSS%20-%20FINAL%20060513.pdf
SEP-4,"Analyzing and Interpreting Data
Analyzing data in 6–8 builds on K–5 experiences and progresses to extending quantitative analysis to investigations, distinguishing between correlation and causation, and basic statistical techniques of data and error analysis. ",Science,Grade_06,6-8,,California,,http://www.nextgenscience.org/sites/default/files/Appendix%20F%20%20Science%20and%20Engineering%20Practices%20in%20the%20NGSS%20-%20FINAL%20060513.pdf
SEP-3-v,"Collect data about the performance of a proposed object, tool, process, or system under a range of conditions.",Science,Grade_06,6-8,,California,,http://www.nextgenscience.org/sites/default/files/Appendix%20F%20%20Science%20and%20Engineering%20Practices%20in%20the%20NGSS%20-%20FINAL%20060513.pdf
SEP-3-iv,Collect data to produce data to serve as the basis for evidence to answer scientific questions or test design solutions under a range of conditions,Science,Grade_06,6-8,,California,,http://www.nextgenscience.org/sites/default/files/Appendix%20F%20%20Science%20and%20Engineering%20Practices%20in%20the%20NGSS%20-%20FINAL%20060513.pdf
SEP-3-iii,Evaluate the accuracy of various methods for collecting data.,Science,Grade_06,6-8,,California,,http://www.nextgenscience.org/sites/default/files/Appendix%20F%20%20Science%20and%20Engineering%20Practices%20in%20the%20NGSS%20-%20FINAL%20060513.pdf
SEP-3-ii,Conduct an investigation and/or evaluate and/or revise the experimental design to produce data to serve as the basis for evidence that meet the goals of the investigation.,Science,Grade_06,6-8,,California,,http://www.nextgenscience.org/sites/default/files/Appendix%20F%20%20Science%20and%20Engineering%20Practices%20in%20the%20NGSS%20-%20FINAL%20060513.pdf
SEP-3-i,"Plan an investigation individually and collaboratively, and in the design: identify independent and dependent variables and controls, what tools are needed to do the gathering, how measurements will be recorded, and how many data are needed to support a claim. ",Science,Grade_06,6-8,,California,,http://www.nextgenscience.org/sites/default/files/Appendix%20F%20%20Science%20and%20Engineering%20Practices%20in%20the%20NGSS%20-%20FINAL%20060513.pdf
SEP-3,"Planning and Carrying Out Investigations
Planning and carrying out investigations in 6-8 builds on K-5 experiences and progresses to include investigations that use multiple variables and provide evidence to support explanations or solutions. ",Science,Grade_06,6-8,,California,,http://www.nextgenscience.org/sites/default/files/Appendix%20F%20%20Science%20and%20Engineering%20Practices%20in%20the%20NGSS%20-%20FINAL%20060513.pdf
SEP-2-vii,"Develop and/or use a model to generate data to test ideas about phenomena in natural or designed systems, including those representing inputs and outputs, and those at unobservable scales.",Science,Grade_06,6-8,,California,,http://www.nextgenscience.org/sites/default/files/Appendix%20F%20%20Science%20and%20Engineering%20Practices%20in%20the%20NGSS%20-%20FINAL%20060513.pdf
SEP-2-vi,Develop a model to describe unobservable mechanisms.,Science,Grade_06,6-8,,California,,http://www.nextgenscience.org/sites/default/files/Appendix%20F%20%20Science%20and%20Engineering%20Practices%20in%20the%20NGSS%20-%20FINAL%20060513.pdf
SEP-2-v,Develop and/or use a model to predict and/or describe phenomena. ,Science,Grade_06,6-8,,California,,http://www.nextgenscience.org/sites/default/files/Appendix%20F%20%20Science%20and%20Engineering%20Practices%20in%20the%20NGSS%20-%20FINAL%20060513.pdf
SEP-2-iv,"Develop and/or revise a model to show the relationships among variables, including those that are not observable but predict observable phenomena. ",Science,Grade_06,6-8,,California,,http://www.nextgenscience.org/sites/default/files/Appendix%20F%20%20Science%20and%20Engineering%20Practices%20in%20the%20NGSS%20-%20FINAL%20060513.pdf
SEP-2-iii,Use and/or develop a model of simple systems with uncertain and less predictable factors. ,Science,Grade_06,6-8,,California,,http://www.nextgenscience.org/sites/default/files/Appendix%20F%20%20Science%20and%20Engineering%20Practices%20in%20the%20NGSS%20-%20FINAL%20060513.pdf
SEP-2-ii,Develop or modify a model—based on evidence – to match what happens if a variable or component of a system is changed. ,Science,Grade_06,6-8,,California,,http://www.nextgenscience.org/sites/default/files/Appendix%20F%20%20Science%20and%20Engineering%20Practices%20in%20the%20NGSS%20-%20FINAL%20060513.pdf
SEP-2-i,Evaluate limitations of a model for a proposed object or tool.,Science,Grade_06,6-8,,California,,http://www.nextgenscience.org/sites/default/files/Appendix%20F%20%20Science%20and%20Engineering%20Practices%20in%20the%20NGSS%20-%20FINAL%20060513.pdf
SEP-2,"Developing and Using Models
Modeling in 6–8 builds on K–5 experiences and progresses to developing, using, and revising models to describe, test, and predict more abstract phenomena and design systems. ",Science,Grade_06,6-8,,California,,http://www.nextgenscience.org/sites/default/files/Appendix%20F%20%20Science%20and%20Engineering%20Practices%20in%20the%20NGSS%20-%20FINAL%20060513.pdf
SEP-1-iv,"Define a design problem that can be solved through the development of an object, tool, process or system and includes multiple criteria and constraints, including scientific knowledge that may limit possible solutions.",Science,Grade_06,6-8,,California,,http://www.nextgenscience.org/sites/default/files/Appendix%20F%20%20Science%20and%20Engineering%20Practices%20in%20the%20NGSS%20-%20FINAL%20060513.pdf
SEP-1-iii,Ask questions that challenge the premise(s) of an argument or the interpretation of a data set.,Science,Grade_06,6-8,,California,,http://www.nextgenscience.org/sites/default/files/Appendix%20F%20%20Science%20and%20Engineering%20Practices%20in%20the%20NGSS%20-%20FINAL%20060513.pdf
SEP-1-ii,"Ask questions that require sufficient and appropriate empirical evidence to answer. * Ask questions that can be investigated within the scope of the classroom, outdoor environment, and museums and other public facilities with available resources and, when appropriate, frame a hypothesis based on observations and scientific principles.",Science,Grade_06,6-8,,California,,http://www.nextgenscience.org/sites/default/files/Appendix%20F%20%20Science%20and%20Engineering%20Practices%20in%20the%20NGSS%20-%20FINAL%20060513.pdf
