Standard_ID,Standard_Text,Subject,Grade_Level,Range,Interdisciplinary,Framework_Type,Adoption_Date,Source_URL
FA8516E1AF364819A6F6F7D0A76EF0D5,Craft and Structure,English Language Arts,Grade_11,11-12,,Common Core State Standards,2010,http://www.corestandards.org/assets/CCSSI_ELA%20Standards.pdf
CCSS.ELA-Literacy.RI.11-12.3,"Analyze a complex set of ideas or sequence of events and explain how specific individuals, ideas, or events interact and develop over the course of the text.",English Language Arts,Grade_11,11-12,,Common Core State Standards,2010,http://www.corestandards.org/assets/CCSSI_ELA%20Standards.pdf
CCSS.ELA-Literacy.RI.11-12.2,"Determine two or more central ideas of a text and analyze their development over the course of the text, including how they interact and build on one another to provide a complex analysis; provide an objective summary of the text.",English Language Arts,Grade_11,11-12,,Common Core State Standards,2010,http://www.corestandards.org/assets/CCSSI_ELA%20Standards.pdf
CCSS.ELA-Literacy.RI.11-12.1,"Cite strong and thorough textual evidence to support analysis of what the text says explicitly as well as inferences drawn from the text, including determining where the text leaves matters uncertain.",English Language Arts,Grade_11,11-12,,Common Core State Standards,2010,http://www.corestandards.org/assets/CCSSI_ELA%20Standards.pdf
965BB388FB75467DABAD80237A5715DD,Key Ideas and Details,English Language Arts,Grade_11,11-12,,Common Core State Standards,2010,http://www.corestandards.org/assets/CCSSI_ELA%20Standards.pdf
5F45BEF73E5342BFA406F0A50574C876,Reading Standards for Informational Text,English Language Arts,Grade_11,11-12,,Common Core State Standards,2010,http://www.corestandards.org/assets/CCSSI_ELA%20Standards.pdf
CCSS.ELA-Literacy.RL.11-12.10,"By the end of grade 11, read and comprehend literature, including stories, dramas, and poems, in the grades 11—CCR text complexity band proficiently, with scaffolding as needed at the high end of the range.<br />By the end of grade 12, read and comprehend literature, including stories, dramas, and poems, at the high end of the grades 11—CCR text complexity band independently and proficiently.",English Language Arts,Grade_11,11-12,,Common Core State Standards,2010,http://www.corestandards.org/assets/CCSSI_ELA%20Standards.pdf
CB69614995FD4B2AA672CC06EE27A34F,Range of Reading and Level of Text Complexity,English Language Arts,Grade_11,11-12,,Common Core State Standards,2010,http://www.corestandards.org/assets/CCSSI_ELA%20Standards.pdf
CCSS.ELA-Literacy.RL.11-12.9,"Demonstrate knowledge of eighteenth-, nineteenth- and early-twentieth-century foundational works of American literature, including how two or more texts from the same period treat similar themes or topics.",English Language Arts,Grade_11,11-12,,Common Core State Standards,2010,http://www.corestandards.org/assets/CCSSI_ELA%20Standards.pdf
CCSS.ELA-Literacy.RL.11-12.7,"Analyze multiple interpretations of a story, drama, or poem (e.g., recorded or live production of a play or recorded novel or poetry), evaluating how each version interprets the source text. (Include at least one play by Shakespeare and one play by an American dramatist.)",English Language Arts,Grade_11,11-12,,Common Core State Standards,2010,http://www.corestandards.org/assets/CCSSI_ELA%20Standards.pdf
D47C64AA845E4913AAD7A2D57D710CF1,Integration of Knowledge and Ideas,English Language Arts,Grade_11,11-12,,Common Core State Standards,2010,http://www.corestandards.org/assets/CCSSI_ELA%20Standards.pdf
CCSS.ELA-Literacy.RL.11-12.6,"Analyze a case in which grasping point of view requires distinguishing what is directly stated in a text from what is really meant (e.g., satire, sarcasm, irony, or understatement).",English Language Arts,Grade_11,11-12,,Common Core State Standards,2010,http://www.corestandards.org/assets/CCSSI_ELA%20Standards.pdf
CCSS.ELA-Literacy.RL.11-12.5,"Analyze how an author's choices concerning how to structure specific parts of a text (e.g., the choice of where to begin or end a story, the choice to provide a comedic or tragic resolution) contribute to its overall structure and meaning as well as its aesthetic impact.",English Language Arts,Grade_11,11-12,,Common Core State Standards,2010,http://www.corestandards.org/assets/CCSSI_ELA%20Standards.pdf
CCSS.ELA-Literacy.RL.11-12.4,"Determine the meaning of words and phrases as they are used in the text, including figurative and connotative meanings; analyze the impact of specific word choices on meaning and tone, including words with multiple meanings or language that is particularly fresh, engaging, or beautiful. (Include Shakespeare as well as other authors.)",English Language Arts,Grade_11,11-12,,Common Core State Standards,2010,http://www.corestandards.org/assets/CCSSI_ELA%20Standards.pdf
BE4418F3113D4286B5ECD152FE2EDFCB,Craft and Structure,English Language Arts,Grade_11,11-12,,Common Core State Standards,2010,http://www.corestandards.org/assets/CCSSI_ELA%20Standards.pdf
CCSS.ELA-Literacy.RL.11-12.3,"Analyze the impact of the author's choices regarding how to develop and relate elements of a story or drama (e.g., where a story is set, how the action is ordered, how the characters are introduced and developed).",English Language Arts,Grade_11,11-12,,Common Core State Standards,2010,http://www.corestandards.org/assets/CCSSI_ELA%20Standards.pdf
CCSS.ELA-Literacy.RL.11-12.2,"Determine two or more themes or central ideas of a text and analyze their development over the course of the text, including how they interact and build on one another to produce a complex account; provide an objective summary of the text.",English Language Arts,Grade_11,11-12,,Common Core State Standards,2010,http://www.corestandards.org/assets/CCSSI_ELA%20Standards.pdf
CCSS.ELA-Literacy.RL.11-12.1,"Cite strong and thorough textual evidence to support analysis of what the text says explicitly as well as inferences drawn from the text, including determining where the text leaves matters uncertain.",English Language Arts,Grade_11,11-12,,Common Core State Standards,2010,http://www.corestandards.org/assets/CCSSI_ELA%20Standards.pdf
650A48A5FF2C471E9E6A6B7DDA945659,Key Ideas and Details,English Language Arts,Grade_11,11-12,,Common Core State Standards,2010,http://www.corestandards.org/assets/CCSSI_ELA%20Standards.pdf
2098824D741947EBB0E5B85AAD291675,Reading Standards for Literature,English Language Arts,Grade_11,11-12,,Common Core State Standards,2010,http://www.corestandards.org/assets/CCSSI_ELA%20Standards.pdf
CCSS.ELA-Literacy.CCRA.R.10,Read and comprehend complex literary and informational texts independently and proficiently.,English Language Arts,Grade_11,11-12,,Common Core State Standards,2010,http://www.corestandards.org/assets/CCSSI_ELA%20Standards.pdf
647BD027AECD4471A21D071A097ADBBB,Range of Reading and Level of Text Complexity,English Language Arts,Grade_11,11-12,,Common Core State Standards,2010,http://www.corestandards.org/assets/CCSSI_ELA%20Standards.pdf
CCSS.ELA-Literacy.CCRA.R.9,Analyze how two or more texts address similar themes or topics in order to build knowledge or to compare the approaches the authors take.,English Language Arts,Grade_11,11-12,,Common Core State Standards,2010,http://www.corestandards.org/assets/CCSSI_ELA%20Standards.pdf
CCSS.ELA-Literacy.CCRA.R.8,"Delineate and evaluate the argument and specific claims in a text, including the validity of the reasoning as well as the relevance and sufficiency of the evidence.",English Language Arts,Grade_11,11-12,,Common Core State Standards,2010,http://www.corestandards.org/assets/CCSSI_ELA%20Standards.pdf
CCSS.ELA-Literacy.CCRA.R.7,"Integrate and evaluate content presented in diverse media and formats, including visually and quantitatively, as well as in words.",English Language Arts,Grade_11,11-12,,Common Core State Standards,2010,http://www.corestandards.org/assets/CCSSI_ELA%20Standards.pdf
3E897B1E32394BFD81685C675A6B3487,Integration of Knowledge and Ideas,English Language Arts,Grade_11,11-12,,Common Core State Standards,2010,http://www.corestandards.org/assets/CCSSI_ELA%20Standards.pdf
CCSS.ELA-Literacy.CCRA.R.6,Assess how point of view or purpose shapes the content and style of a text.,English Language Arts,Grade_11,11-12,,Common Core State Standards,2010,http://www.corestandards.org/assets/CCSSI_ELA%20Standards.pdf
CCSS.ELA-Literacy.CCRA.R.5,"Analyze the structure of texts, including how specific sentences, paragraphs, and larger portions of the text (e.g., a section, chapter, scene, or stanza) relate to each other and the whole.",English Language Arts,Grade_11,11-12,,Common Core State Standards,2010,http://www.corestandards.org/assets/CCSSI_ELA%20Standards.pdf
CCSS.ELA-Literacy.CCRA.R.4,"Interpret words and phrases as they are used in a text, including determining technical, connotative, and figurative meanings, and analyze how specific word choices shape meaning or tone.",English Language Arts,Grade_11,11-12,,Common Core State Standards,2010,http://www.corestandards.org/assets/CCSSI_ELA%20Standards.pdf
5529D80FF55347CEA6A8D1632ED75AC8,Craft and Structure,English Language Arts,Grade_11,11-12,,Common Core State Standards,2010,http://www.corestandards.org/assets/CCSSI_ELA%20Standards.pdf
CCSS.ELA-Literacy.CCRA.R.3,"Analyze how and why individuals, events, and ideas develop and interact over the course of a text.",English Language Arts,Grade_11,11-12,,Common Core State Standards,2010,http://www.corestandards.org/assets/CCSSI_ELA%20Standards.pdf
CCSS.ELA-Literacy.CCRA.R.2,Determine central ideas or themes of a text and analyze their development; summarize the key supporting details and ideas.,English Language Arts,Grade_11,11-12,,Common Core State Standards,2010,http://www.corestandards.org/assets/CCSSI_ELA%20Standards.pdf
CCSS.ELA-Literacy.CCRA.R.1,Read closely to determine what the text says explicitly and to make logical inferences from it; cite specific textual evidence when writing or speaking to support conclusions drawn from the text.,English Language Arts,Grade_11,11-12,,Common Core State Standards,2010,http://www.corestandards.org/assets/CCSSI_ELA%20Standards.pdf
62A23268103A4B4ABA79056DA27D5C40,Key Ideas and Details,English Language Arts,Grade_11,11-12,,Common Core State Standards,2010,http://www.corestandards.org/assets/CCSSI_ELA%20Standards.pdf
B204A0B873D74F7AA07049501C5DC0BE,College and Career Readiness Anchor Standards for Reading,English Language Arts,Grade_11,11-12,,Common Core State Standards,2010,http://www.corestandards.org/assets/CCSSI_ELA%20Standards.pdf
CCSS.ELA-LITERACY.WHST.11-12.10,"Write routinely over extended time frames (time for reflection and revision) and shorter time frames (a single sitting or a day or two) for a range of discipline-specific tasks, purposes, and audiences.",English Language Arts,Grade_11,11-12,,Common Core State Standards,,https://www.thecorestandards.org/ELA-Literacy/WHST/11-12/
ccss.ELA-literacy.whst.4,Range of Writing:,English Language Arts,Grade_11,11-12,,Common Core State Standards,,https://www.thecorestandards.org/ELA-Literacy/WHST/11-12/
CCSS.ELA-LITERACY.WHST.11-12.9,"Draw evidence from informational texts to support analysis, reflection, and research.",English Language Arts,Grade_11,11-12,,Common Core State Standards,,https://www.thecorestandards.org/ELA-Literacy/WHST/11-12/
CCSS.ELA-LITERACY.WHST.11-12.8,"Gather relevant information from multiple authoritative print and digital sources, using advanced searches effectively; assess the strengths and limitations of each source in terms of the specific task, purpose, and audience; integrate information into the text selectively to maintain the flow of ideas, avoiding plagiarism and overreliance on any one source and following a standard format for citation.",English Language Arts,Grade_11,11-12,,Common Core State Standards,,https://www.thecorestandards.org/ELA-Literacy/WHST/11-12/
CCSS.ELA-LITERACY.WHST.11-12.7,"Conduct short as well as more sustained research projects to answer a question (including a self-generated question) or solve a problem; narrow or broaden the inquiry when appropriate; synthesize multiple sources on the subject, demonstrating understanding of the subject under investigation.",English Language Arts,Grade_11,11-12,,Common Core State Standards,,https://www.thecorestandards.org/ELA-Literacy/WHST/11-12/
ccss.ELA-literacy.whst.3,Research to Build and Present Knowledge:,English Language Arts,Grade_11,11-12,,Common Core State Standards,,https://www.thecorestandards.org/ELA-Literacy/WHST/11-12/
CCSS.ELA-LITERACY.WHST.11-12.6,"Use technology, including the Internet, to produce, publish, and update individual or shared writing products in response to ongoing feedback, including new arguments or information.",English Language Arts,Grade_11,11-12,,Common Core State Standards,,https://www.thecorestandards.org/ELA-Literacy/WHST/11-12/
CCSS.ELA-LITERACY.WHST.11-12.5,"Develop and strengthen writing as needed by planning, revising, editing, rewriting, or trying a new approach, focusing on addressing what is most significant for a specific purpose and audience.",English Language Arts,Grade_11,11-12,,Common Core State Standards,,https://www.thecorestandards.org/ELA-Literacy/WHST/11-12/
CCSS.ELA-LITERACY.WHST.11-12.4,"Produce clear and coherent writing in which the development, organization, and style are appropriate to task, purpose, and audience.",English Language Arts,Grade_11,11-12,,Common Core State Standards,,https://www.thecorestandards.org/ELA-Literacy/WHST/11-12/
ccss.ELA-literacy.whst.2,Production and Distribution of Writing:,English Language Arts,Grade_11,11-12,,Common Core State Standards,,https://www.thecorestandards.org/ELA-Literacy/WHST/11-12/
CCSS.ELA-LITERACY.WHST.11-12.2.E,"Provide a concluding statement or section that follows from and supports the information or explanation provided (e.g., articulating implications or the significance of the topic).",English Language Arts,Grade_11,11-12,,Common Core State Standards,,https://www.thecorestandards.org/ELA-Literacy/WHST/11-12/
CCSS.ELA-LITERACY.WHST.11-12.2.D,"Use precise language, domain-specific vocabulary and techniques such as metaphor, simile, and analogy to manage the complexity of the topic; convey a knowledgeable stance in a style that responds to the discipline and context as well as to the expertise of likely readers.",English Language Arts,Grade_11,11-12,,Common Core State Standards,,https://www.thecorestandards.org/ELA-Literacy/WHST/11-12/
CCSS.ELA-LITERACY.WHST.11-12.2.C,"Use varied transitions and sentence structures to link the major sections of the text, create cohesion, and clarify the relationships among complex ideas and concepts.",English Language Arts,Grade_11,11-12,,Common Core State Standards,,https://www.thecorestandards.org/ELA-Literacy/WHST/11-12/
CCSS.ELA-LITERACY.WHST.11-12.2.B,"Develop the topic thoroughly by selecting the most significant and relevant facts, extended definitions, concrete details, quotations, or other information and examples appropriate to the audience's knowledge of the topic.",English Language Arts,Grade_11,11-12,,Common Core State Standards,,https://www.thecorestandards.org/ELA-Literacy/WHST/11-12/
CCSS.ELA-LITERACY.WHST.11-12.2.A,"Introduce a topic and organize complex ideas, concepts, and information so that each new element builds on that which precedes it to create a unified whole; include formatting (e.g., headings), graphics (e.g., figures, tables), and multimedia when useful to aiding comprehension.",English Language Arts,Grade_11,11-12,,Common Core State Standards,,https://www.thecorestandards.org/ELA-Literacy/WHST/11-12/
CCSS.ELA-LITERACY.WHST.11-12.2,"Write informative/explanatory texts, including the narration of historical events, scientific procedures/experiments, or technical processes.",English Language Arts,Grade_11,11-12,,Common Core State Standards,,https://www.thecorestandards.org/ELA-Literacy/WHST/11-12/
CCSS.ELA-LITERACY.WHST.11-12.1.E,Provide a concluding statement or section that follows from or supports the argument presented.,English Language Arts,Grade_11,11-12,,Common Core State Standards,,https://www.thecorestandards.org/ELA-Literacy/WHST/11-12/
CCSS.ELA-LITERACY.WHST.11-12.1.D,Establish and maintain a formal style and objective tone while attending to the norms and conventions of the discipline in which they are writing.,English Language Arts,Grade_11,11-12,,Common Core State Standards,,https://www.thecorestandards.org/ELA-Literacy/WHST/11-12/
CCSS.ELA-LITERACY.WHST.11-12.1.C,"Use words, phrases, and clauses as well as varied syntax to link the major sections of the text, create cohesion, and clarify the relationships between claim(s) and reasons, between reasons and evidence, and between claim(s) and counterclaims.",English Language Arts,Grade_11,11-12,,Common Core State Standards,,https://www.thecorestandards.org/ELA-Literacy/WHST/11-12/
CCSS.ELA-LITERACY.WHST.11-12.1.B,"Develop claim(s) and counterclaims fairly and thoroughly, supplying the most relevant data and evidence for each while pointing out the strengths and limitations of both claim(s) and counterclaims in a discipline-appropriate form that anticipates the audience's knowledge level, concerns, values, and possible biases.",English Language Arts,Grade_11,11-12,,Common Core State Standards,,https://www.thecorestandards.org/ELA-Literacy/WHST/11-12/
CCSS.ELA-LITERACY.WHST.11-12.1.A,"Introduce precise, knowledgeable claim(s), establish the significance of the claim(s), distinguish the claim(s) from alternate or opposing claims, and create an organization that logically sequences the claim(s), counterclaims, reasons, and evidence.",English Language Arts,Grade_11,11-12,,Common Core State Standards,,https://www.thecorestandards.org/ELA-Literacy/WHST/11-12/
CCSS.ELA-LITERACY.WHST.11-12.1,Write arguments focused on discipline-specific content.,English Language Arts,Grade_11,11-12,,Common Core State Standards,,https://www.thecorestandards.org/ELA-Literacy/WHST/11-12/
ccss.ELA-literacy.whst.1,Text Types and Purposes:,English Language Arts,Grade_11,11-12,,Common Core State Standards,,https://www.thecorestandards.org/ELA-Literacy/WHST/11-12/
