Standard_ID,Standard_Text,Subject,Grade_Level,Range,Interdisciplinary,Framework_Type,Adoption_Date,Source_URL
CCSS.ELA-Literacy.W.11-12.8,"Gather relevant information from multiple authoritative print and digital sources, using advanced searches effectively; assess the strengths and limitations of each source in terms of the task, purpose, and audience; integrate information into the text selectively to maintain the flow of ideas, avoiding plagiarism and over-reliance on any one source and following a standard format for citation.",English Language Arts,Grade_11,11-12,,Common Core State Standards,2010,http://www.corestandards.org/assets/CCSSI_ELA%20Standards.pdf
CCSS.ELA-Literacy.W.11-12.7,"Conduct short as well as more sustained research projects to answer a question (including a self-generated question) or solve a problem; narrow or broaden the inquiry when appropriate; synthesize multiple sources on the subject, demonstrating understanding of the subject under investigation.",English Language Arts,Grade_11,11-12,,Common Core State Standards,2010,http://www.corestandards.org/assets/CCSSI_ELA%20Standards.pdf
ABBBB3683A2846E7B04744618BF5BAC5,Research to Build and Present Knowledge,English Language Arts,Grade_11,11-12,,Common Core State Standards,2010,http://www.corestandards.org/assets/CCSSI_ELA%20Standards.pdf
CCSS.ELA-Literacy.W.11-12.6,"Use technology, including the Internet, to produce, publish, and update individual or shared writing products in response to ongoing feedback, including new arguments or information.",English Language Arts,Grade_11,11-12,,Common Core State Standards,2010,http://www.corestandards.org/assets/CCSSI_ELA%20Standards.pdf
CCSS.ELA-Literacy.W.11-12.5,"Develop and strengthen writing as needed by planning, revising, editing, rewriting, or trying a new approach, focusing on addressing what is most significant for a specific purpose and audience.",English Language Arts,Grade_11,11-12,,Common Core State Standards,2010,http://www.corestandards.org/assets/CCSSI_ELA%20Standards.pdf
CCSS.ELA-Literacy.W.11-12.4,"Produce clear and coherent writing in which the development, organization, and style are appropriate to task, purpose, and audience.",English Language Arts,Grade_11,11-12,,Common Core State Standards,2010,http://www.corestandards.org/assets/CCSSI_ELA%20Standards.pdf
4FF09BF03B0B441D99C71DA1543FA445,Production and Distribution of Writing,English Language Arts,Grade_11,11-12,,Common Core State Standards,2010,http://www.corestandards.org/assets/CCSSI_ELA%20Standards.pdf
CCSS.ELA-Literacy.W.11-12.3e,"Provide a conclusion that follows from and reflects on what is experienced, observed, or resolved over the course of the narrative.",English Language Arts,Grade_11,11-12,,Common Core State Standards,2010,http://www.corestandards.org/assets/CCSSI_ELA%20Standards.pdf
CCSS.ELA-Literacy.W.11-12.3d,"Use precise words and phrases, telling details, and sensory language to convey a vivid picture of the experiences, events, setting, and/or characters.",English Language Arts,Grade_11,11-12,,Common Core State Standards,2010,http://www.corestandards.org/assets/CCSSI_ELA%20Standards.pdf
CCSS.ELA-Literacy.W.11-12.3c,"Use a variety of techniques to sequence events so that they build on one another to create a coherent whole and build toward a particular tone and outcome (e.g., a sense of mystery, suspense, growth, or resolution).",English Language Arts,Grade_11,11-12,,Common Core State Standards,2010,http://www.corestandards.org/assets/CCSSI_ELA%20Standards.pdf
CCSS.ELA-Literacy.W.11-12.3b,"Use narrative techniques, such as dialogue, pacing, description, reflection, and multiple plot lines, to develop experiences, events, and/or characters.",English Language Arts,Grade_11,11-12,,Common Core State Standards,2010,http://www.corestandards.org/assets/CCSSI_ELA%20Standards.pdf
CCSS.ELA-Literacy.W.11-12.3a,"Engage and orient the reader by setting out a problem, situation, or observation and its significance, establishing one or multiple point(s) of view, and introducing a narrator and/or characters; create a smooth progression of experiences or events.",English Language Arts,Grade_11,11-12,,Common Core State Standards,2010,http://www.corestandards.org/assets/CCSSI_ELA%20Standards.pdf
CCSS.ELA-Literacy.W.11-12.3,"Write narratives to develop real or imagined experiences or events using effective technique, well-chosen details, and well-structured event sequences.",English Language Arts,Grade_11,11-12,,Common Core State Standards,2010,http://www.corestandards.org/assets/CCSSI_ELA%20Standards.pdf
CCSS.ELA-Literacy.W.11-12.2f,"Provide a concluding statement or section that follows from and supports the information or explanation presented (e.g., articulating implications or the significance of the topic).",English Language Arts,Grade_11,11-12,,Common Core State Standards,2010,http://www.corestandards.org/assets/CCSSI_ELA%20Standards.pdf
CCSS.ELA-Literacy.W.11-12.2e,Establish and maintain a formal style and objective tone while attending to the norms and conventions of the discipline in which they are writing.,English Language Arts,Grade_11,11-12,,Common Core State Standards,2010,http://www.corestandards.org/assets/CCSSI_ELA%20Standards.pdf
CCSS.ELA-Literacy.W.11-12.2d,"Use precise language, domain-specific vocabulary, and techniques such as metaphor, simile, and analogy to manage the complexity of the topic.",English Language Arts,Grade_11,11-12,,Common Core State Standards,2010,http://www.corestandards.org/assets/CCSSI_ELA%20Standards.pdf
CCSS.ELA-Literacy.W.11-12.2c,"Use appropriate and varied transitions and syntax to link the major sections of the text, create cohesion, and clarify the relationships among complex ideas and concepts.",English Language Arts,Grade_11,11-12,,Common Core State Standards,2010,http://www.corestandards.org/assets/CCSSI_ELA%20Standards.pdf
CCSS.ELA-Literacy.W.11-12.2b,"Develop the topic thoroughly by selecting the most significant and relevant facts, extended definitions, concrete details, quotations, or other information and examples appropriate to the audience's knowledge of the topic.",English Language Arts,Grade_11,11-12,,Common Core State Standards,2010,http://www.corestandards.org/assets/CCSSI_ELA%20Standards.pdf
CCSS.ELA-Literacy.W.11-12.2a,"Introduce a topic; organize complex ideas, concepts, and information so that each new element builds on that which precedes it to create a unified whole; include formatting (e.g., headings), graphics (e.g., figures, tables), and multimedia when useful to aiding comprehension.",English Language Arts,Grade_11,11-12,,Common Core State Standards,2010,http://www.corestandards.org/assets/CCSSI_ELA%20Standards.pdf
CCSS.ELA-Literacy.W.11-12.2,"Write informative/explanatory texts to examine and convey complex ideas, concepts, and information clearly and accurately through the effective selection, organization, and analysis of content.",English Language Arts,Grade_11,11-12,,Common Core State Standards,2010,http://www.corestandards.org/assets/CCSSI_ELA%20Standards.pdf
CCSS.ELA-Literacy.W.11-12.1e,Provide a concluding statement or section that follows from and supports the argument presented.,English Language Arts,Grade_11,11-12,,Common Core State Standards,2010,http://www.corestandards.org/assets/CCSSI_ELA%20Standards.pdf
CCSS.ELA-Literacy.W.11-12.1d,Establish and maintain a formal style and objective tone while attending to the norms and conventions of the discipline in which they are writing.,English Language Arts,Grade_11,11-12,,Common Core State Standards,2010,http://www.corestandards.org/assets/CCSSI_ELA%20Standards.pdf
CCSS.ELA-Literacy.W.11-12.1c,"Use words, phrases, and clauses as well as varied syntax to link the major sections of the text, create cohesion, and clarify the relationships between claim(s) and reasons, between reasons and evidence, and between claim(s) and counterclaims.",English Language Arts,Grade_11,11-12,,Common Core State Standards,2010,http://www.corestandards.org/assets/CCSSI_ELA%20Standards.pdf
CCSS.ELA-Literacy.W.11-12.1b,"Develop claim(s) and counterclaims fairly and thoroughly, supplying the most relevant evidence for each while pointing out the strengths and limitations of both in a manner that anticipates the audience's knowledge level, concerns, values, and possible biases.",English Language Arts,Grade_11,11-12,,Common Core State Standards,2010,http://www.corestandards.org/assets/CCSSI_ELA%20Standards.pdf
CCSS.ELA-Literacy.W.11-12.1a,"Introduce precise, knowledgeable claim(s), establish the significance of the claim(s), distinguish the claim(s) from alternate or opposing claims, and create an organization that logically sequences claim(s), counterclaims, reasons, and evidence.",English Language Arts,Grade_11,11-12,,Common Core State Standards,2010,http://www.corestandards.org/assets/CCSSI_ELA%20Standards.pdf
CCSS.ELA-Literacy.W.11-12.1,"Write arguments to support claims in an analysis of substantive topics or texts, using valid reasoning and relevant and sufficient evidence.",English Language Arts,Grade_11,11-12,,Common Core State Standards,2010,http://www.corestandards.org/assets/CCSSI_ELA%20Standards.pdf
2A13A9ED82BD48E6923D47725D450FD5,Text Types and Purposes,English Language Arts,Grade_11,11-12,,Common Core State Standards,2010,http://www.corestandards.org/assets/CCSSI_ELA%20Standards.pdf
E5E78350A1AE433F9A6F90BDE56D8250,Writing Standards,English Language Arts,Grade_11,11-12,,Common Core State Standards,2010,http://www.corestandards.org/assets/CCSSI_ELA%20Standards.pdf
CCSS.ELA-Literacy.CCRA.W.10,"Write routinely over extended time frames (time for research, reflection, and revision) and shorter time frames (a single sitting or a day or two) for a range of tasks, purposes, and audiences.",English Language Arts,Grade_11,11-12,,Common Core State Standards,2010,http://www.corestandards.org/assets/CCSSI_ELA%20Standards.pdf
DB485BD82A40416C8032E0CA66B87EF8,Range of Writing,English Language Arts,Grade_11,11-12,,Common Core State Standards,2010,http://www.corestandards.org/assets/CCSSI_ELA%20Standards.pdf
CCSS.ELA-Literacy.CCRA.W.9,"Draw evidence from literary or informational texts to support analysis, reflection, and research.",English Language Arts,Grade_11,11-12,,Common Core State Standards,2010,http://www.corestandards.org/assets/CCSSI_ELA%20Standards.pdf
CCSS.ELA-Literacy.CCRA.W.8,"Gather relevant information from multiple print and digital sources, assess the credibility and accuracy of each source, and integrate the information while avoiding plagiarism.",English Language Arts,Grade_11,11-12,,Common Core State Standards,2010,http://www.corestandards.org/assets/CCSSI_ELA%20Standards.pdf
CCSS.ELA-Literacy.CCRA.W.7,"Conduct short as well as more sustained research projects based on focused questions, demonstrating understanding of the subject under investigation.",English Language Arts,Grade_11,11-12,,Common Core State Standards,2010,http://www.corestandards.org/assets/CCSSI_ELA%20Standards.pdf
142577D2257D43979B031D7949DFD3AB,Research to Build and Present Knowledge,English Language Arts,Grade_11,11-12,,Common Core State Standards,2010,http://www.corestandards.org/assets/CCSSI_ELA%20Standards.pdf
CCSS.ELA-Literacy.CCRA.W.6,"Use technology, including the Internet, to produce and publish writing and to interact and collaborate with others.",English Language Arts,Grade_11,11-12,,Common Core State Standards,2010,http://www.corestandards.org/assets/CCSSI_ELA%20Standards.pdf
CCSS.ELA-Literacy.CCRA.W.5,"Develop and strengthen writing as needed by planning, revising, editing, rewriting, or trying a new approach.",English Language Arts,Grade_11,11-12,,Common Core State Standards,2010,http://www.corestandards.org/assets/CCSSI_ELA%20Standards.pdf
CCSS.ELA-Literacy.CCRA.W.4,"Produce clear and coherent writing in which the development, organization, and style are appropriate to task, purpose, and audience.",English Language Arts,Grade_11,11-12,,Common Core State Standards,2010,http://www.corestandards.org/assets/CCSSI_ELA%20Standards.pdf
61A24AEB2C0A47AAB6FDBB408771FD76,Production and Distribution of Writing,English Language Arts,Grade_11,11-12,,Common Core State Standards,2010,http://www.corestandards.org/assets/CCSSI_ELA%20Standards.pdf
CCSS.ELA-Literacy.CCRA.W.3,"Write narratives to develop real or imagined experiences or events using effective technique, well-chosen details, and well-structured event sequences.",English Language Arts,Grade_11,11-12,,Common Core State Standards,2010,http://www.corestandards.org/assets/CCSSI_ELA%20Standards.pdf
CCSS.ELA-Literacy.CCRA.W.2,"Write informative/explanatory texts to examine and convey complex ideas and information clearly and accurately through the effective selection, organization, and analysis of content.",English Language Arts,Grade_11,11-12,,Common Core State Standards,2010,http://www.corestandards.org/assets/CCSSI_ELA%20Standards.pdf
CCSS.ELA-Literacy.CCRA.W.1,"Write arguments to support claims in an analysis of substantive topics or texts, using valid reasoning and relevant and sufficient evidence.",English Language Arts,Grade_11,11-12,,Common Core State Standards,2010,http://www.corestandards.org/assets/CCSSI_ELA%20Standards.pdf
D2C8DCE4B18747D59EF8A4584FD1AB7D,Text Types and Purposes,English Language Arts,Grade_11,11-12,,Common Core State Standards,2010,http://www.corestandards.org/assets/CCSSI_ELA%20Standards.pdf
4E4ACD008A6A4856B273152E744C7D33,College and Career Readiness Anchor Standards for Writing,English Language Arts,Grade_11,11-12,,Common Core State Standards,2010,http://www.corestandards.org/assets/CCSSI_ELA%20Standards.pdf
CCSS.ELA-Literacy.RST.11-12.10,"By the end of grade 12, read and comprehend science/technical texts in the grades 11—CCR text complexity band independently and proficiently.",English Language Arts,Grade_11,11-12,,Common Core State Standards,2010,http://www.corestandards.org/assets/CCSSI_ELA%20Standards.pdf
4959B1E549D84DA9A703506359EAB1A4,Range of Reading and Level of Text Complexity,English Language Arts,Grade_11,11-12,,Common Core State Standards,2010,http://www.corestandards.org/assets/CCSSI_ELA%20Standards.pdf
CCSS.ELA-Literacy.RST.11-12.9,"Synthesize information from a range of sources (e.g., texts, experiments, simulations) into a coherent understanding of a process, phenomenon, or concept, resolving conflicting information when possible.",English Language Arts,Grade_11,11-12,,Common Core State Standards,2010,http://www.corestandards.org/assets/CCSSI_ELA%20Standards.pdf
CCSS.ELA-Literacy.RST.11-12.8,"Evaluate the hypotheses, data, analysis, and conclusions in a science or technical text, verifying the data when possible and corroborating or challenging conclusions with other sources of information.",English Language Arts,Grade_11,11-12,,Common Core State Standards,2010,http://www.corestandards.org/assets/CCSSI_ELA%20Standards.pdf
CCSS.ELA-Literacy.RST.11-12.7,"Integrate and evaluate multiple sources of information presented in diverse formats and media (e.g., quantitative data, video, multimedia) in order to address a question or solve a problem.",English Language Arts,Grade_11,11-12,,Common Core State Standards,2010,http://www.corestandards.org/assets/CCSSI_ELA%20Standards.pdf
2327A2B1C5C743118AA95205CBEC8800,Integration of Knowledge and Ideas,English Language Arts,Grade_11,11-12,,Common Core State Standards,2010,http://www.corestandards.org/assets/CCSSI_ELA%20Standards.pdf
CCSS.ELA-Literacy.RST.11-12.6,"Analyze the author's purpose in providing an explanation, describing a procedure, or discussing an experiment in a text, identifying important issues that remain unresolved.",English Language Arts,Grade_11,11-12,,Common Core State Standards,2010,http://www.corestandards.org/assets/CCSSI_ELA%20Standards.pdf
CCSS.ELA-Literacy.RST.11-12.5,"Analyze how the text structures information or ideas into categories or hierarchies, demonstrating understanding of the information or ideas.",English Language Arts,Grade_11,11-12,,Common Core State Standards,2010,http://www.corestandards.org/assets/CCSSI_ELA%20Standards.pdf
CCSS.ELA-Literacy.RST.11-12.4,"Determine the meaning of symbols, key terms, and other domain-specific words and phrases as they are used in a specific scientific or technical context relevant to grades 11—12 texts and topics.",English Language Arts,Grade_11,11-12,,Common Core State Standards,2010,http://www.corestandards.org/assets/CCSSI_ELA%20Standards.pdf
76571F6BE0BE4EC6A67B85434D2A2955,Craft and Structure,English Language Arts,Grade_11,11-12,,Common Core State Standards,2010,http://www.corestandards.org/assets/CCSSI_ELA%20Standards.pdf
CCSS.ELA-Literacy.RST.11-12.3,"Follow precisely a complex multistep procedure when carrying out experiments, taking measurements, or performing technical tasks; analyze the specific results based on explanations in the text.",English Language Arts,Grade_11,11-12,,Common Core State Standards,2010,http://www.corestandards.org/assets/CCSSI_ELA%20Standards.pdf
CCSS.ELA-Literacy.RST.11-12.2,"Determine the central ideas or conclusions of a text; summarize complex concepts, processes, or information presented in a text by paraphrasing them in simpler but still accurate terms.",English Language Arts,Grade_11,11-12,,Common Core State Standards,2010,http://www.corestandards.org/assets/CCSSI_ELA%20Standards.pdf
CCSS.ELA-Literacy.RST.11-12.1,"Cite specific textual evidence to support analysis of science and technical texts, attending to important distinctions the author makes and to any gaps or inconsistencies in the account.",English Language Arts,Grade_11,11-12,,Common Core State Standards,2010,http://www.corestandards.org/assets/CCSSI_ELA%20Standards.pdf
FF679A86820040BBBBB89E9336BBDE0C,Key Ideas and Details,English Language Arts,Grade_11,11-12,,Common Core State Standards,2010,http://www.corestandards.org/assets/CCSSI_ELA%20Standards.pdf
68F261671B1F434594B40D3F5E48A252,Reading Standards for Literacy in Science and Technical Subjects 6—12,English Language Arts,Grade_11,11-12,,Common Core State Standards,2010,http://www.corestandards.org/assets/CCSSI_ELA%20Standards.pdf
CCSS.ELA-Literacy.RH.11-12.10,"By the end of grade 12, read and comprehend history/social studies texts in the grades 11—CCR text complexity band independently and proficiently.",English Language Arts,Grade_11,11-12,,Common Core State Standards,2010,http://www.corestandards.org/assets/CCSSI_ELA%20Standards.pdf
029AB2E8633249848BBBBA05EAF716A4,Range of Reading and Level of Text Complexity,English Language Arts,Grade_11,11-12,,Common Core State Standards,2010,http://www.corestandards.org/assets/CCSSI_ELA%20Standards.pdf
CCSS.ELA-Literacy.RH.11-12.9,"Integrate information from diverse sources, both primary and secondary, into a coherent understanding of an idea or event, noting discrepancies among sources.",English Language Arts,Grade_11,11-12,,Common Core State Standards,2010,http://www.corestandards.org/assets/CCSSI_ELA%20Standards.pdf
CCSS.ELA-Literacy.RH.11-12.8,"Evaluate an author's premises, claims, and evidence by corroborating or challenging them with other information.",English Language Arts,Grade_11,11-12,,Common Core State Standards,2010,http://www.corestandards.org/assets/CCSSI_ELA%20Standards.pdf
CCSS.ELA-Literacy.RH.11-12.7,"Integrate and evaluate multiple sources of information presented in diverse formats and media (e.g., visually, quantitatively, as well as in words) in order to address a question or solve a problem.",English Language Arts,Grade_11,11-12,,Common Core State Standards,2010,http://www.corestandards.org/assets/CCSSI_ELA%20Standards.pdf
2A76A29F4DEF4301A71822638A2BC344,Integration of Knowledge and Ideas,English Language Arts,Grade_11,11-12,,Common Core State Standards,2010,http://www.corestandards.org/assets/CCSSI_ELA%20Standards.pdf
CCSS.ELA-Literacy.RH.11-12.6,"Evaluate authors' differing points of view on the same historical event or issue by assessing the authors' claims, reasoning, and evidence.",English Language Arts,Grade_11,11-12,,Common Core State Standards,2010,http://www.corestandards.org/assets/CCSSI_ELA%20Standards.pdf
CCSS.ELA-Literacy.RH.11-12.5,"Analyze in detail how a complex primary source is structured, including how key sentences, paragraphs, and larger portions of the text contribute to the whole.",English Language Arts,Grade_11,11-12,,Common Core State Standards,2010,http://www.corestandards.org/assets/CCSSI_ELA%20Standards.pdf
CCSS.ELA-Literacy.RH.11-12.4,"Determine the meaning of words and phrases as they are used in a text, including analyzing how an author uses and refines the meaning of a key term over the course of a text (e.g., how Madison defines faction in Federalist No. 10).",English Language Arts,Grade_11,11-12,,Common Core State Standards,2010,http://www.corestandards.org/assets/CCSSI_ELA%20Standards.pdf
EDA7B9BAF62A406382B231F21F37672D,Craft and Structure,English Language Arts,Grade_11,11-12,,Common Core State Standards,2010,http://www.corestandards.org/assets/CCSSI_ELA%20Standards.pdf
CCSS.ELA-Literacy.RH.11-12.3,"Evaluate various explanations for actions or events and determine which explanation best accords with textual evidence, acknowledging where the text leaves matters uncertain.",English Language Arts,Grade_11,11-12,,Common Core State Standards,2010,http://www.corestandards.org/assets/CCSSI_ELA%20Standards.pdf
CCSS.ELA-Literacy.RH.11-12.2,Determine the central ideas or information of a primary or secondary source; provide an accurate summary that makes clear the relationships among the key details and ideas.,English Language Arts,Grade_11,11-12,,Common Core State Standards,2010,http://www.corestandards.org/assets/CCSSI_ELA%20Standards.pdf
CCSS.ELA-Literacy.RH.11-12.1,"Cite specific textual evidence to support analysis of primary and secondary sources, connecting insights gained from specific details to an understanding of the text as a whole.",English Language Arts,Grade_11,11-12,,Common Core State Standards,2010,http://www.corestandards.org/assets/CCSSI_ELA%20Standards.pdf
97E76DB29230462890B10F9413E24382,Key Ideas and Details,English Language Arts,Grade_11,11-12,,Common Core State Standards,2010,http://www.corestandards.org/assets/CCSSI_ELA%20Standards.pdf
108CB176BB6B41F19CFF435F904C3955,Reading Standards for Literacy in History/Social Studies 6—12,English Language Arts,Grade_11,11-12,,Common Core State Standards,2010,http://www.corestandards.org/assets/CCSSI_ELA%20Standards.pdf
CCSS.ELA-Literacy.RI.11-12.10,"By the end of grade 11, read and comprehend literary nonfiction in the grades 11—CCR text complexity band proficiently, with scaffolding as needed at the high end of the range.<br />By the end of grade 12, read and comprehend literary nonfiction at the high end of the grades 11—CCR text complexity band independently and proficiently.",English Language Arts,Grade_11,11-12,,Common Core State Standards,2010,http://www.corestandards.org/assets/CCSSI_ELA%20Standards.pdf
234470EAC4E14AA2836E66E873BF3700,Range of Reading and Level of Text Complexity,English Language Arts,Grade_11,11-12,,Common Core State Standards,2010,http://www.corestandards.org/assets/CCSSI_ELA%20Standards.pdf
CCSS.ELA-Literacy.RI.11-12.9,"Analyze seventeenth-, eighteenth-, and nineteenth-century foundational U.S. documents of historical and literary significance (including The Declaration of Independence, the Preamble to the Constitution, the Bill of Rights, and Lincoln's Second Inaugural Address) for their themes, purposes, and rhetorical features.",English Language Arts,Grade_11,11-12,,Common Core State Standards,2010,http://www.corestandards.org/assets/CCSSI_ELA%20Standards.pdf
CCSS.ELA-Literacy.RI.11-12.8,"Delineate and evaluate the reasoning in seminal U.S. texts, including the application of constitutional principles and use of legal reasoning (e.g., in U.S. Supreme Court majority opinions and dissents) and the premises, purposes, and arguments in works of public advocacy (e.g., The Federalist, presidential addresses).",English Language Arts,Grade_11,11-12,,Common Core State Standards,2010,http://www.corestandards.org/assets/CCSSI_ELA%20Standards.pdf
CCSS.ELA-Literacy.RI.11-12.7,"Integrate and evaluate multiple sources of information presented in different media or formats (e.g., visually, quantitatively) as well as in words in order to address a question or solve a problem.",English Language Arts,Grade_11,11-12,,Common Core State Standards,2010,http://www.corestandards.org/assets/CCSSI_ELA%20Standards.pdf
1A4A6CF2DF714DF9890DE9855F17698D,Integration of Knowledge and Ideas,English Language Arts,Grade_11,11-12,,Common Core State Standards,2010,http://www.corestandards.org/assets/CCSSI_ELA%20Standards.pdf
CCSS.ELA-Literacy.RI.11-12.6,"Determine an author's point of view or purpose in a text in which the rhetoric is particularly effective, analyzing how style and content contribute to the power, persuasiveness, or beauty of the text.",English Language Arts,Grade_11,11-12,,Common Core State Standards,2010,http://www.corestandards.org/assets/CCSSI_ELA%20Standards.pdf
CCSS.ELA-Literacy.RI.11-12.5,"Analyze and evaluate the effectiveness of the structure an author uses in his or her exposition or argument, including whether the structure makes points clear, convincing, and engaging.",English Language Arts,Grade_11,11-12,,Common Core State Standards,2010,http://www.corestandards.org/assets/CCSSI_ELA%20Standards.pdf
CCSS.ELA-Literacy.RI.11-12.4,"Determine the meaning of words and phrases as they are used in a text, including figurative, connotative, and technical meanings; analyze how an author uses and refines the meaning of a key term or terms over the course of a text (e.g., how Madison defines faction in Federalist No. 10).",English Language Arts,Grade_11,11-12,,Common Core State Standards,2010,http://www.corestandards.org/assets/CCSSI_ELA%20Standards.pdf
