Standard_ID,Standard_Text,Subject,Grade_Level,Range,Interdisciplinary,Framework_Type,Adoption_Date,Source_URL
CCSS.Math.Content.3.NBT.A.3,"Multiply one-digit whole numbers by multiples of 10 in the range 10—90 (e.g., 9 × 80, 5 × 60) using strategies based on place value and properties of operations.",Mathematics,Grade_03,,,Common Core State Standards,2010,http://www.corestandards.org/assets/CCSSI_Math%20Standards.pdf
CCSS.Math.Content.3.NBT.A.2,"Fluently add and subtract within 1000 using strategies and algorithms based on place value, properties of operations, and/or the relationship between addition and subtraction.",Mathematics,Grade_03,,,Common Core State Standards,2010,http://www.corestandards.org/assets/CCSSI_Math%20Standards.pdf
CCSS.Math.Content.3.NBT.A.1,Use place value understanding to round whole numbers to the nearest 10 or 100.,Mathematics,Grade_03,,,Common Core State Standards,2010,http://www.corestandards.org/assets/CCSSI_Math%20Standards.pdf
CCSS.Math.Content.3.NBT.A,Use place value understanding and properties of operations to perform multi-digit arithmetic.,Mathematics,Grade_03,,,Common Core State Standards,2010,http://www.corestandards.org/assets/CCSSI_Math%20Standards.pdf
D0772610DFE401311CEA68A86D17958E,Number and Operations in Base Ten,Mathematics,Grade_03,,,Common Core State Standards,2010,http://www.corestandards.org/assets/CCSSI_Math%20Standards.pdf
CCSS.Math.Content.3.OA.D.9,"Identify arithmetic patterns (including patterns in the addition table or multiplication table), and explain them using properties of operations.",Mathematics,Grade_03,,,Common Core State Standards,2010,http://www.corestandards.org/assets/CCSSI_Math%20Standards.pdf
CCSS.Math.Content.3.OA.D.8,Solve two-step word problems using the four operations. Represent these problems using equations with a letter standing for the unknown quantity. Assess the reasonableness of answers using mental computation and estimation strategies including rounding.,Mathematics,Grade_03,,,Common Core State Standards,2010,http://www.corestandards.org/assets/CCSSI_Math%20Standards.pdf
CCSS.Math.Content.3.OA.D,"Solve problems involving the four operations, and identify and explain patterns in arithmetic.",Mathematics,Grade_03,,,Common Core State Standards,2010,http://www.corestandards.org/assets/CCSSI_Math%20Standards.pdf
CCSS.Math.Content.3.OA.C.7,"Fluently multiply and divide within 100, using strategies such as the relationship between multiplication and division (e.g., knowing that 8 × 5 = 40, one knows 40 ÷ 5 = 8) or properties of operations. By the end of Grade 3, know from memory all products of two one-digit numbers.",Mathematics,Grade_03,,,Common Core State Standards,2010,http://www.corestandards.org/assets/CCSSI_Math%20Standards.pdf
CCSS.Math.Content.3.OA.C,Multiply and divide within 100.,Mathematics,Grade_03,,,Common Core State Standards,2010,http://www.corestandards.org/assets/CCSSI_Math%20Standards.pdf
CCSS.Math.Content.3.OA.B.6,Understand division as an unknown-factor problem.,Mathematics,Grade_03,,,Common Core State Standards,2010,http://www.corestandards.org/assets/CCSSI_Math%20Standards.pdf
CCSS.Math.Content.3.OA.B.5,Apply properties of operations as strategies to multiply and divide.,Mathematics,Grade_03,,,Common Core State Standards,2010,http://www.corestandards.org/assets/CCSSI_Math%20Standards.pdf
CCSS.Math.Content.3.OA.B,Understand properties of multiplication and the relationship between multiplication and division.,Mathematics,Grade_03,,,Common Core State Standards,2010,http://www.corestandards.org/assets/CCSSI_Math%20Standards.pdf
CCSS.Math.Content.3.OA.A.4,Determine the unknown whole number in a multiplication or division equation relating three whole numbers.,Mathematics,Grade_03,,,Common Core State Standards,2010,http://www.corestandards.org/assets/CCSSI_Math%20Standards.pdf
CCSS.Math.Content.3.OA.A.3,"Use multiplication and division within 100 to solve word problems in situations involving equal groups, arrays, and measurement quantities, e.g., by using drawings and equations with a symbol for the unknown number to represent the problem.",Mathematics,Grade_03,,,Common Core State Standards,2010,http://www.corestandards.org/assets/CCSSI_Math%20Standards.pdf
CCSS.Math.Content.3.OA.A.2,"Interpret whole-number quotients of whole numbers, e.g., interpret 56 ÷ 8 as the number of objects in each share when 56 objects are partitioned equally into 8 shares, or as a number of shares when 56 objects are partitioned into equal shares of 8 objects each.",Mathematics,Grade_03,,,Common Core State Standards,2010,http://www.corestandards.org/assets/CCSSI_Math%20Standards.pdf
CCSS.Math.Content.3.OA.A.1,"Interpret products of whole numbers, e.g., interpret 5 × 7 as the total number of objects in 5 groups of 7 objects each.",Mathematics,Grade_03,,,Common Core State Standards,2010,http://www.corestandards.org/assets/CCSSI_Math%20Standards.pdf
CCSS.Math.Content.3.OA.A,Represent and solve problems involving multiplication and division.,Mathematics,Grade_03,,,Common Core State Standards,2010,http://www.corestandards.org/assets/CCSSI_Math%20Standards.pdf
D0714BF0DFE401311CE968A86D17958E,Operations and Algebraic Thinking,Mathematics,Grade_03,,,Common Core State Standards,2010,http://www.corestandards.org/assets/CCSSI_Math%20Standards.pdf
CCSS.Math.Practice.MP8,Look for and express regularity in repeated reasoning.,Mathematics,Grade_03,,,Common Core State Standards,2010,http://www.corestandards.org/assets/CCSSI_Math%20Standards.pdf
CCSS.Math.Practice.MP7,Look for and make use of structure.,Mathematics,Grade_03,,,Common Core State Standards,2010,http://www.corestandards.org/assets/CCSSI_Math%20Standards.pdf
CCSS.Math.Practice.MP6,Attend to precision.,Mathematics,Grade_03,,,Common Core State Standards,2010,http://www.corestandards.org/assets/CCSSI_Math%20Standards.pdf
CCSS.Math.Practice.MP5,Use appropriate tools strategically.,Mathematics,Grade_03,,,Common Core State Standards,2010,http://www.corestandards.org/assets/CCSSI_Math%20Standards.pdf
CCSS.Math.Practice.MP4,Model with mathematics.,Mathematics,Grade_03,,,Common Core State Standards,2010,http://www.corestandards.org/assets/CCSSI_Math%20Standards.pdf
CCSS.Math.Practice.MP3,Construct viable arguments and critique the reasoning of others.,Mathematics,Grade_03,,,Common Core State Standards,2010,http://www.corestandards.org/assets/CCSSI_Math%20Standards.pdf
CCSS.Math.Practice.MP2,Reason abstractly and quantitatively.,Mathematics,Grade_03,,,Common Core State Standards,2010,http://www.corestandards.org/assets/CCSSI_Math%20Standards.pdf
CCSS.Math.Practice.MP1,Make sense of problems and persevere in solving them.,Mathematics,Grade_03,,,Common Core State Standards,2010,http://www.corestandards.org/assets/CCSSI_Math%20Standards.pdf
D0868B50DFE401311CEE68A86D17958E,Standards for Mathematical Practice,Mathematics,Grade_03,,,Common Core State Standards,2010,http://www.corestandards.org/assets/CCSSI_Math%20Standards.pdf
