Standard_ID,Standard_Text,Subject,Grade_Level,Range,Interdisciplinary,Framework_Type,Adoption_Date,Source_URL
3.NF.3.d,"Compare two fractions with the same numerator or the same denominator by reasoning about their size. Recognize that comparisons are valid only when the two fractions refer to the same whole. Record the results of comparisons with the symbols >, =, or <, and justify the conclusions, e.g., by using a visual fraction model.",Mathematics,Grade_03,,,California,2010,http://www.cde.ca.gov/be/st/ss/documents/ccssmathstandardaug2013.pdf
3.NF.3.c,"Express whole numbers as fractions, and recognize fractions that are equivalent to whole numbers.",Mathematics,Grade_03,,,California,2010,http://www.cde.ca.gov/be/st/ss/documents/ccssmathstandardaug2013.pdf
3.NF.3.b,"Recognize and generate simple equivalent fractions, e.g., 1/2 = 2/4, 4/6 = 2/3). Explain why the fractions are equivalent, e.g., by using a visual fraction model.",Mathematics,Grade_03,,,California,2010,http://www.cde.ca.gov/be/st/ss/documents/ccssmathstandardaug2013.pdf
3.NF.3.a,"Understand two fractions as equivalent (equal) if they are the same size, or the same point on a number line.",Mathematics,Grade_03,,,California,2010,http://www.cde.ca.gov/be/st/ss/documents/ccssmathstandardaug2013.pdf
3.NF.3,"Explain equivalence of fractions in special cases, and compare fractions by reasoning about their size.",Mathematics,Grade_03,,,California,2010,http://www.cde.ca.gov/be/st/ss/documents/ccssmathstandardaug2013.pdf
3.NF.2.b,Represent a fraction a/b on a number line diagram by marking off a lengths 1/b from 0. Recognize that the resulting interval has size a/b and that its endpoint locates the number a/b on the number line.,Mathematics,Grade_03,,,California,2010,http://www.cde.ca.gov/be/st/ss/documents/ccssmathstandardaug2013.pdf
3.NF.2.a,Represent a fraction 1/b on a number line diagram by defining the interval from 0 to 1 as the whole and partitioning it into b equal parts. Recognize that each part has size 1/b and that the endpoint of the part based at 0 locates the number 1/b on the number line.,Mathematics,Grade_03,,,California,2010,http://www.cde.ca.gov/be/st/ss/documents/ccssmathstandardaug2013.pdf
3.NF.2,Understand a fraction as a number on the number line; represent fractions on a number line diagram.,Mathematics,Grade_03,,,California,2010,http://www.cde.ca.gov/be/st/ss/documents/ccssmathstandardaug2013.pdf
3.NF.1,Understand a fraction 1/b as the quantity formed by 1 part when a whole is partitioned into b equal parts; understand a fraction a/b as the quantity formed by a parts of size 1/b.,Mathematics,Grade_03,,,California,2010,http://www.cde.ca.gov/be/st/ss/documents/ccssmathstandardaug2013.pdf
3.NF.A,Develop understanding of fractions as numbers.,Mathematics,Grade_03,,,California,2010,http://www.cde.ca.gov/be/st/ss/documents/ccssmathstandardaug2013.pdf
7BD6987B8DB648CD82B653F1E6D7D84F,Number and Operations—Fractions,Mathematics,Grade_03,,,California,2010,http://www.cde.ca.gov/be/st/ss/documents/ccssmathstandardaug2013.pdf
3.G.2,Partition shapes into parts with equal areas. Express the area of each part as a unit fraction of the whole.,Mathematics,Grade_03,,,California,2010,http://www.cde.ca.gov/be/st/ss/documents/ccssmathstandardaug2013.pdf
3.G.1,"Understand that shapes in different categories (e.g., rhombuses, rectangles, and others) may share attributes (e.g., having four sides), and that the shared attributes can define a larger category (e.g., quadrilaterals). Recognize rhombuses, rectangles, and squares as examples of quadrilaterals, and draw examples of quadrilaterals that do not belong to any of these subcategories.",Mathematics,Grade_03,,,California,2010,http://www.cde.ca.gov/be/st/ss/documents/ccssmathstandardaug2013.pdf
3.G.A,Reason with shapes and their attributes.,Mathematics,Grade_03,,,California,2010,http://www.cde.ca.gov/be/st/ss/documents/ccssmathstandardaug2013.pdf
B8E1FC3CAC2D4440AF1DDF4E9AE22850,Geometry,Mathematics,Grade_03,,,California,2010,http://www.cde.ca.gov/be/st/ss/documents/ccssmathstandardaug2013.pdf
3.MD.8,"Solve real world and mathematical problems involving perimeters of polygons, including finding the perimeter given the side lengths, finding an unknown side length, and exhibiting rectangles with the same perimeter and different areas or with the same area and different perimeters.",Mathematics,Grade_03,,,California,2010,http://www.cde.ca.gov/be/st/ss/documents/ccssmathstandardaug2013.pdf
3.MD.D,Geometric measurement: recognize perimeter as an attribute of plane figures and distinguish between linear and area measures.,Mathematics,Grade_03,,,California,2010,http://www.cde.ca.gov/be/st/ss/documents/ccssmathstandardaug2013.pdf
3.MD.7.d,"Recognize area as additive. Find areas of rectilinear figures by decomposing them into non-overlapping rectangles and adding the areas of the non-overlapping parts, applying this technique to solve real world problems.",Mathematics,Grade_03,,,California,2010,http://www.cde.ca.gov/be/st/ss/documents/ccssmathstandardaug2013.pdf
3.MD.7.c,Use tiling to show in a concrete case that the area of a rectangle with whole-number side lengths a and b + c is the sum of a × b and a × c. Use area models to represent the distributive property in mathematical reasoning.,Mathematics,Grade_03,,,California,2010,http://www.cde.ca.gov/be/st/ss/documents/ccssmathstandardaug2013.pdf
3.MD.7.b,"Multiply side lengths to find areas of rectangles with whole-number side lengths in the context of solving real world and mathematical problems, and represent whole-number products as rectangular areas in mathematical reasoning.",Mathematics,Grade_03,,,California,2010,http://www.cde.ca.gov/be/st/ss/documents/ccssmathstandardaug2013.pdf
3.MD.7.a,"Find the area of a rectangle with whole-number side lengths by tiling it, and show that the area is the same as would be found by multiplying the side lengths.",Mathematics,Grade_03,,,California,2010,http://www.cde.ca.gov/be/st/ss/documents/ccssmathstandardaug2013.pdf
3.MD.7,Relate area to the operations of multiplication and addition.,Mathematics,Grade_03,,,California,2010,http://www.cde.ca.gov/be/st/ss/documents/ccssmathstandardaug2013.pdf
3.MD.6,"Measure areas by counting unit squares (square cm, square m, square in, square ft, and improvised units).",Mathematics,Grade_03,,,California,2010,http://www.cde.ca.gov/be/st/ss/documents/ccssmathstandardaug2013.pdf
3.MD.5.b,A plane figure which can be covered without gaps or overlaps by n unit squares is said to have an area of n square units.,Mathematics,Grade_03,,,California,2010,http://www.cde.ca.gov/be/st/ss/documents/ccssmathstandardaug2013.pdf
3.MD.5.a,"A square with side length 1 unit, called ""a unit square,"" is said to have ""one square unit"" of area, and can be used to measure area.",Mathematics,Grade_03,,,California,2010,http://www.cde.ca.gov/be/st/ss/documents/ccssmathstandardaug2013.pdf
3.MD.5,Recognize area as an attribute of plane figures and understand concepts of area measurement.,Mathematics,Grade_03,,,California,2010,http://www.cde.ca.gov/be/st/ss/documents/ccssmathstandardaug2013.pdf
3.MD.C,Geometric measurement: understand concepts of area and relate area to multiplication and to addition.,Mathematics,Grade_03,,,California,2010,http://www.cde.ca.gov/be/st/ss/documents/ccssmathstandardaug2013.pdf
3.MD.4,"Generate measurement data by measuring lengths using rulers marked with halves and fourths of an inch. Show the data by making a line plot, where the horizontal scale is marked off in appropriate units— whole numbers, halves, or quarters.",Mathematics,Grade_03,,,California,2010,http://www.cde.ca.gov/be/st/ss/documents/ccssmathstandardaug2013.pdf
3.MD.3,"Draw a scaled picture graph and a scaled bar graph to represent a data set with several categories. Solve one- and two-step ""how many more"" and ""how many less"" problems using information presented in scaled bar graphs.",Mathematics,Grade_03,,,California,2010,http://www.cde.ca.gov/be/st/ss/documents/ccssmathstandardaug2013.pdf
3.MD.B,Represent and interpret data.,Mathematics,Grade_03,,,California,2010,http://www.cde.ca.gov/be/st/ss/documents/ccssmathstandardaug2013.pdf
3.MD.2,"Measure and estimate liquid volumes and masses of objects using standard units of grams (g), kilograms (kg), and liters (l). Add, subtract, multiply, or divide to solve one-step word problems involving masses or volumes that are given in the same units, e.g., by using drawings (such as a beaker with a measurement scale) to represent the problem.",Mathematics,Grade_03,,,California,2010,http://www.cde.ca.gov/be/st/ss/documents/ccssmathstandardaug2013.pdf
3.MD.1,"Tell and write time to the nearest minute and measure time intervals in minutes. Solve word problems involving addition and subtraction of time intervals in minutes, e.g., by representing the problem on a number line diagram.",Mathematics,Grade_03,,,California,2010,http://www.cde.ca.gov/be/st/ss/documents/ccssmathstandardaug2013.pdf
3.MD.A,"Solve problems involving measurement and estimation of intervals of time, liquid volumes, and masses of objects.",Mathematics,Grade_03,,,California,2010,http://www.cde.ca.gov/be/st/ss/documents/ccssmathstandardaug2013.pdf
FE259FA262D441A98C97350559097732,Measurement and Data,Mathematics,Grade_03,,,California,2010,http://www.cde.ca.gov/be/st/ss/documents/ccssmathstandardaug2013.pdf
3.NBT.3,"Multiply one-digit whole numbers by multiples of 10 in the range 10—90 (e.g., 9 × 80, 5 × 60) using strategies based on place value and properties of operations.",Mathematics,Grade_03,,,California,2010,http://www.cde.ca.gov/be/st/ss/documents/ccssmathstandardaug2013.pdf
3.NBT.2,"Fluently add and subtract within 1000 using strategies and algorithms based on place value, properties of operations, and/or the relationship between addition and subtraction.",Mathematics,Grade_03,,,California,2010,http://www.cde.ca.gov/be/st/ss/documents/ccssmathstandardaug2013.pdf
3.NBT.1,Use place value understanding to round whole numbers to the nearest 10 or 100.,Mathematics,Grade_03,,,California,2010,http://www.cde.ca.gov/be/st/ss/documents/ccssmathstandardaug2013.pdf
3.NBT.A,Use place value understanding and properties of operations to perform multi-digit arithmetic.,Mathematics,Grade_03,,,California,2010,http://www.cde.ca.gov/be/st/ss/documents/ccssmathstandardaug2013.pdf
48869EE79BA149378A5C8F7D6B1978AE,Number and Operations in Base Ten,Mathematics,Grade_03,,,California,2010,http://www.cde.ca.gov/be/st/ss/documents/ccssmathstandardaug2013.pdf
3.OA.9,"Identify arithmetic patterns (including patterns in the addition table or multiplication table), and explain them using properties of operations.",Mathematics,Grade_03,,,California,2010,http://www.cde.ca.gov/be/st/ss/documents/ccssmathstandardaug2013.pdf
3.OA.8,Solve two-step word problems using the four operations. Represent these problems using equations with a letter standing for the unknown quantity. Assess the reasonableness of answers using mental computation and estimation strategies including rounding.,Mathematics,Grade_03,,,California,2010,http://www.cde.ca.gov/be/st/ss/documents/ccssmathstandardaug2013.pdf
3.OA.D,"Solve problems involving the four operations, and identify and explain patterns in arithmetic.",Mathematics,Grade_03,,,California,2010,http://www.cde.ca.gov/be/st/ss/documents/ccssmathstandardaug2013.pdf
3.OA.7,"Fluently multiply and divide within 100, using strategies such as the relationship between multiplication and division (e.g., knowing that 8 × 5 = 40, one knows 40 ÷ 5 = 8) or properties of operations. By the end of Grade 3, know from memory all products of two one-digit numbers.",Mathematics,Grade_03,,,California,2010,http://www.cde.ca.gov/be/st/ss/documents/ccssmathstandardaug2013.pdf
3.OA.C,Multiply and divide within 100.,Mathematics,Grade_03,,,California,2010,http://www.cde.ca.gov/be/st/ss/documents/ccssmathstandardaug2013.pdf
3.OA.6,Understand division as an unknown-factor problem.,Mathematics,Grade_03,,,California,2010,http://www.cde.ca.gov/be/st/ss/documents/ccssmathstandardaug2013.pdf
3.OA.5,Apply properties of operations as strategies to multiply and divide.,Mathematics,Grade_03,,,California,2010,http://www.cde.ca.gov/be/st/ss/documents/ccssmathstandardaug2013.pdf
3.OA.B,Understand properties of multiplication and the relationship between multiplication and division.,Mathematics,Grade_03,,,California,2010,http://www.cde.ca.gov/be/st/ss/documents/ccssmathstandardaug2013.pdf
3.OA.4,Determine the unknown whole number in a multiplication or division equation relating three whole numbers.,Mathematics,Grade_03,,,California,2010,http://www.cde.ca.gov/be/st/ss/documents/ccssmathstandardaug2013.pdf
3.OA.3,"Use multiplication and division within 100 to solve word problems in situations involving equal groups, arrays, and measurement quantities, e.g., by using drawings and equations with a symbol for the unknown number to represent the problem.",Mathematics,Grade_03,,,California,2010,http://www.cde.ca.gov/be/st/ss/documents/ccssmathstandardaug2013.pdf
3.OA.2,"Interpret whole-number quotients of whole numbers, e.g., interpret 56 ÷ 8 as the number of objects in each share when 56 objects are partitioned equally into 8 shares, or as a number of shares when 56 objects are partitioned into equal shares of 8 objects each.",Mathematics,Grade_03,,,California,2010,http://www.cde.ca.gov/be/st/ss/documents/ccssmathstandardaug2013.pdf
3.OA.1,"Interpret products of whole numbers, e.g., interpret 5 × 7 as the total number of objects in 5 groups of 7 objects each.",Mathematics,Grade_03,,,California,2010,http://www.cde.ca.gov/be/st/ss/documents/ccssmathstandardaug2013.pdf
3.OA.A,Represent and solve problems involving multiplication and division.,Mathematics,Grade_03,,,California,2010,http://www.cde.ca.gov/be/st/ss/documents/ccssmathstandardaug2013.pdf
D32D8650D0554BA986F60145CB1882BC,Operations and Algebraic Thinking,Mathematics,Grade_03,,,California,2010,http://www.cde.ca.gov/be/st/ss/documents/ccssmathstandardaug2013.pdf
MP.8,Look for and express regularity in repeated reasoning.,Mathematics,Grade_03,,,California,2010,http://www.cde.ca.gov/be/st/ss/documents/ccssmathstandardaug2013.pdf
MP.7,Look for and make use of structure.,Mathematics,Grade_03,,,California,2010,http://www.cde.ca.gov/be/st/ss/documents/ccssmathstandardaug2013.pdf
MP.6,Attend to precision.,Mathematics,Grade_03,,,California,2010,http://www.cde.ca.gov/be/st/ss/documents/ccssmathstandardaug2013.pdf
MP.5,Use appropriate tools strategically.,Mathematics,Grade_03,,,California,2010,http://www.cde.ca.gov/be/st/ss/documents/ccssmathstandardaug2013.pdf
MP.4,Model with mathematics.,Mathematics,Grade_03,,,California,2010,http://www.cde.ca.gov/be/st/ss/documents/ccssmathstandardaug2013.pdf
MP.3,Construct viable arguments and critique the reasoning of others.,Mathematics,Grade_03,,,California,2010,http://www.cde.ca.gov/be/st/ss/documents/ccssmathstandardaug2013.pdf
MP.2,Reason abstractly and quantitatively.,Mathematics,Grade_03,,,California,2010,http://www.cde.ca.gov/be/st/ss/documents/ccssmathstandardaug2013.pdf
MP.1,Make sense of problems and persevere in solving them.,Mathematics,Grade_03,,,California,2010,http://www.cde.ca.gov/be/st/ss/documents/ccssmathstandardaug2013.pdf
788138FE95FE4B1B83D93B02E4689E28,Standards for Mathematical Practice,Mathematics,Grade_03,,,California,2010,http://www.cde.ca.gov/be/st/ss/documents/ccssmathstandardaug2013.pdf
CCSS.Math.Content.3.NF.A.3d,"Compare two fractions with the same numerator or the same denominator by reasoning about their size. Recognize that comparisons are valid only when the two fractions refer to the same whole. Record the results of comparisons with the symbols >, =, or <, and justify the conclusions, e.g., by using a visual fraction model.",Mathematics,Grade_03,,,Common Core State Standards,2010,http://www.corestandards.org/assets/CCSSI_Math%20Standards.pdf
CCSS.Math.Content.3.NF.A.3c,"Express whole numbers as fractions, and recognize fractions that are equivalent to whole numbers.",Mathematics,Grade_03,,,Common Core State Standards,2010,http://www.corestandards.org/assets/CCSSI_Math%20Standards.pdf
CCSS.Math.Content.3.NF.A.3b,"Recognize and generate simple equivalent fractions, e.g., 1/2 = 2/4, 4/6 = 2/3). Explain why the fractions are equivalent, e.g., by using a visual fraction model.",Mathematics,Grade_03,,,Common Core State Standards,2010,http://www.corestandards.org/assets/CCSSI_Math%20Standards.pdf
CCSS.Math.Content.3.NF.A.3a,"Understand two fractions as equivalent (equal) if they are the same size, or the same point on a number line.",Mathematics,Grade_03,,,Common Core State Standards,2010,http://www.corestandards.org/assets/CCSSI_Math%20Standards.pdf
CCSS.Math.Content.3.NF.A.3,"Explain equivalence of fractions in special cases, and compare fractions by reasoning about their size.",Mathematics,Grade_03,,,Common Core State Standards,2010,http://www.corestandards.org/assets/CCSSI_Math%20Standards.pdf
CCSS.Math.Content.3.NF.A.2b,Represent a fraction a/b on a number line diagram by marking off a lengths 1/b from 0. Recognize that the resulting interval has size a/b and that its endpoint locates the number a/b on the number line.,Mathematics,Grade_03,,,Common Core State Standards,2010,http://www.corestandards.org/assets/CCSSI_Math%20Standards.pdf
CCSS.Math.Content.3.NF.A.2a,Represent a fraction 1/b on a number line diagram by defining the interval from 0 to 1 as the whole and partitioning it into b equal parts. Recognize that each part has size 1/b and that the endpoint of the part based at 0 locates the number 1/b on the number line.,Mathematics,Grade_03,,,Common Core State Standards,2010,http://www.corestandards.org/assets/CCSSI_Math%20Standards.pdf
CCSS.Math.Content.3.NF.A.2,Understand a fraction as a number on the number line; represent fractions on a number line diagram.,Mathematics,Grade_03,,,Common Core State Standards,2010,http://www.corestandards.org/assets/CCSSI_Math%20Standards.pdf
CCSS.Math.Content.3.NF.A.1,Understand a fraction 1/b as the quantity formed by 1 part when a whole is partitioned into b equal parts; understand a fraction a/b as the quantity formed by a parts of size 1/b.,Mathematics,Grade_03,,,Common Core State Standards,2010,http://www.corestandards.org/assets/CCSSI_Math%20Standards.pdf
CCSS.Math.Content.3.NF.A,Develop understanding of fractions as numbers.,Mathematics,Grade_03,,,Common Core State Standards,2010,http://www.corestandards.org/assets/CCSSI_Math%20Standards.pdf
D0824F90DFE401311CED68A86D17958E,Number and Operations—Fractions,Mathematics,Grade_03,,,Common Core State Standards,2010,http://www.corestandards.org/assets/CCSSI_Math%20Standards.pdf
CCSS.Math.Content.3.G.A.2,Partition shapes into parts with equal areas. Express the area of each part as a unit fraction of the whole.,Mathematics,Grade_03,,,Common Core State Standards,2010,http://www.corestandards.org/assets/CCSSI_Math%20Standards.pdf
CCSS.Math.Content.3.G.A.1,"Understand that shapes in different categories (e.g., rhombuses, rectangles, and others) may share attributes (e.g., having four sides), and that the shared attributes can define a larger category (e.g., quadrilaterals). Recognize rhombuses, rectangles, and squares as examples of quadrilaterals, and draw examples of quadrilaterals that do not belong to any of these subcategories.",Mathematics,Grade_03,,,Common Core State Standards,2010,http://www.corestandards.org/assets/CCSSI_Math%20Standards.pdf
CCSS.Math.Content.3.G.A,Reason with shapes and their attributes.,Mathematics,Grade_03,,,Common Core State Standards,2010,http://www.corestandards.org/assets/CCSSI_Math%20Standards.pdf
D080CA30DFE401311CEC68A86D17958E,Geometry,Mathematics,Grade_03,,,Common Core State Standards,2010,http://www.corestandards.org/assets/CCSSI_Math%20Standards.pdf
CCSS.Math.Content.3.MD.D.8,"Solve real world and mathematical problems involving perimeters of polygons, including finding the perimeter given the side lengths, finding an unknown side length, and exhibiting rectangles with the same perimeter and different areas or with the same area and different perimeters.",Mathematics,Grade_03,,,Common Core State Standards,2010,http://www.corestandards.org/assets/CCSSI_Math%20Standards.pdf
CCSS.Math.Content.3.MD.D,Geometric measurement: recognize perimeter as an attribute of plane figures and distinguish between linear and area measures.,Mathematics,Grade_03,,,Common Core State Standards,2010,http://www.corestandards.org/assets/CCSSI_Math%20Standards.pdf
CCSS.Math.Content.3.MD.C.7d,"Recognize area as additive. Find areas of rectilinear figures by decomposing them into non-overlapping rectangles and adding the areas of the non-overlapping parts, applying this technique to solve real world problems.",Mathematics,Grade_03,,,Common Core State Standards,2010,http://www.corestandards.org/assets/CCSSI_Math%20Standards.pdf
CCSS.Math.Content.3.MD.C.7c,Use tiling to show in a concrete case that the area of a rectangle with whole-number side lengths a and b + c is the sum of a × b and a × c. Use area models to represent the distributive property in mathematical reasoning.,Mathematics,Grade_03,,,Common Core State Standards,2010,http://www.corestandards.org/assets/CCSSI_Math%20Standards.pdf
CCSS.Math.Content.3.MD.C.7b,"Multiply side lengths to find areas of rectangles with whole-number side lengths in the context of solving real world and mathematical problems, and represent whole-number products as rectangular areas in mathematical reasoning.",Mathematics,Grade_03,,,Common Core State Standards,2010,http://www.corestandards.org/assets/CCSSI_Math%20Standards.pdf
CCSS.Math.Content.3.MD.C.7a,"Find the area of a rectangle with whole-number side lengths by tiling it, and show that the area is the same as would be found by multiplying the side lengths.",Mathematics,Grade_03,,,Common Core State Standards,2010,http://www.corestandards.org/assets/CCSSI_Math%20Standards.pdf
CCSS.Math.Content.3.MD.C.7,Relate area to the operations of multiplication and addition.,Mathematics,Grade_03,,,Common Core State Standards,2010,http://www.corestandards.org/assets/CCSSI_Math%20Standards.pdf
CCSS.Math.Content.3.MD.C.6,"Measure areas by counting unit squares (square cm, square m, square in, square ft, and improvised units).",Mathematics,Grade_03,,,Common Core State Standards,2010,http://www.corestandards.org/assets/CCSSI_Math%20Standards.pdf
CCSS.Math.Content.3.MD.C.5b,A plane figure which can be covered without gaps or overlaps by n unit squares is said to have an area of n square units.,Mathematics,Grade_03,,,Common Core State Standards,2010,http://www.corestandards.org/assets/CCSSI_Math%20Standards.pdf
CCSS.Math.Content.3.MD.C.5a,"A square with side length 1 unit, called ""a unit square,"" is said to have ""one square unit"" of area, and can be used to measure area.",Mathematics,Grade_03,,,Common Core State Standards,2010,http://www.corestandards.org/assets/CCSSI_Math%20Standards.pdf
CCSS.Math.Content.3.MD.C.5,Recognize area as an attribute of plane figures and understand concepts of area measurement.,Mathematics,Grade_03,,,Common Core State Standards,2010,http://www.corestandards.org/assets/CCSSI_Math%20Standards.pdf
CCSS.Math.Content.3.MD.C,Geometric measurement: understand concepts of area and relate area to multiplication and to addition.,Mathematics,Grade_03,,,Common Core State Standards,2010,http://www.corestandards.org/assets/CCSSI_Math%20Standards.pdf
CCSS.Math.Content.3.MD.B.4,"Generate measurement data by measuring lengths using rulers marked with halves and fourths of an inch. Show the data by making a line plot, where the horizontal scale is marked off in appropriate units— whole numbers, halves, or quarters.",Mathematics,Grade_03,,,Common Core State Standards,2010,http://www.corestandards.org/assets/CCSSI_Math%20Standards.pdf
CCSS.Math.Content.3.MD.B.3,"Draw a scaled picture graph and a scaled bar graph to represent a data set with several categories. Solve one- and two-step ""how many more"" and ""how many less"" problems using information presented in scaled bar graphs.",Mathematics,Grade_03,,,Common Core State Standards,2010,http://www.corestandards.org/assets/CCSSI_Math%20Standards.pdf
CCSS.Math.Content.3.MD.B,Represent and interpret data.,Mathematics,Grade_03,,,Common Core State Standards,2010,http://www.corestandards.org/assets/CCSSI_Math%20Standards.pdf
CCSS.Math.Content.3.MD.A.2,"Measure and estimate liquid volumes and masses of objects using standard units of grams (g), kilograms (kg), and liters (l). Add, subtract, multiply, or divide to solve one-step word problems involving masses or volumes that are given in the same units, e.g., by using drawings (such as a beaker with a measurement scale) to represent the problem.",Mathematics,Grade_03,,,Common Core State Standards,2010,http://www.corestandards.org/assets/CCSSI_Math%20Standards.pdf
CCSS.Math.Content.3.MD.A.1,"Tell and write time to the nearest minute and measure time intervals in minutes. Solve word problems involving addition and subtraction of time intervals in minutes, e.g., by representing the problem on a number line diagram.",Mathematics,Grade_03,,,Common Core State Standards,2010,http://www.corestandards.org/assets/CCSSI_Math%20Standards.pdf
CCSS.Math.Content.3.MD.A,"Solve problems involving measurement and estimation of intervals of time, liquid volumes, and masses of objects.",Mathematics,Grade_03,,,Common Core State Standards,2010,http://www.corestandards.org/assets/CCSSI_Math%20Standards.pdf
D0791970DFE401311CEB68A86D17958E,Measurement and Data,Mathematics,Grade_03,,,Common Core State Standards,2010,http://www.corestandards.org/assets/CCSSI_Math%20Standards.pdf
